root@lamp-ubuntu-s-1vcpu-1gb-tor1-01:~# apt-get install tcpdump
Reading package lists... Done
Building dependency tree
Reading state information... Done
tcpdump is already the newest version (4.9.3-4ubuntu0.1).
tcpdump set to manually installed.
0 upgraded, 0 newly installed, 0 to remove and 28 not upgraded.
root@lamp-ubuntu-s-1vcpu-1gb-tor1-01:~# tcpdump -i eth0
tcpdump: verbose output suppressed, use -v or -vv for full protocol decode
listening on eth0, link-type EN10MB (Ethernet), capture size 262144 bytes
19:34:45.537399 IP lamp-ubuntu-s-1vcpu-1gb-tor1-01.ssh > 198.96.87.75.51610: Flags [P.], seq 2945082775:2945082883, ack 2599919301, win 501, length 108
19:34:45.537524 IP lamp-ubuntu-s-1vcpu-1gb-tor1-01.ssh > 198.96.87.75.51610: Flags [P.], seq 108:144, ack 1, win 501, length 36
19:34:45.537663 IP lamp-ubuntu-s-1vcpu-1gb-tor1-01.ssh > 198.96.87.75.51610: Flags [P.], seq 144:252, ack 1, win 501, length 108
19:34:45.537914 IP lamp-ubuntu-s-1vcpu-1gb-tor1-01.ssh > 198.96.87.75.51610: Flags [P.], seq 252:288, ack 1, win 501, length 36
19:34:45.539255 IP lamp-ubuntu-s-1vcpu-1gb-tor1-01.45813 > 67.207.67.2.domain: 34404+ [1au] PTR? 75.87.96.198.in-addr.arpa. (54)
19:34:45.539322 IP lamp-ubuntu-s-1vcpu-1gb-tor1-01.42484 > 67.207.67.2.domain: 52929+ [1au] PTR? 75.87.96.198.in-addr.arpa. (54)
19:34:45.539382 IP lamp-ubuntu-s-1vcpu-1gb-tor1-01.51639 > 67.207.67.2.domain: 43182+ [1au] PTR? 75.87.96.198.in-addr.arpa. (54)
19:34:45.545369 IP 67.207.67.2.domain > lamp-ubuntu-s-1vcpu-1gb-tor1-01.45813: 34404 NXDomain 0/1/1 (119)
19:34:45.545370 IP 67.207.67.2.domain > lamp-ubuntu-s-1vcpu-1gb-tor1-01.51639: 43182 NXDomain 0/1/1 (119)
19:34:45.545621 IP lamp-ubuntu-s-1vcpu-1gb-tor1-01.45813 > 67.207.67.2.domain: 34404+ PTR? 75.87.96.198.in-addr.arpa. (43)
19:34:45.545685 IP lamp-ubuntu-s-1vcpu-1gb-tor1-01.51639 > 67.207.67.2.domain: 43182+ PTR? 75.87.96.198.in-addr.arpa. (43)
19:34:45.546354 IP 67.207.67.2.domain > lamp-ubuntu-s-1vcpu-1gb-tor1-01.45813: 34404 NXDomain 0/1/0 (108)
19:34:45.546834 IP 198.96.87.75.51610 > lamp-ubuntu-s-1vcpu-1gb-tor1-01.ssh: Flags [.], ack 288, win 509, length 0
19:34:45.598159 IP 67.207.67.2.domain > lamp-ubuntu-s-1vcpu-1gb-tor1-01.51639: 43182 NXDomain 0/1/0 (108)
19:34:45.598213 IP 67.207.67.2.domain > lamp-ubuntu-s-1vcpu-1gb-tor1-01.42484: 52929 NXDomain 0/1/1 (119)
19:34:45.598405 IP lamp-ubuntu-s-1vcpu-1gb-tor1-01.42484 > 67.207.67.2.domain: 52929+ PTR? 75.87.96.198.in-addr.arpa. (43)
19:34:45.599210 IP 67.207.67.2.domain > lamp-ubuntu-s-1vcpu-1gb-tor1-01.42484: 52929 NXDomain 0/1/0 (108)
19:34:45.599900 IP lamp-ubuntu-s-1vcpu-1gb-tor1-01.51092 > 67.207.67.2.domain: 49671+ [1au] PTR? 21.12.203.159.in-addr.arpa. (55)
19:34:45.599970 IP lamp-ubuntu-s-1vcpu-1gb-tor1-01.42365 > 67.207.67.2.domain: 34505+ [1au] PTR? 21.12.203.159.in-addr.arpa. (55)
19:34:45.600029 IP lamp-ubuntu-s-1vcpu-1gb-tor1-01.53534 > 67.207.67.2.domain: 58026+ [1au] PTR? 21.12.203.159.in-addr.arpa. (55)
19:34:45.728804 IP 67.207.67.2.domain > lamp-ubuntu-s-1vcpu-1gb-tor1-01.51092: 49671 NXDomain 0/1/1 (122)
19:34:45.729045 IP lamp-ubuntu-s-1vcpu-1gb-tor1-01.51092 > 67.207.67.2.domain: 49671+ PTR? 21.12.203.159.in-addr.arpa. (44)
19:34:45.737166 IP 67.207.67.2.domain > lamp-ubuntu-s-1vcpu-1gb-tor1-01.42365: 34505 NXDomain 0/1/1 (122)
19:34:45.737166 IP 67.207.67.2.domain > lamp-ubuntu-s-1vcpu-1gb-tor1-01.53534: 58026 NXDomain 0/1/1 (122)
19:34:45.737353 IP lamp-ubuntu-s-1vcpu-1gb-tor1-01.42365 > 67.207.67.2.domain: 34505+ PTR? 21.12.203.159.in-addr.arpa. (44)
19:34:45.737436 IP lamp-ubuntu-s-1vcpu-1gb-tor1-01.53534 > 67.207.67.2.domain: 58026+ PTR? 21.12.203.159.in-addr.arpa. (44)
19:34:45.811624 IP 67.207.67.2.domain > lamp-ubuntu-s-1vcpu-1gb-tor1-01.51092: 49671 NXDomain 0/1/0 (111)
19:34:45.811672 IP 67.207.67.2.domain > lamp-ubuntu-s-1vcpu-1gb-tor1-01.53534: 58026 NXDomain 0/1/0 (111)
19:34:45.818700 IP 67.207.67.2.domain > lamp-ubuntu-s-1vcpu-1gb-tor1-01.42365: 34505 NXDomain 0/1/0 (111)
19:34:45.819444 IP lamp-ubuntu-s-1vcpu-1gb-tor1-01.ssh > 198.96.87.75.51610: Flags [P.], seq 288:868, ack 1, win 501, length 580
19:34:45.819743 IP lamp-ubuntu-s-1vcpu-1gb-tor1-01.36839 > 67.207.67.2.domain: 15767+ [1au] PTR? 2.67.207.67.in-addr.arpa. (53)
19:34:45.819832 IP lamp-ubuntu-s-1vcpu-1gb-tor1-01.48391 > 67.207.67.2.domain: 63701+ [1au] PTR? 2.67.207.67.in-addr.arpa. (53)
19:34:45.819896 IP lamp-ubuntu-s-1vcpu-1gb-tor1-01.59069 > 67.207.67.2.domain: 24070+ [1au] PTR? 2.67.207.67.in-addr.arpa. (53)
19:34:45.820095 IP 67.207.67.2.domain > lamp-ubuntu-s-1vcpu-1gb-tor1-01.36839: 15767 NXDomain 0/1/1 (120)
19:34:45.820148 IP 67.207.67.2.domain > lamp-ubuntu-s-1vcpu-1gb-tor1-01.59069: 24070 NXDomain 0/1/1 (120)
19:34:45.820196 IP 67.207.67.2.domain > lamp-ubuntu-s-1vcpu-1gb-tor1-01.48391: 63701 NXDomain 0/1/1 (120)
19:34:45.886146 IP lamp-ubuntu-s-1vcpu-1gb-tor1-01.ssh > 198.96.87.75.51610: Flags [P.], seq 868:3468, ack 1, win 501, length 2600
19:34:45.886203 IP lamp-ubuntu-s-1vcpu-1gb-tor1-01.ssh > 198.96.87.75.51610: Flags [P.], seq 3468:4672, ack 1, win 501, length 1204
19:34:45.886289 IP lamp-ubuntu-s-1vcpu-1gb-tor1-01.ssh > 198.96.87.75.51610: Flags [P.], seq 4672:4972, ack 1, win 501, length 300
19:34:45.886341 IP lamp-ubuntu-s-1vcpu-1gb-tor1-01.ssh > 198.96.87.75.51610: Flags [P.], seq 4972:5144, ack 1, win 501, length 172
19:34:45.886392 IP lamp-ubuntu-s-1vcpu-1gb-tor1-01.ssh > 198.96.87.75.51610: Flags [P.], seq 5144:5316, ack 1, win 501, length 172
19:34:45.886439 IP lamp-ubuntu-s-1vcpu-1gb-tor1-01.ssh > 198.96.87.75.51610: Flags [P.], seq 5316:5488, ack 1, win 501, length 172
19:34:45.886515 IP lamp-ubuntu-s-1vcpu-1gb-tor1-01.ssh > 198.96.87.75.51610: Flags [P.], seq 5488:5660, ack 1, win 501, length 172
19:34:45.886570 IP lamp-ubuntu-s-1vcpu-1gb-tor1-01.ssh > 198.96.87.75.51610: Flags [P.], seq 5660:5832, ack 1, win 501, length 172
19:34:45.894560 IP 198.96.87.75.51610 > lamp-ubuntu-s-1vcpu-1gb-tor1-01.ssh: Flags [.], ack 5832, win 512, length 0
19:34:45.894622 IP lamp-ubuntu-s-1vcpu-1gb-tor1-01.ssh > 198.96.87.75.51610: Flags [P.], seq 5832:6004, ack 1, win 501, length 172
19:34:45.894792 IP lamp-ubuntu-s-1vcpu-1gb-tor1-01.ssh > 198.96.87.75.51610: Flags [P.], seq 6004:6288, ack 1, win 501, length 284
19:34:45.894844 IP lamp-ubuntu-s-1vcpu-1gb-tor1-01.ssh > 198.96.87.75.51610: Flags [P.], seq 6288:6460, ack 1, win 501, length 172
19:34:45.894888 IP lamp-ubuntu-s-1vcpu-1gb-tor1-01.ssh > 198.96.87.75.51610: Flags [P.], seq 6460:6632, ack 1, win 501, length 172
19:34:45.894948 IP lamp-ubuntu-s-1vcpu-1gb-tor1-01.ssh > 198.96.87.75.51610: Flags [P.], seq 6632:6804, ack 1, win 501, length 172
19:34:45.894992 IP lamp-ubuntu-s-1vcpu-1gb-tor1-01.ssh > 198.96.87.75.51610: Flags [P.], seq 6804:6976, ack 1, win 501, length 172
19:34:45.895032 IP lamp-ubuntu-s-1vcpu-1gb-tor1-01.ssh > 198.96.87.75.51610: Flags [P.], seq 6976:7140, ack 1, win 501, length 164
19:34:45.895067 IP lamp-ubuntu-s-1vcpu-1gb-tor1-01.ssh > 198.96.87.75.51610: Flags [P.], seq 7140:7176, ack 1, win 501, length 36
19:34:45.895101 IP lamp-ubuntu-s-1vcpu-1gb-tor1-01.ssh > 198.96.87.75.51610: Flags [P.], seq 7176:7340, ack 1, win 501, length 164
19:34:45.895136 IP lamp-ubuntu-s-1vcpu-1gb-tor1-01.ssh > 198.96.87.75.51610: Flags [P.], seq 7340:7376, ack 1, win 501, length 36
19:34:45.895170 IP lamp-ubuntu-s-1vcpu-1gb-tor1-01.ssh > 198.96.87.75.51610: Flags [P.], seq 7376:7540, ack 1, win 501, length 164
19:34:45.895222 IP lamp-ubuntu-s-1vcpu-1gb-tor1-01.ssh > 198.96.87.75.51610: Flags [P.], seq 7540:7740, ack 1, win 501, length 200
19:34:45.895277 IP lamp-ubuntu-s-1vcpu-1gb-tor1-01.ssh > 198.96.87.75.51610: Flags [P.], seq 7740:7776, ack 1, win 501, length 36
19:34:45.895305 IP lamp-ubuntu-s-1vcpu-1gb-tor1-01.ssh > 198.96.87.75.51610: Flags [P.], seq 7776:7940, ack 1, win 501, length 164
19:34:45.895405 IP lamp-ubuntu-s-1vcpu-1gb-tor1-01.ssh > 198.96.87.75.51610: Flags [P.], seq 7940:8176, ack 1, win 501, length 236
19:34:45.895449 IP lamp-ubuntu-s-1vcpu-1gb-tor1-01.ssh > 198.96.87.75.51610: Flags [P.], seq 8176:8340, ack 1, win 501, length 164
19:34:45.895512 IP lamp-ubuntu-s-1vcpu-1gb-tor1-01.ssh > 198.96.87.75.51610: Flags [P.], seq 8340:8540, ack 1, win 501, length 200
19:34:45.895562 IP lamp-ubuntu-s-1vcpu-1gb-tor1-01.ssh > 198.96.87.75.51610: Flags [P.], seq 8540:8576, ack 1, win 501, length 36
19:34:45.895608 IP lamp-ubuntu-s-1vcpu-1gb-tor1-01.ssh > 198.96.87.75.51610: Flags [P.], seq 8576:8740, ack 1, win 501, length 164
19:34:45.895660 IP lamp-ubuntu-s-1vcpu-1gb-tor1-01.ssh > 198.96.87.75.51610: Flags [P.], seq 8740:8776, ack 1, win 501, length 36
19:34:45.910127 IP 198.96.87.75.51610 > lamp-ubuntu-s-1vcpu-1gb-tor1-01.ssh: Flags [.], ack 8776, win 512, length 0
19:34:45.910226 IP lamp-ubuntu-s-1vcpu-1gb-tor1-01.ssh > 198.96.87.75.51610: Flags [P.], seq 8776:9740, ack 1, win 501, length 964
19:34:45.910320 IP lamp-ubuntu-s-1vcpu-1gb-tor1-01.ssh > 198.96.87.75.51610: Flags [P.], seq 9740:9976, ack 1, win 501, length 236
19:34:45.910443 IP lamp-ubuntu-s-1vcpu-1gb-tor1-01.ssh > 198.96.87.75.51610: Flags [P.], seq 9976:10132, ack 1, win 501, length 156
19:34:45.910505 IP lamp-ubuntu-s-1vcpu-1gb-tor1-01.ssh > 198.96.87.75.51610: Flags [P.], seq 10132:10168, ack 1, win 501, length 36
19:34:45.910545 IP lamp-ubuntu-s-1vcpu-1gb-tor1-01.ssh > 198.96.87.75.51610: Flags [P.], seq 10168:10332, ack 1, win 501, length 164
19:34:45.910592 IP lamp-ubuntu-s-1vcpu-1gb-tor1-01.ssh > 198.96.87.75.51610: Flags [P.], seq 10332:10368, ack 1, win 501, length 36
19:34:45.910636 IP lamp-ubuntu-s-1vcpu-1gb-tor1-01.ssh > 198.96.87.75.51610: Flags [P.], seq 10368:10532, ack 1, win 501, length 164
19:34:45.910704 IP lamp-ubuntu-s-1vcpu-1gb-tor1-01.ssh > 198.96.87.75.51610: Flags [P.], seq 10532:10740, ack 1, win 501, length 208
19:34:45.910788 IP lamp-ubuntu-s-1vcpu-1gb-tor1-01.ssh > 198.96.87.75.51610: Flags [P.], seq 10740:10984, ack 1, win 501, length 244
19:34:45.910834 IP lamp-ubuntu-s-1vcpu-1gb-tor1-01.ssh > 198.96.87.75.51610: Flags [P.], seq 10984:11156, ack 1, win 501, length 172
19:34:45.910876 IP lamp-ubuntu-s-1vcpu-1gb-tor1-01.ssh > 198.96.87.75.51610: Flags [P.], seq 11156:11192, ack 1, win 501, length 36
19:34:45.910912 IP lamp-ubuntu-s-1vcpu-1gb-tor1-01.ssh > 198.96.87.75.51610: Flags [P.], seq 11192:11364, ack 1, win 501, length 172
19:34:45.910954 IP lamp-ubuntu-s-1vcpu-1gb-tor1-01.ssh > 198.96.87.75.51610: Flags [P.], seq 11364:11400, ack 1, win 501, length 36
19:34:45.911000 IP lamp-ubuntu-s-1vcpu-1gb-tor1-01.ssh > 198.96.87.75.51610: Flags [P.], seq 11400:11572, ack 1, win 501, length 172
19:34:45.911042 IP lamp-ubuntu-s-1vcpu-1gb-tor1-01.ssh > 198.96.87.75.51610: Flags [P.], seq 11572:11608, ack 1, win 501, length 36
19:34:45.911084 IP lamp-ubuntu-s-1vcpu-1gb-tor1-01.ssh > 198.96.87.75.51610: Flags [P.], seq 11608:11780, ack 1, win 501, length 172
19:34:45.911126 IP lamp-ubuntu-s-1vcpu-1gb-tor1-01.ssh > 198.96.87.75.51610: Flags [P.], seq 11780:11816, ack 1, win 501, length 36
19:34:45.911168 IP lamp-ubuntu-s-1vcpu-1gb-tor1-01.ssh > 198.96.87.75.51610: Flags [P.], seq 11816:11988, ack 1, win 501, length 172
19:34:45.911209 IP lamp-ubuntu-s-1vcpu-1gb-tor1-01.ssh > 198.96.87.75.51610: Flags [P.], seq 11988:12024, ack 1, win 501, length 36
19:34:45.911251 IP lamp-ubuntu-s-1vcpu-1gb-tor1-01.ssh > 198.96.87.75.51610: Flags [P.], seq 12024:12196, ack 1, win 501, length 172
19:34:45.911293 IP lamp-ubuntu-s-1vcpu-1gb-tor1-01.ssh > 198.96.87.75.51610: Flags [P.], seq 12196:12232, ack 1, win 501, length 36
19:34:45.911342 IP lamp-ubuntu-s-1vcpu-1gb-tor1-01.ssh > 198.96.87.75.51610: Flags [P.], seq 12232:12404, ack 1, win 501, length 172
19:34:45.911383 IP lamp-ubuntu-s-1vcpu-1gb-tor1-01.ssh > 198.96.87.75.51610: Flags [P.], seq 12404:12440, ack 1, win 501, length 36
19:34:45.911427 IP lamp-ubuntu-s-1vcpu-1gb-tor1-01.ssh > 198.96.87.75.51610: Flags [P.], seq 12440:12612, ack 1, win 501, length 172
19:34:45.911469 IP lamp-ubuntu-s-1vcpu-1gb-tor1-01.ssh > 198.96.87.75.51610: Flags [P.], seq 12612:12648, ack 1, win 501, length 36
19:34:45.911516 IP lamp-ubuntu-s-1vcpu-1gb-tor1-01.ssh > 198.96.87.75.51610: Flags [P.], seq 12648:12820, ack 1, win 501, length 172
19:34:45.911558 IP lamp-ubuntu-s-1vcpu-1gb-tor1-01.ssh > 198.96.87.75.51610: Flags [P.], seq 12820:12856, ack 1, win 501, length 36
19:34:45.911601 IP lamp-ubuntu-s-1vcpu-1gb-tor1-01.ssh > 198.96.87.75.51610: Flags [P.], seq 12856:13028, ack 1, win 501, length 172
19:34:45.911643 IP lamp-ubuntu-s-1vcpu-1gb-tor1-01.ssh > 198.96.87.75.51610: Flags [P.], seq 13028:13064, ack 1, win 501, length 36
19:34:45.911690 IP lamp-ubuntu-s-1vcpu-1gb-tor1-01.ssh > 198.96.87.75.51610: Flags [P.], seq 13064:13236, ack 1, win 501, length 172
19:34:45.911731 IP lamp-ubuntu-s-1vcpu-1gb-tor1-01.ssh > 198.96.87.75.51610: Flags [P.], seq 13236:13272, ack 1, win 501, length 36
19:34:45.911774 IP lamp-ubuntu-s-1vcpu-1gb-tor1-01.ssh > 198.96.87.75.51610: Flags [P.], seq 13272:13444, ack 1, win 501, length 172
19:34:45.911816 IP lamp-ubuntu-s-1vcpu-1gb-tor1-01.ssh > 198.96.87.75.51610: Flags [P.], seq 13444:13480, ack 1, win 501, length 36
19:34:45.911857 IP lamp-ubuntu-s-1vcpu-1gb-tor1-01.ssh > 198.96.87.75.51610: Flags [P.], seq 13480:13652, ack 1, win 501, length 172
19:34:45.911899 IP lamp-ubuntu-s-1vcpu-1gb-tor1-01.ssh > 198.96.87.75.51610: Flags [P.], seq 13652:13688, ack 1, win 501, length 36
19:34:45.911944 IP lamp-ubuntu-s-1vcpu-1gb-tor1-01.ssh > 198.96.87.75.51610: Flags [P.], seq 13688:13860, ack 1, win 501, length 172
19:34:45.911985 IP lamp-ubuntu-s-1vcpu-1gb-tor1-01.ssh > 198.96.87.75.51610: Flags [P.], seq 13860:13896, ack 1, win 501, length 36
19:34:45.912032 IP lamp-ubuntu-s-1vcpu-1gb-tor1-01.ssh > 198.96.87.75.51610: Flags [P.], seq 13896:14068, ack 1, win 501, length 172
19:34:45.912076 IP lamp-ubuntu-s-1vcpu-1gb-tor1-01.ssh > 198.96.87.75.51610: Flags [P.], seq 14068:14104, ack 1, win 501, length 36
19:34:45.912117 IP lamp-ubuntu-s-1vcpu-1gb-tor1-01.ssh > 198.96.87.75.51610: Flags [P.], seq 14104:14276, ack 1, win 501, length 172
19:34:45.919861 IP 198.96.87.75.51610 > lamp-ubuntu-s-1vcpu-1gb-tor1-01.ssh: Flags [.], ack 13444, win 512, length 0
19:34:45.919937 IP lamp-ubuntu-s-1vcpu-1gb-tor1-01.ssh > 198.96.87.75.51610: Flags [P.], seq 14276:18472, ack 1, win 501, length 4196
19:34:45.920019 IP 198.96.87.75.51610 > lamp-ubuntu-s-1vcpu-1gb-tor1-01.ssh: Flags [.], ack 14276, win 509, length 0
19:34:45.920093 IP lamp-ubuntu-s-1vcpu-1gb-tor1-01.ssh > 198.96.87.75.51610: Flags [P.], seq 18472:18628, ack 1, win 501, length 156
19:34:45.920174 IP lamp-ubuntu-s-1vcpu-1gb-tor1-01.ssh > 198.96.87.75.51610: Flags [P.], seq 18628:18664, ack 1, win 501, length 36
19:34:45.920195 IP lamp-ubuntu-s-1vcpu-1gb-tor1-01.ssh > 198.96.87.75.51610: Flags [P.], seq 18664:18836, ack 1, win 501, length 172
19:34:45.920243 IP lamp-ubuntu-s-1vcpu-1gb-tor1-01.ssh > 198.96.87.75.51610: Flags [P.], seq 18836:18872, ack 1, win 501, length 36
19:34:45.920261 IP lamp-ubuntu-s-1vcpu-1gb-tor1-01.ssh > 198.96.87.75.51610: Flags [P.], seq 18872:19028, ack 1, win 501, length 156
19:34:45.920303 IP lamp-ubuntu-s-1vcpu-1gb-tor1-01.ssh > 198.96.87.75.51610: Flags [P.], seq 19028:19064, ack 1, win 501, length 36
19:34:45.920331 IP lamp-ubuntu-s-1vcpu-1gb-tor1-01.ssh > 198.96.87.75.51610: Flags [P.], seq 19064:19236, ack 1, win 501, length 172
19:34:45.920366 IP lamp-ubuntu-s-1vcpu-1gb-tor1-01.ssh > 198.96.87.75.51610: Flags [P.], seq 19236:19272, ack 1, win 501, length 36
19:34:45.920390 IP lamp-ubuntu-s-1vcpu-1gb-tor1-01.ssh > 198.96.87.75.51610: Flags [P.], seq 19272:19444, ack 1, win 501, length 172
19:34:45.920440 IP lamp-ubuntu-s-1vcpu-1gb-tor1-01.ssh > 198.96.87.75.51610: Flags [P.], seq 19444:19652, ack 1, win 501, length 208
19:34:45.920491 IP lamp-ubuntu-s-1vcpu-1gb-tor1-01.ssh > 198.96.87.75.51610: Flags [P.], seq 19652:19688, ack 1, win 501, length 36
19:34:45.920533 IP lamp-ubuntu-s-1vcpu-1gb-tor1-01.ssh > 198.96.87.75.51610: Flags [P.], seq 19688:19860, ack 1, win 501, length 172
19:34:45.920574 IP lamp-ubuntu-s-1vcpu-1gb-tor1-01.ssh > 198.96.87.75.51610: Flags [P.], seq 19860:19896, ack 1, win 501, length 36
19:34:45.920617 IP lamp-ubuntu-s-1vcpu-1gb-tor1-01.ssh > 198.96.87.75.51610: Flags [P.], seq 19896:20068, ack 1, win 501, length 172
19:34:45.920771 IP lamp-ubuntu-s-1vcpu-1gb-tor1-01.ssh > 198.96.87.75.51610: Flags [P.], seq 20068:20104, ack 1, win 501, length 36
19:34:45.920819 IP lamp-ubuntu-s-1vcpu-1gb-tor1-01.ssh > 198.96.87.75.51610: Flags [P.], seq 20104:20276, ack 1, win 501, length 172
19:34:45.920866 IP lamp-ubuntu-s-1vcpu-1gb-tor1-01.ssh > 198.96.87.75.51610: Flags [P.], seq 20276:20312, ack 1, win 501, length 36
19:34:45.920914 IP lamp-ubuntu-s-1vcpu-1gb-tor1-01.ssh > 198.96.87.75.51610: Flags [P.], seq 20312:20484, ack 1, win 501, length 172
19:34:45.920968 IP lamp-ubuntu-s-1vcpu-1gb-tor1-01.ssh > 198.96.87.75.51610: Flags [P.], seq 20484:20520, ack 1, win 501, length 36
19:34:45.920994 IP lamp-ubuntu-s-1vcpu-1gb-tor1-01.ssh > 198.96.87.75.51610: Flags [P.], seq 20520:20692, ack 1, win 501, length 172
19:34:45.921031 IP lamp-ubuntu-s-1vcpu-1gb-tor1-01.ssh > 198.96.87.75.51610: Flags [P.], seq 20692:20728, ack 1, win 501, length 36
19:34:45.921060 IP lamp-ubuntu-s-1vcpu-1gb-tor1-01.ssh > 198.96.87.75.51610: Flags [P.], seq 20728:20900, ack 1, win 501, length 172
19:34:45.921093 IP lamp-ubuntu-s-1vcpu-1gb-tor1-01.ssh > 198.96.87.75.51610: Flags [P.], seq 20900:20936, ack 1, win 501, length 36
19:34:45.921125 IP lamp-ubuntu-s-1vcpu-1gb-tor1-01.ssh > 198.96.87.75.51610: Flags [P.], seq 20936:21108, ack 1, win 501, length 172
19:34:45.921162 IP lamp-ubuntu-s-1vcpu-1gb-tor1-01.ssh > 198.96.87.75.51610: Flags [P.], seq 21108:21144, ack 1, win 501, length 36
19:34:45.921191 IP lamp-ubuntu-s-1vcpu-1gb-tor1-01.ssh > 198.96.87.75.51610: Flags [P.], seq 21144:21316, ack 1, win 501, length 172
19:34:45.921223 IP lamp-ubuntu-s-1vcpu-1gb-tor1-01.ssh > 198.96.87.75.51610: Flags [P.], seq 21316:21352, ack 1, win 501, length 36
19:34:45.921255 IP lamp-ubuntu-s-1vcpu-1gb-tor1-01.ssh > 198.96.87.75.51610: Flags [P.], seq 21352:21524, ack 1, win 501, length 172
19:34:45.921293 IP lamp-ubuntu-s-1vcpu-1gb-tor1-01.ssh > 198.96.87.75.51610: Flags [P.], seq 21524:21560, ack 1, win 501, length 36
19:34:45.921323 IP lamp-ubuntu-s-1vcpu-1gb-tor1-01.ssh > 198.96.87.75.51610: Flags [P.], seq 21560:21732, ack 1, win 501, length 172
19:34:45.921361 IP lamp-ubuntu-s-1vcpu-1gb-tor1-01.ssh > 198.96.87.75.51610: Flags [P.], seq 21732:21768, ack 1, win 501, length 36
19:34:45.921392 IP lamp-ubuntu-s-1vcpu-1gb-tor1-01.ssh > 198.96.87.75.51610: Flags [P.], seq 21768:21940, ack 1, win 501, length 172
19:34:45.921428 IP lamp-ubuntu-s-1vcpu-1gb-tor1-01.ssh > 198.96.87.75.51610: Flags [P.], seq 21940:21976, ack 1, win 501, length 36
19:34:45.921458 IP lamp-ubuntu-s-1vcpu-1gb-tor1-01.ssh > 198.96.87.75.51610: Flags [P.], seq 21976:22148, ack 1, win 501, length 172
19:34:45.921489 IP lamp-ubuntu-s-1vcpu-1gb-tor1-01.ssh > 198.96.87.75.51610: Flags [P.], seq 22148:22184, ack 1, win 501, length 36
19:34:45.921521 IP lamp-ubuntu-s-1vcpu-1gb-tor1-01.ssh > 198.96.87.75.51610: Flags [P.], seq 22184:22356, ack 1, win 501, length 172
19:34:45.921560 IP lamp-ubuntu-s-1vcpu-1gb-tor1-01.ssh > 198.96.87.75.51610: Flags [P.], seq 22356:22392, ack 1, win 501, length 36
19:34:45.921598 IP lamp-ubuntu-s-1vcpu-1gb-tor1-01.ssh > 198.96.87.75.51610: Flags [P.], seq 22392:22564, ack 1, win 501, length 172
19:34:45.921639 IP lamp-ubuntu-s-1vcpu-1gb-tor1-01.ssh > 198.96.87.75.51610: Flags [P.], seq 22564:22600, ack 1, win 501, length 36
19:34:45.921682 IP lamp-ubuntu-s-1vcpu-1gb-tor1-01.ssh > 198.96.87.75.51610: Flags [P.], seq 22600:22772, ack 1, win 501, length 172
19:34:45.921719 IP lamp-ubuntu-s-1vcpu-1gb-tor1-01.ssh > 198.96.87.75.51610: Flags [P.], seq 22772:22808, ack 1, win 501, length 36
19:34:45.921748 IP lamp-ubuntu-s-1vcpu-1gb-tor1-01.ssh > 198.96.87.75.51610: Flags [P.], seq 22808:22980, ack 1, win 501, length 172
19:34:45.921781 IP lamp-ubuntu-s-1vcpu-1gb-tor1-01.ssh > 198.96.87.75.51610: Flags [P.], seq 22980:23016, ack 1, win 501, length 36
19:34:45.921813 IP lamp-ubuntu-s-1vcpu-1gb-tor1-01.ssh > 198.96.87.75.51610: Flags [P.], seq 23016:23188, ack 1, win 501, length 172
19:34:45.921852 IP lamp-ubuntu-s-1vcpu-1gb-tor1-01.ssh > 198.96.87.75.51610: Flags [P.], seq 23188:23224, ack 1, win 501, length 36
19:34:45.921884 IP lamp-ubuntu-s-1vcpu-1gb-tor1-01.ssh > 198.96.87.75.51610: Flags [P.], seq 23224:23396, ack 1, win 501, length 172
19:34:45.921922 IP lamp-ubuntu-s-1vcpu-1gb-tor1-01.ssh > 198.96.87.75.51610: Flags [P.], seq 23396:23432, ack 1, win 501, length 36
19:34:45.921950 IP lamp-ubuntu-s-1vcpu-1gb-tor1-01.ssh > 198.96.87.75.51610: Flags [P.], seq 23432:23604, ack 1, win 501, length 172
19:34:45.921982 IP lamp-ubuntu-s-1vcpu-1gb-tor1-01.ssh > 198.96.87.75.51610: Flags [P.], seq 23604:23640, ack 1, win 501, length 36
19:34:45.922013 IP lamp-ubuntu-s-1vcpu-1gb-tor1-01.ssh > 198.96.87.75.51610: Flags [P.], seq 23640:23812, ack 1, win 501, length 172
19:34:45.922052 IP lamp-ubuntu-s-1vcpu-1gb-tor1-01.ssh > 198.96.87.75.51610: Flags [P.], seq 23812:23848, ack 1, win 501, length 36
19:34:45.922080 IP lamp-ubuntu-s-1vcpu-1gb-tor1-01.ssh > 198.96.87.75.51610: Flags [P.], seq 23848:24020, ack 1, win 501, length 172
19:34:45.922113 IP lamp-ubuntu-s-1vcpu-1gb-tor1-01.ssh > 198.96.87.75.51610: Flags [P.], seq 24020:24056, ack 1, win 501, length 36
19:34:45.922144 IP lamp-ubuntu-s-1vcpu-1gb-tor1-01.ssh > 198.96.87.75.51610: Flags [P.], seq 24056:24228, ack 1, win 501, length 172
19:34:45.922195 IP lamp-ubuntu-s-1vcpu-1gb-tor1-01.ssh > 198.96.87.75.51610: Flags [P.], seq 24228:24264, ack 1, win 501, length 36
19:34:45.922231 IP lamp-ubuntu-s-1vcpu-1gb-tor1-01.ssh > 198.96.87.75.51610: Flags [P.], seq 24264:24436, ack 1, win 501, length 172
19:34:45.922267 IP lamp-ubuntu-s-1vcpu-1gb-tor1-01.ssh > 198.96.87.75.51610: Flags [P.], seq 24436:24472, ack 1, win 501, length 36
19:34:45.922295 IP lamp-ubuntu-s-1vcpu-1gb-tor1-01.ssh > 198.96.87.75.51610: Flags [P.], seq 24472:24644, ack 1, win 501, length 172
19:34:45.922328 IP lamp-ubuntu-s-1vcpu-1gb-tor1-01.ssh > 198.96.87.75.51610: Flags [P.], seq 24644:24680, ack 1, win 501, length 36
19:34:45.922436 IP lamp-ubuntu-s-1vcpu-1gb-tor1-01.ssh > 198.96.87.75.51610: Flags [P.], seq 24888:25060, ack 1, win 501, length 172
19:34:45.922477 IP lamp-ubuntu-s-1vcpu-1gb-tor1-01.ssh > 198.96.87.75.51610: Flags [P.], seq 25060:25096, ack 1, win 501, length 36
19:34:45.922554 IP lamp-ubuntu-s-1vcpu-1gb-tor1-01.ssh > 198.96.87.75.51610: Flags [P.], seq 25268:25304, ack 1, win 501, length 36
19:34:45.922677 IP lamp-ubuntu-s-1vcpu-1gb-tor1-01.ssh > 198.96.87.75.51610: Flags [P.], seq 25512:25684, ack 1, win 501, length 172
19:34:45.922758 IP lamp-ubuntu-s-1vcpu-1gb-tor1-01.ssh > 198.96.87.75.51610: Flags [P.], seq 25720:25892, ack 1, win 501, length 172
19:34:45.922798 IP lamp-ubuntu-s-1vcpu-1gb-tor1-01.ssh > 198.96.87.75.51610: Flags [P.], seq 25892:25928, ack 1, win 501, length 36
19:34:45.922872 IP lamp-ubuntu-s-1vcpu-1gb-tor1-01.ssh > 198.96.87.75.51610: Flags [P.], seq 26100:26136, ack 1, win 501, length 36
19:34:45.922994 IP lamp-ubuntu-s-1vcpu-1gb-tor1-01.ssh > 198.96.87.75.51610: Flags [P.], seq 26344:26516, ack 1, win 501, length 172
19:34:45.939781 IP 198.96.87.75.51610 > lamp-ubuntu-s-1vcpu-1gb-tor1-01.ssh: Flags [.], ack 21560, win 512, length 0
19:34:45.939851 IP lamp-ubuntu-s-1vcpu-1gb-tor1-01.ssh > 198.96.87.75.51610: Flags [P.], seq 26516:32624, ack 1, win 501, length 6108
19:34:45.940189 IP lamp-ubuntu-s-1vcpu-1gb-tor1-01.ssh > 198.96.87.75.51610: Flags [P.], seq 32624:33024, ack 1, win 501, length 400
19:34:45.940247 IP lamp-ubuntu-s-1vcpu-1gb-tor1-01.ssh > 198.96.87.75.51610: Flags [P.], seq 33024:33196, ack 1, win 501, length 172
19:34:45.940305 IP lamp-ubuntu-s-1vcpu-1gb-tor1-01.ssh > 198.96.87.75.51610: Flags [P.], seq 33196:33404, ack 1, win 501, length 208
19:34:45.940345 IP lamp-ubuntu-s-1vcpu-1gb-tor1-01.ssh > 198.96.87.75.51610: Flags [P.], seq 33404:33440, ack 1, win 501, length 36
19:34:45.940371 IP lamp-ubuntu-s-1vcpu-1gb-tor1-01.ssh > 198.96.87.75.51610: Flags [P.], seq 33440:33612, ack 1, win 501, length 172
19:34:45.940407 IP lamp-ubuntu-s-1vcpu-1gb-tor1-01.ssh > 198.96.87.75.51610: Flags [P.], seq 33612:33648, ack 1, win 501, length 36
19:34:45.940435 IP lamp-ubuntu-s-1vcpu-1gb-tor1-01.ssh > 198.96.87.75.51610: Flags [P.], seq 33648:33820, ack 1, win 501, length 172
19:34:45.940470 IP 198.96.87.75.51610 > lamp-ubuntu-s-1vcpu-1gb-tor1-01.ssh: Flags [.], ack 24888, win 512, length 0
19:34:45.940470 IP 198.96.87.75.51610 > lamp-ubuntu-s-1vcpu-1gb-tor1-01.ssh: Flags [.], ack 26516, win 512, length 0
19:34:45.940548 IP lamp-ubuntu-s-1vcpu-1gb-tor1-01.ssh > 198.96.87.75.51610: Flags [P.], seq 33820:33856, ack 1, win 501, length 36
19:34:45.940595 IP lamp-ubuntu-s-1vcpu-1gb-tor1-01.ssh > 198.96.87.75.51610: Flags [P.], seq 33856:34028, ack 1, win 501, length 172
19:34:45.940741 IP lamp-ubuntu-s-1vcpu-1gb-tor1-01.ssh > 198.96.87.75.51610: Flags [P.], seq 34028:34236, ack 1, win 501, length 208
19:34:45.940832 IP lamp-ubuntu-s-1vcpu-1gb-tor1-01.ssh > 198.96.87.75.51610: Flags [P.], seq 34236:34444, ack 1, win 501, length 208
19:34:45.940883 IP lamp-ubuntu-s-1vcpu-1gb-tor1-01.ssh > 198.96.87.75.51610: Flags [P.], seq 34444:34480, ack 1, win 501, length 36
19:34:45.940904 IP lamp-ubuntu-s-1vcpu-1gb-tor1-01.ssh > 198.96.87.75.51610: Flags [P.], seq 34480:34636, ack 1, win 501, length 156
19:34:45.940971 IP lamp-ubuntu-s-1vcpu-1gb-tor1-01.ssh > 198.96.87.75.51610: Flags [P.], seq 34636:35056, ack 1, win 501, length 420
19:34:45.941031 IP lamp-ubuntu-s-1vcpu-1gb-tor1-01.ssh > 198.96.87.75.51610: Flags [P.], seq 35056:35492, ack 1, win 501, length 436
19:34:45.941123 IP lamp-ubuntu-s-1vcpu-1gb-tor1-01.ssh > 198.96.87.75.51610: Flags [P.], seq 35492:35928, ack 1, win 501, length 436
19:34:45.941185 IP lamp-ubuntu-s-1vcpu-1gb-tor1-01.ssh > 198.96.87.75.51610: Flags [P.], seq 35928:36100, ack 1, win 501, length 172
19:34:45.941241 IP lamp-ubuntu-s-1vcpu-1gb-tor1-01.ssh > 198.96.87.75.51610: Flags [P.], seq 36100:36272, ack 1, win 501, length 172
19:34:45.941296 IP lamp-ubuntu-s-1vcpu-1gb-tor1-01.ssh > 198.96.87.75.51610: Flags [P.], seq 36272:36444, ack 1, win 501, length 172
19:34:45.941349 IP lamp-ubuntu-s-1vcpu-1gb-tor1-01.ssh > 198.96.87.75.51610: Flags [P.], seq 36444:36616, ack 1, win 501, length 172
19:34:45.941402 IP lamp-ubuntu-s-1vcpu-1gb-tor1-01.ssh > 198.96.87.75.51610: Flags [P.], seq 36616:36788, ack 1, win 501, length 172
19:34:45.941456 IP lamp-ubuntu-s-1vcpu-1gb-tor1-01.ssh > 198.96.87.75.51610: Flags [P.], seq 36788:36960, ack 1, win 501, length 172
19:34:45.941510 IP lamp-ubuntu-s-1vcpu-1gb-tor1-01.ssh > 198.96.87.75.51610: Flags [P.], seq 36960:37132, ack 1, win 501, length 172
19:34:45.941563 IP lamp-ubuntu-s-1vcpu-1gb-tor1-01.ssh > 198.96.87.75.51610: Flags [P.], seq 37132:37304, ack 1, win 501, length 172
19:34:45.941617 IP lamp-ubuntu-s-1vcpu-1gb-tor1-01.ssh > 198.96.87.75.51610: Flags [P.], seq 37304:37476, ack 1, win 501, length 172
19:34:45.941670 IP lamp-ubuntu-s-1vcpu-1gb-tor1-01.ssh > 198.96.87.75.51610: Flags [P.], seq 37476:37648, ack 1, win 501, length 172
19:34:45.941747 IP lamp-ubuntu-s-1vcpu-1gb-tor1-01.ssh > 198.96.87.75.51610: Flags [P.], seq 37648:37820, ack 1, win 501, length 172
19:34:45.941801 IP lamp-ubuntu-s-1vcpu-1gb-tor1-01.ssh > 198.96.87.75.51610: Flags [P.], seq 37820:37992, ack 1, win 501, length 172
19:34:45.941854 IP lamp-ubuntu-s-1vcpu-1gb-tor1-01.ssh > 198.96.87.75.51610: Flags [P.], seq 37992:38164, ack 1, win 501, length 172
19:34:45.941907 IP lamp-ubuntu-s-1vcpu-1gb-tor1-01.ssh > 198.96.87.75.51610: Flags [P.], seq 38164:38336, ack 1, win 501, length 172
19:34:45.941961 IP lamp-ubuntu-s-1vcpu-1gb-tor1-01.ssh > 198.96.87.75.51610: Flags [P.], seq 38336:38508, ack 1, win 501, length 172
19:34:45.942014 IP lamp-ubuntu-s-1vcpu-1gb-tor1-01.ssh > 198.96.87.75.51610: Flags [P.], seq 38508:38680, ack 1, win 501, length 172
19:34:45.942085 IP lamp-ubuntu-s-1vcpu-1gb-tor1-01.ssh > 198.96.87.75.51610: Flags [P.], seq 38680:38852, ack 1, win 501, length 172
19:34:45.942138 IP lamp-ubuntu-s-1vcpu-1gb-tor1-01.ssh > 198.96.87.75.51610: Flags [P.], seq 38852:39024, ack 1, win 501, length 172
19:34:45.942207 IP lamp-ubuntu-s-1vcpu-1gb-tor1-01.ssh > 198.96.87.75.51610: Flags [P.], seq 39024:39196, ack 1, win 501, length 172
19:34:45.942261 IP lamp-ubuntu-s-1vcpu-1gb-tor1-01.ssh > 198.96.87.75.51610: Flags [P.], seq 39196:39368, ack 1, win 501, length 172
19:34:45.942314 IP lamp-ubuntu-s-1vcpu-1gb-tor1-01.ssh > 198.96.87.75.51610: Flags [P.], seq 39368:39540, ack 1, win 501, length 172
19:34:45.942367 IP lamp-ubuntu-s-1vcpu-1gb-tor1-01.ssh > 198.96.87.75.51610: Flags [P.], seq 39540:39712, ack 1, win 501, length 172
19:34:45.942419 IP lamp-ubuntu-s-1vcpu-1gb-tor1-01.ssh > 198.96.87.75.51610: Flags [P.], seq 39712:39884, ack 1, win 501, length 172
19:34:45.942476 IP lamp-ubuntu-s-1vcpu-1gb-tor1-01.ssh > 198.96.87.75.51610: Flags [P.], seq 39884:40056, ack 1, win 501, length 172
19:34:45.942530 IP lamp-ubuntu-s-1vcpu-1gb-tor1-01.ssh > 198.96.87.75.51610: Flags [P.], seq 40056:40228, ack 1, win 501, length 172
19:34:45.942584 IP lamp-ubuntu-s-1vcpu-1gb-tor1-01.ssh > 198.96.87.75.51610: Flags [P.], seq 40228:40400, ack 1, win 501, length 172
19:34:45.942637 IP lamp-ubuntu-s-1vcpu-1gb-tor1-01.ssh > 198.96.87.75.51610: Flags [P.], seq 40400:40572, ack 1, win 501, length 172
19:34:45.942689 IP lamp-ubuntu-s-1vcpu-1gb-tor1-01.ssh > 198.96.87.75.51610: Flags [P.], seq 40572:40744, ack 1, win 501, length 172
19:34:45.942741 IP lamp-ubuntu-s-1vcpu-1gb-tor1-01.ssh > 198.96.87.75.51610: Flags [P.], seq 40744:40916, ack 1, win 501, length 172
19:34:45.942794 IP lamp-ubuntu-s-1vcpu-1gb-tor1-01.ssh > 198.96.87.75.51610: Flags [P.], seq 40916:41088, ack 1, win 501, length 172
19:34:45.942847 IP lamp-ubuntu-s-1vcpu-1gb-tor1-01.ssh > 198.96.87.75.51610: Flags [P.], seq 41088:41260, ack 1, win 501, length 172
19:34:45.942901 IP lamp-ubuntu-s-1vcpu-1gb-tor1-01.ssh > 198.96.87.75.51610: Flags [P.], seq 41260:41432, ack 1, win 501, length 172
19:34:45.942954 IP lamp-ubuntu-s-1vcpu-1gb-tor1-01.ssh > 198.96.87.75.51610: Flags [P.], seq 41432:41604, ack 1, win 501, length 172
19:34:45.943008 IP lamp-ubuntu-s-1vcpu-1gb-tor1-01.ssh > 198.96.87.75.51610: Flags [P.], seq 41604:41776, ack 1, win 501, length 172
19:34:45.943060 IP lamp-ubuntu-s-1vcpu-1gb-tor1-01.ssh > 198.96.87.75.51610: Flags [P.], seq 41776:41948, ack 1, win 501, length 172
19:34:45.943113 IP lamp-ubuntu-s-1vcpu-1gb-tor1-01.ssh > 198.96.87.75.51610: Flags [P.], seq 41948:42120, ack 1, win 501, length 172
19:34:45.943166 IP lamp-ubuntu-s-1vcpu-1gb-tor1-01.ssh > 198.96.87.75.51610: Flags [P.], seq 42120:42292, ack 1, win 501, length 172
19:34:45.943218 IP lamp-ubuntu-s-1vcpu-1gb-tor1-01.ssh > 198.96.87.75.51610: Flags [P.], seq 42292:42464, ack 1, win 501, length 172
19:34:45.943270 IP lamp-ubuntu-s-1vcpu-1gb-tor1-01.ssh > 198.96.87.75.51610: Flags [P.], seq 42464:42636, ack 1, win 501, length 172
19:34:45.943375 IP lamp-ubuntu-s-1vcpu-1gb-tor1-01.ssh > 198.96.87.75.51610: Flags [P.], seq 42636:42808, ack 1, win 501, length 172
19:34:45.943432 IP lamp-ubuntu-s-1vcpu-1gb-tor1-01.ssh > 198.96.87.75.51610: Flags [P.], seq 42808:42980, ack 1, win 501, length 172
19:34:45.943500 IP lamp-ubuntu-s-1vcpu-1gb-tor1-01.ssh > 198.96.87.75.51610: Flags [P.], seq 42980:43152, ack 1, win 501, length 172
19:34:45.943552 IP lamp-ubuntu-s-1vcpu-1gb-tor1-01.ssh > 198.96.87.75.51610: Flags [P.], seq 43152:43324, ack 1, win 501, length 172
19:34:45.943605 IP lamp-ubuntu-s-1vcpu-1gb-tor1-01.ssh > 198.96.87.75.51610: Flags [P.], seq 43324:43496, ack 1, win 501, length 172
19:34:45.943658 IP lamp-ubuntu-s-1vcpu-1gb-tor1-01.ssh > 198.96.87.75.51610: Flags [P.], seq 43496:43668, ack 1, win 501, length 172
19:34:45.943711 IP lamp-ubuntu-s-1vcpu-1gb-tor1-01.ssh > 198.96.87.75.51610: Flags [P.], seq 43668:43840, ack 1, win 501, length 172
19:34:45.943764 IP lamp-ubuntu-s-1vcpu-1gb-tor1-01.ssh > 198.96.87.75.51610: Flags [P.], seq 43840:44012, ack 1, win 501, length 172
19:34:45.943818 IP lamp-ubuntu-s-1vcpu-1gb-tor1-01.ssh > 198.96.87.75.51610: Flags [P.], seq 44012:44184, ack 1, win 501, length 172
19:34:45.943870 IP lamp-ubuntu-s-1vcpu-1gb-tor1-01.ssh > 198.96.87.75.51610: Flags [P.], seq 44184:44356, ack 1, win 501, length 172
19:34:45.943924 IP lamp-ubuntu-s-1vcpu-1gb-tor1-01.ssh > 198.96.87.75.51610: Flags [P.], seq 44356:44528, ack 1, win 501, length 172
19:34:45.943977 IP lamp-ubuntu-s-1vcpu-1gb-tor1-01.ssh > 198.96.87.75.51610: Flags [P.], seq 44528:44700, ack 1, win 501, length 172
19:34:45.944030 IP lamp-ubuntu-s-1vcpu-1gb-tor1-01.ssh > 198.96.87.75.51610: Flags [P.], seq 44700:44872, ack 1, win 501, length 172
19:34:45.944083 IP lamp-ubuntu-s-1vcpu-1gb-tor1-01.ssh > 198.96.87.75.51610: Flags [P.], seq 44872:45044, ack 1, win 501, length 172
19:34:45.944136 IP lamp-ubuntu-s-1vcpu-1gb-tor1-01.ssh > 198.96.87.75.51610: Flags [P.], seq 45044:45216, ack 1, win 501, length 172
19:34:45.944190 IP lamp-ubuntu-s-1vcpu-1gb-tor1-01.ssh > 198.96.87.75.51610: Flags [P.], seq 45216:45388, ack 1, win 501, length 172
19:34:45.944243 IP lamp-ubuntu-s-1vcpu-1gb-tor1-01.ssh > 198.96.87.75.51610: Flags [P.], seq 45388:45560, ack 1, win 501, length 172
19:34:45.944296 IP lamp-ubuntu-s-1vcpu-1gb-tor1-01.ssh > 198.96.87.75.51610: Flags [P.], seq 45560:45732, ack 1, win 501, length 172
19:34:45.944349 IP lamp-ubuntu-s-1vcpu-1gb-tor1-01.ssh > 198.96.87.75.51610: Flags [P.], seq 45732:45904, ack 1, win 501, length 172
19:34:45.944402 IP lamp-ubuntu-s-1vcpu-1gb-tor1-01.ssh > 198.96.87.75.51610: Flags [P.], seq 45904:46076, ack 1, win 501, length 172
19:34:45.944454 IP lamp-ubuntu-s-1vcpu-1gb-tor1-01.ssh > 198.96.87.75.51610: Flags [P.], seq 46076:46248, ack 1, win 501, length 172
19:34:45.944508 IP lamp-ubuntu-s-1vcpu-1gb-tor1-01.ssh > 198.96.87.75.51610: Flags [P.], seq 46248:46420, ack 1, win 501, length 172
19:34:45.944561 IP lamp-ubuntu-s-1vcpu-1gb-tor1-01.ssh > 198.96.87.75.51610: Flags [P.], seq 46420:46592, ack 1, win 501, length 172
19:34:45.944614 IP lamp-ubuntu-s-1vcpu-1gb-tor1-01.ssh > 198.96.87.75.51610: Flags [P.], seq 46592:46764, ack 1, win 501, length 172
19:34:45.944716 IP lamp-ubuntu-s-1vcpu-1gb-tor1-01.ssh > 198.96.87.75.51610: Flags [P.], seq 46764:46936, ack 1, win 501, length 172
19:34:45.954464 IP 198.96.87.75.51610 > lamp-ubuntu-s-1vcpu-1gb-tor1-01.ssh: Flags [.], ack 46936, win 512, length 0
19:34:45.954668 IP lamp-ubuntu-s-1vcpu-1gb-tor1-01.ssh > 198.96.87.75.51610: Flags [P.], seq 46936:47108, ack 1, win 501, length 172
19:34:45.954753 IP lamp-ubuntu-s-1vcpu-1gb-tor1-01.ssh > 198.96.87.75.51610: Flags [P.], seq 47108:47264, ack 1, win 501, length 156
19:34:45.954806 IP lamp-ubuntu-s-1vcpu-1gb-tor1-01.ssh > 198.96.87.75.51610: Flags [P.], seq 47264:47436, ack 1, win 501, length 172
19:34:45.954858 IP lamp-ubuntu-s-1vcpu-1gb-tor1-01.ssh > 198.96.87.75.51610: Flags [P.], seq 47436:47608, ack 1, win 501, length 172
19:34:45.954912 IP lamp-ubuntu-s-1vcpu-1gb-tor1-01.ssh > 198.96.87.75.51610: Flags [P.], seq 47608:47780, ack 1, win 501, length 172
19:34:45.954961 IP lamp-ubuntu-s-1vcpu-1gb-tor1-01.ssh > 198.96.87.75.51610: Flags [P.], seq 47780:47952, ack 1, win 501, length 172
19:34:45.955010 IP lamp-ubuntu-s-1vcpu-1gb-tor1-01.ssh > 198.96.87.75.51610: Flags [P.], seq 47952:48124, ack 1, win 501, length 172
19:34:45.955055 IP lamp-ubuntu-s-1vcpu-1gb-tor1-01.ssh > 198.96.87.75.51610: Flags [P.], seq 48124:48296, ack 1, win 501, length 172
19:34:45.955109 IP lamp-ubuntu-s-1vcpu-1gb-tor1-01.ssh > 198.96.87.75.51610: Flags [P.], seq 48296:48604, ack 1, win 501, length 308
19:34:45.955162 IP lamp-ubuntu-s-1vcpu-1gb-tor1-01.ssh > 198.96.87.75.51610: Flags [P.], seq 48604:48776, ack 1, win 501, length 172
19:34:45.955215 IP lamp-ubuntu-s-1vcpu-1gb-tor1-01.ssh > 198.96.87.75.51610: Flags [P.], seq 48776:48948, ack 1, win 501, length 172
19:34:45.955288 IP lamp-ubuntu-s-1vcpu-1gb-tor1-01.ssh > 198.96.87.75.51610: Flags [P.], seq 48948:49120, ack 1, win 501, length 172
19:34:45.955368 IP lamp-ubuntu-s-1vcpu-1gb-tor1-01.ssh > 198.96.87.75.51610: Flags [P.], seq 49120:49292, ack 1, win 501, length 172
19:34:45.955423 IP lamp-ubuntu-s-1vcpu-1gb-tor1-01.ssh > 198.96.87.75.51610: Flags [P.], seq 49292:49464, ack 1, win 501, length 172
19:34:45.955473 IP lamp-ubuntu-s-1vcpu-1gb-tor1-01.ssh > 198.96.87.75.51610: Flags [P.], seq 49464:49636, ack 1, win 501, length 172
19:34:45.955581 IP lamp-ubuntu-s-1vcpu-1gb-tor1-01.ssh > 198.96.87.75.51610: Flags [P.], seq 49636:49808, ack 1, win 501, length 172
19:34:45.955858 IP lamp-ubuntu-s-1vcpu-1gb-tor1-01.ssh > 198.96.87.75.51610: Flags [P.], seq 49808:49980, ack 1, win 501, length 172
19:34:45.955947 IP lamp-ubuntu-s-1vcpu-1gb-tor1-01.ssh > 198.96.87.75.51610: Flags [P.], seq 49980:50152, ack 1, win 501, length 172
19:34:45.956009 IP lamp-ubuntu-s-1vcpu-1gb-tor1-01.ssh > 198.96.87.75.51610: Flags [P.], seq 50152:50324, ack 1, win 501, length 172
19:34:45.956063 IP lamp-ubuntu-s-1vcpu-1gb-tor1-01.ssh > 198.96.87.75.51610: Flags [P.], seq 50324:50496, ack 1, win 501, length 172
19:34:45.956107 IP lamp-ubuntu-s-1vcpu-1gb-tor1-01.ssh > 198.96.87.75.51610: Flags [P.], seq 50496:50668, ack 1, win 501, length 172
19:34:45.956150 IP lamp-ubuntu-s-1vcpu-1gb-tor1-01.ssh > 198.96.87.75.51610: Flags [P.], seq 50668:50840, ack 1, win 501, length 172
19:34:45.956192 IP lamp-ubuntu-s-1vcpu-1gb-tor1-01.ssh > 198.96.87.75.51610: Flags [P.], seq 50840:51012, ack 1, win 501, length 172
19:34:45.956234 IP lamp-ubuntu-s-1vcpu-1gb-tor1-01.ssh > 198.96.87.75.51610: Flags [P.], seq 51012:51184, ack 1, win 501, length 172
19:34:45.956293 IP lamp-ubuntu-s-1vcpu-1gb-tor1-01.ssh > 198.96.87.75.51610: Flags [P.], seq 51184:51356, ack 1, win 501, length 172
19:34:45.956345 IP lamp-ubuntu-s-1vcpu-1gb-tor1-01.ssh > 198.96.87.75.51610: Flags [P.], seq 51356:51528, ack 1, win 501, length 172
19:34:45.956387 IP lamp-ubuntu-s-1vcpu-1gb-tor1-01.ssh > 198.96.87.75.51610: Flags [P.], seq 51528:51700, ack 1, win 501, length 172
19:34:45.956429 IP lamp-ubuntu-s-1vcpu-1gb-tor1-01.ssh > 198.96.87.75.51610: Flags [P.], seq 51700:51872, ack 1, win 501, length 172
19:34:45.956470 IP lamp-ubuntu-s-1vcpu-1gb-tor1-01.ssh > 198.96.87.75.51610: Flags [P.], seq 51872:52044, ack 1, win 501, length 172
19:34:45.956513 IP lamp-ubuntu-s-1vcpu-1gb-tor1-01.ssh > 198.96.87.75.51610: Flags [P.], seq 52044:52216, ack 1, win 501, length 172
19:34:45.956554 IP lamp-ubuntu-s-1vcpu-1gb-tor1-01.ssh > 198.96.87.75.51610: Flags [P.], seq 52216:52388, ack 1, win 501, length 172
19:34:45.956598 IP lamp-ubuntu-s-1vcpu-1gb-tor1-01.ssh > 198.96.87.75.51610: Flags [P.], seq 52388:52560, ack 1, win 501, length 172
19:34:45.956708 IP lamp-ubuntu-s-1vcpu-1gb-tor1-01.ssh > 198.96.87.75.51610: Flags [P.], seq 52560:52732, ack 1, win 501, length 172
19:34:45.956755 IP lamp-ubuntu-s-1vcpu-1gb-tor1-01.ssh > 198.96.87.75.51610: Flags [P.], seq 52732:52904, ack 1, win 501, length 172
19:34:45.956796 IP lamp-ubuntu-s-1vcpu-1gb-tor1-01.ssh > 198.96.87.75.51610: Flags [P.], seq 52904:53076, ack 1, win 501, length 172
19:34:45.956837 IP lamp-ubuntu-s-1vcpu-1gb-tor1-01.ssh > 198.96.87.75.51610: Flags [P.], seq 53076:53248, ack 1, win 501, length 172
19:34:45.956878 IP lamp-ubuntu-s-1vcpu-1gb-tor1-01.ssh > 198.96.87.75.51610: Flags [P.], seq 53248:53420, ack 1, win 501, length 172
19:34:45.956919 IP lamp-ubuntu-s-1vcpu-1gb-tor1-01.ssh > 198.96.87.75.51610: Flags [P.], seq 53420:53592, ack 1, win 501, length 172
19:34:45.956960 IP lamp-ubuntu-s-1vcpu-1gb-tor1-01.ssh > 198.96.87.75.51610: Flags [P.], seq 53592:53764, ack 1, win 501, length 172
