19:46:21.502877 IP lamp-ubuntu-s-1vcpu-1gb-tor1-01.ssh > 198.96.87.75.51219: Flags [P.], seq 280464:280636, ack 37, win 501, length 172
19:46:21.502922 IP lamp-ubuntu-s-1vcpu-1gb-tor1-01.ssh > 198.96.87.75.51219: Flags [P.], seq 280636:280808, ack 37, win 501, length 172
19:46:21.502963 IP lamp-ubuntu-s-1vcpu-1gb-tor1-01.ssh > 198.96.87.75.51219: Flags [P.], seq 280808:280980, ack 37, win 501, length 172
19:46:21.503004 IP lamp-ubuntu-s-1vcpu-1gb-tor1-01.ssh > 198.96.87.75.51219: Flags [P.], seq 280980:281152, ack 37, win 501, length 172
19:46:21.503045 IP lamp-ubuntu-s-1vcpu-1gb-tor1-01.ssh > 198.96.87.75.51219: Flags [P.], seq 281152:281324, ack 37, win 501, length 172
19:46:21.503089 IP lamp-ubuntu-s-1vcpu-1gb-tor1-01.ssh > 198.96.87.75.51219: Flags [P.], seq 281324:281496, ack 37, win 501, length 172
19:46:21.503132 IP lamp-ubuntu-s-1vcpu-1gb-tor1-01.ssh > 198.96.87.75.51219: Flags [P.], seq 281496:281668, ack 37, win 501, length 172
19:46:21.503178 IP lamp-ubuntu-s-1vcpu-1gb-tor1-01.ssh > 198.96.87.75.51219: Flags [P.], seq 281668:281840, ack 37, win 501, length 172
19:46:21.503220 IP lamp-ubuntu-s-1vcpu-1gb-tor1-01.ssh > 198.96.87.75.51219: Flags [P.], seq 281840:282012, ack 37, win 501, length 172
19:46:21.503261 IP lamp-ubuntu-s-1vcpu-1gb-tor1-01.ssh > 198.96.87.75.51219: Flags [P.], seq 282012:282184, ack 37, win 501, length 172
19:46:21.503302 IP lamp-ubuntu-s-1vcpu-1gb-tor1-01.ssh > 198.96.87.75.51219: Flags [P.], seq 282184:282356, ack 37, win 501, length 172
19:46:21.503343 IP lamp-ubuntu-s-1vcpu-1gb-tor1-01.ssh > 198.96.87.75.51219: Flags [P.], seq 282356:282528, ack 37, win 501, length 172
19:46:21.503398 IP lamp-ubuntu-s-1vcpu-1gb-tor1-01.ssh > 198.96.87.75.51219: Flags [P.], seq 282528:282700, ack 37, win 501, length 172
19:46:21.503440 IP lamp-ubuntu-s-1vcpu-1gb-tor1-01.ssh > 198.96.87.75.51219: Flags [P.], seq 282700:282872, ack 37, win 501, length 172
19:46:21.503484 IP lamp-ubuntu-s-1vcpu-1gb-tor1-01.ssh > 198.96.87.75.51219: Flags [P.], seq 282872:283044, ack 37, win 501, length 172
19:46:21.503525 IP lamp-ubuntu-s-1vcpu-1gb-tor1-01.ssh > 198.96.87.75.51219: Flags [P.], seq 283044:283216, ack 37, win 501, length 172
19:46:21.503565 IP lamp-ubuntu-s-1vcpu-1gb-tor1-01.ssh > 198.96.87.75.51219: Flags [P.], seq 283216:283388, ack 37, win 501, length 172
19:46:21.503606 IP lamp-ubuntu-s-1vcpu-1gb-tor1-01.ssh > 198.96.87.75.51219: Flags [P.], seq 283388:283560, ack 37, win 501, length 172
19:46:21.508713 IP 198.96.87.75.51219 > lamp-ubuntu-s-1vcpu-1gb-tor1-01.ssh: Flags [P.], seq 37:73, ack 255628, win 512, length 36
19:46:21.508714 IP 198.96.87.75.51219 > lamp-ubuntu-s-1vcpu-1gb-tor1-01.ssh: Flags [.], ack 263832, win 488, length 0
19:46:21.508714 IP 198.96.87.75.51219 > lamp-ubuntu-s-1vcpu-1gb-tor1-01.ssh: Flags [.], ack 272088, win 455, length 0
19:46:21.508714 IP 198.96.87.75.51219 > lamp-ubuntu-s-1vcpu-1gb-tor1-01.ssh: Flags [.], ack 278400, win 431, length 0
19:46:21.508714 IP 198.96.87.75.51219 > lamp-ubuntu-s-1vcpu-1gb-tor1-01.ssh: Flags [.], ack 282700, win 414, length 0
19:46:21.508843 IP lamp-ubuntu-s-1vcpu-1gb-tor1-01.ssh > 198.96.87.75.51219: Flags [P.], seq 283560:283732, ack 73, win 501, length 172
19:46:21.509123 IP lamp-ubuntu-s-1vcpu-1gb-tor1-01.ssh > 198.96.87.75.51219: Flags [P.], seq 283732:284512, ack 73, win 501, length 780
19:46:21.509178 IP lamp-ubuntu-s-1vcpu-1gb-tor1-01.ssh > 198.96.87.75.51219: Flags [P.], seq 284512:284684, ack 73, win 501, length 172
19:46:21.509265 IP lamp-ubuntu-s-1vcpu-1gb-tor1-01.ssh > 198.96.87.75.51219: Flags [P.], seq 284684:284856, ack 73, win 501, length 172
19:46:21.509321 IP lamp-ubuntu-s-1vcpu-1gb-tor1-01.ssh > 198.96.87.75.51219: Flags [P.], seq 284856:285028, ack 73, win 501, length 172
19:46:21.509366 IP lamp-ubuntu-s-1vcpu-1gb-tor1-01.ssh > 198.96.87.75.51219: Flags [P.], seq 285028:285200, ack 73, win 501, length 172
19:46:21.509408 IP lamp-ubuntu-s-1vcpu-1gb-tor1-01.ssh > 198.96.87.75.51219: Flags [P.], seq 285200:285372, ack 73, win 501, length 172
19:46:21.509450 IP lamp-ubuntu-s-1vcpu-1gb-tor1-01.ssh > 198.96.87.75.51219: Flags [P.], seq 285372:285544, ack 73, win 501, length 172
19:46:21.509493 IP lamp-ubuntu-s-1vcpu-1gb-tor1-01.ssh > 198.96.87.75.51219: Flags [P.], seq 285544:285716, ack 73, win 501, length 172
19:46:21.509535 IP lamp-ubuntu-s-1vcpu-1gb-tor1-01.ssh > 198.96.87.75.51219: Flags [P.], seq 285716:285888, ack 73, win 501, length 172
19:46:21.509585 IP lamp-ubuntu-s-1vcpu-1gb-tor1-01.ssh > 198.96.87.75.51219: Flags [P.], seq 285888:286060, ack 73, win 501, length 172
19:46:21.509628 IP lamp-ubuntu-s-1vcpu-1gb-tor1-01.ssh > 198.96.87.75.51219: Flags [P.], seq 286060:286232, ack 73, win 501, length 172
19:46:21.509676 IP 198.96.87.75.51219 > lamp-ubuntu-s-1vcpu-1gb-tor1-01.ssh: Flags [.], ack 283560, win 411, length 0
19:46:21.509688 IP lamp-ubuntu-s-1vcpu-1gb-tor1-01.ssh > 198.96.87.75.51219: Flags [P.], seq 286232:286404, ack 73, win 501, length 172
19:46:21.509774 IP lamp-ubuntu-s-1vcpu-1gb-tor1-01.ssh > 198.96.87.75.51219: Flags [P.], seq 286404:286696, ack 73, win 501, length 292
19:46:21.509842 IP lamp-ubuntu-s-1vcpu-1gb-tor1-01.ssh > 198.96.87.75.51219: Flags [P.], seq 286696:286868, ack 73, win 501, length 172
19:46:21.509903 IP lamp-ubuntu-s-1vcpu-1gb-tor1-01.ssh > 198.96.87.75.51219: Flags [P.], seq 286868:287040, ack 73, win 501, length 172
19:46:21.509959 IP lamp-ubuntu-s-1vcpu-1gb-tor1-01.ssh > 198.96.87.75.51219: Flags [P.], seq 287040:287212, ack 73, win 501, length 172
19:46:21.510014 IP lamp-ubuntu-s-1vcpu-1gb-tor1-01.ssh > 198.96.87.75.51219: Flags [P.], seq 287212:287384, ack 73, win 501, length 172
19:46:21.510068 IP lamp-ubuntu-s-1vcpu-1gb-tor1-01.ssh > 198.96.87.75.51219: Flags [P.], seq 287384:287556, ack 73, win 501, length 172
19:46:21.510121 IP lamp-ubuntu-s-1vcpu-1gb-tor1-01.ssh > 198.96.87.75.51219: Flags [P.], seq 287556:287728, ack 73, win 501, length 172
19:46:21.510190 IP lamp-ubuntu-s-1vcpu-1gb-tor1-01.ssh > 198.96.87.75.51219: Flags [P.], seq 287728:287900, ack 73, win 501, length 172
19:46:21.510246 IP lamp-ubuntu-s-1vcpu-1gb-tor1-01.ssh > 198.96.87.75.51219: Flags [P.], seq 287900:288072, ack 73, win 501, length 172
19:46:21.510300 IP lamp-ubuntu-s-1vcpu-1gb-tor1-01.ssh > 198.96.87.75.51219: Flags [P.], seq 288072:288244, ack 73, win 501, length 172
19:46:21.510419 IP lamp-ubuntu-s-1vcpu-1gb-tor1-01.ssh > 198.96.87.75.51219: Flags [P.], seq 288244:288416, ack 73, win 501, length 172
19:46:21.510483 IP lamp-ubuntu-s-1vcpu-1gb-tor1-01.ssh > 198.96.87.75.51219: Flags [P.], seq 288416:288588, ack 73, win 501, length 172
19:46:21.510537 IP lamp-ubuntu-s-1vcpu-1gb-tor1-01.ssh > 198.96.87.75.51219: Flags [P.], seq 288588:288760, ack 73, win 501, length 172
19:46:21.510616 IP lamp-ubuntu-s-1vcpu-1gb-tor1-01.ssh > 198.96.87.75.51219: Flags [P.], seq 288760:288932, ack 73, win 501, length 172
19:46:21.510672 IP lamp-ubuntu-s-1vcpu-1gb-tor1-01.ssh > 198.96.87.75.51219: Flags [P.], seq 288932:289104, ack 73, win 501, length 172
19:46:21.510783 IP lamp-ubuntu-s-1vcpu-1gb-tor1-01.ssh > 198.96.87.75.51219: Flags [P.], seq 289104:289276, ack 73, win 501, length 172
19:46:21.510851 IP lamp-ubuntu-s-1vcpu-1gb-tor1-01.ssh > 198.96.87.75.51219: Flags [P.], seq 289276:289448, ack 73, win 501, length 172
19:46:21.510905 IP lamp-ubuntu-s-1vcpu-1gb-tor1-01.ssh > 198.96.87.75.51219: Flags [P.], seq 289448:289620, ack 73, win 501, length 172
19:46:21.510977 IP lamp-ubuntu-s-1vcpu-1gb-tor1-01.ssh > 198.96.87.75.51219: Flags [P.], seq 289620:289792, ack 73, win 501, length 172
19:46:21.511034 IP lamp-ubuntu-s-1vcpu-1gb-tor1-01.ssh > 198.96.87.75.51219: Flags [P.], seq 289792:289964, ack 73, win 501, length 172
19:46:21.511087 IP lamp-ubuntu-s-1vcpu-1gb-tor1-01.ssh > 198.96.87.75.51219: Flags [P.], seq 289964:290136, ack 73, win 501, length 172
19:46:21.511130 IP lamp-ubuntu-s-1vcpu-1gb-tor1-01.ssh > 198.96.87.75.51219: Flags [P.], seq 290136:290308, ack 73, win 501, length 172
19:46:21.511171 IP lamp-ubuntu-s-1vcpu-1gb-tor1-01.ssh > 198.96.87.75.51219: Flags [P.], seq 290308:290480, ack 73, win 501, length 172
19:46:21.511213 IP lamp-ubuntu-s-1vcpu-1gb-tor1-01.ssh > 198.96.87.75.51219: Flags [P.], seq 290480:290652, ack 73, win 501, length 172
19:46:21.511254 IP lamp-ubuntu-s-1vcpu-1gb-tor1-01.ssh > 198.96.87.75.51219: Flags [P.], seq 290652:290824, ack 73, win 501, length 172
19:46:21.511295 IP lamp-ubuntu-s-1vcpu-1gb-tor1-01.ssh > 198.96.87.75.51219: Flags [P.], seq 290824:290996, ack 73, win 501, length 172
19:46:21.511336 IP lamp-ubuntu-s-1vcpu-1gb-tor1-01.ssh > 198.96.87.75.51219: Flags [P.], seq 290996:291168, ack 73, win 501, length 172
19:46:21.511376 IP lamp-ubuntu-s-1vcpu-1gb-tor1-01.ssh > 198.96.87.75.51219: Flags [P.], seq 291168:291340, ack 73, win 501, length 172
19:46:21.511417 IP lamp-ubuntu-s-1vcpu-1gb-tor1-01.ssh > 198.96.87.75.51219: Flags [P.], seq 291340:291512, ack 73, win 501, length 172
19:46:21.511458 IP lamp-ubuntu-s-1vcpu-1gb-tor1-01.ssh > 198.96.87.75.51219: Flags [P.], seq 291512:291684, ack 73, win 501, length 172
19:46:21.511506 IP lamp-ubuntu-s-1vcpu-1gb-tor1-01.ssh > 198.96.87.75.51219: Flags [P.], seq 291684:291856, ack 73, win 501, length 172
19:46:21.511551 IP lamp-ubuntu-s-1vcpu-1gb-tor1-01.ssh > 198.96.87.75.51219: Flags [P.], seq 291856:292028, ack 73, win 501, length 172
19:46:21.511593 IP lamp-ubuntu-s-1vcpu-1gb-tor1-01.ssh > 198.96.87.75.51219: Flags [P.], seq 292028:292200, ack 73, win 501, length 172
19:46:21.511655 IP lamp-ubuntu-s-1vcpu-1gb-tor1-01.ssh > 198.96.87.75.51219: Flags [P.], seq 292200:292372, ack 73, win 501, length 172
19:46:21.511716 IP lamp-ubuntu-s-1vcpu-1gb-tor1-01.ssh > 198.96.87.75.51219: Flags [P.], seq 292372:292544, ack 73, win 501, length 172
19:46:21.511796 IP lamp-ubuntu-s-1vcpu-1gb-tor1-01.ssh > 198.96.87.75.51219: Flags [P.], seq 292544:292716, ack 73, win 501, length 172
19:46:21.511920 IP lamp-ubuntu-s-1vcpu-1gb-tor1-01.ssh > 198.96.87.75.51219: Flags [P.], seq 292716:292888, ack 73, win 501, length 172
19:46:21.512043 IP lamp-ubuntu-s-1vcpu-1gb-tor1-01.ssh > 198.96.87.75.51219: Flags [P.], seq 292888:293060, ack 73, win 501, length 172
19:46:21.512090 IP lamp-ubuntu-s-1vcpu-1gb-tor1-01.ssh > 198.96.87.75.51219: Flags [P.], seq 293060:293232, ack 73, win 501, length 172
19:46:21.512132 IP lamp-ubuntu-s-1vcpu-1gb-tor1-01.ssh > 198.96.87.75.51219: Flags [P.], seq 293232:293404, ack 73, win 501, length 172
19:46:21.512175 IP lamp-ubuntu-s-1vcpu-1gb-tor1-01.ssh > 198.96.87.75.51219: Flags [P.], seq 293404:293576, ack 73, win 501, length 172
19:46:21.512234 IP lamp-ubuntu-s-1vcpu-1gb-tor1-01.ssh > 198.96.87.75.51219: Flags [P.], seq 293576:293748, ack 73, win 501, length 172
19:46:21.512290 IP lamp-ubuntu-s-1vcpu-1gb-tor1-01.ssh > 198.96.87.75.51219: Flags [P.], seq 293748:293920, ack 73, win 501, length 172
19:46:21.512343 IP lamp-ubuntu-s-1vcpu-1gb-tor1-01.ssh > 198.96.87.75.51219: Flags [P.], seq 293920:294092, ack 73, win 501, length 172
19:46:21.512400 IP lamp-ubuntu-s-1vcpu-1gb-tor1-01.ssh > 198.96.87.75.51219: Flags [P.], seq 294092:294264, ack 73, win 501, length 172
19:46:21.512456 IP lamp-ubuntu-s-1vcpu-1gb-tor1-01.ssh > 198.96.87.75.51219: Flags [P.], seq 294264:294436, ack 73, win 501, length 172
19:46:21.512511 IP lamp-ubuntu-s-1vcpu-1gb-tor1-01.ssh > 198.96.87.75.51219: Flags [P.], seq 294436:294608, ack 73, win 501, length 172
19:46:21.512565 IP lamp-ubuntu-s-1vcpu-1gb-tor1-01.ssh > 198.96.87.75.51219: Flags [P.], seq 294608:294780, ack 73, win 501, length 172
19:46:21.512632 IP lamp-ubuntu-s-1vcpu-1gb-tor1-01.ssh > 198.96.87.75.51219: Flags [P.], seq 294780:294952, ack 73, win 501, length 172
19:46:21.512691 IP lamp-ubuntu-s-1vcpu-1gb-tor1-01.ssh > 198.96.87.75.51219: Flags [P.], seq 294952:295124, ack 73, win 501, length 172
19:46:21.512744 IP lamp-ubuntu-s-1vcpu-1gb-tor1-01.ssh > 198.96.87.75.51219: Flags [P.], seq 295124:295296, ack 73, win 501, length 172
19:46:21.512786 IP lamp-ubuntu-s-1vcpu-1gb-tor1-01.ssh > 198.96.87.75.51219: Flags [P.], seq 295296:295468, ack 73, win 501, length 172
19:46:21.512831 IP lamp-ubuntu-s-1vcpu-1gb-tor1-01.ssh > 198.96.87.75.51219: Flags [P.], seq 295468:295640, ack 73, win 501, length 172
19:46:21.512886 IP lamp-ubuntu-s-1vcpu-1gb-tor1-01.ssh > 198.96.87.75.51219: Flags [P.], seq 295640:295812, ack 73, win 501, length 172
19:46:21.512946 IP lamp-ubuntu-s-1vcpu-1gb-tor1-01.ssh > 198.96.87.75.51219: Flags [P.], seq 295812:295984, ack 73, win 501, length 172
19:46:21.513002 IP lamp-ubuntu-s-1vcpu-1gb-tor1-01.ssh > 198.96.87.75.51219: Flags [P.], seq 295984:296156, ack 73, win 501, length 172
19:46:21.513057 IP lamp-ubuntu-s-1vcpu-1gb-tor1-01.ssh > 198.96.87.75.51219: Flags [P.], seq 296156:296328, ack 73, win 501, length 172
19:46:21.513110 IP lamp-ubuntu-s-1vcpu-1gb-tor1-01.ssh > 198.96.87.75.51219: Flags [P.], seq 296328:296500, ack 73, win 501, length 172
19:46:21.513168 IP lamp-ubuntu-s-1vcpu-1gb-tor1-01.ssh > 198.96.87.75.51219: Flags [P.], seq 296500:296672, ack 73, win 501, length 172
19:46:21.513224 IP lamp-ubuntu-s-1vcpu-1gb-tor1-01.ssh > 198.96.87.75.51219: Flags [P.], seq 296672:296844, ack 73, win 501, length 172
19:46:21.513275 IP lamp-ubuntu-s-1vcpu-1gb-tor1-01.ssh > 198.96.87.75.51219: Flags [P.], seq 296844:297016, ack 73, win 501, length 172
19:46:21.513317 IP lamp-ubuntu-s-1vcpu-1gb-tor1-01.ssh > 198.96.87.75.51219: Flags [P.], seq 297016:297188, ack 73, win 501, length 172
19:46:21.513358 IP lamp-ubuntu-s-1vcpu-1gb-tor1-01.ssh > 198.96.87.75.51219: Flags [P.], seq 297188:297360, ack 73, win 501, length 172
19:46:21.513405 IP lamp-ubuntu-s-1vcpu-1gb-tor1-01.ssh > 198.96.87.75.51219: Flags [P.], seq 297360:297532, ack 73, win 501, length 172
19:46:21.513457 IP lamp-ubuntu-s-1vcpu-1gb-tor1-01.ssh > 198.96.87.75.51219: Flags [P.], seq 297532:297704, ack 73, win 501, length 172
19:46:21.513499 IP lamp-ubuntu-s-1vcpu-1gb-tor1-01.ssh > 198.96.87.75.51219: Flags [P.], seq 297704:297876, ack 73, win 501, length 172
19:46:21.513543 IP lamp-ubuntu-s-1vcpu-1gb-tor1-01.ssh > 198.96.87.75.51219: Flags [P.], seq 297876:298048, ack 73, win 501, length 172
19:46:21.513585 IP lamp-ubuntu-s-1vcpu-1gb-tor1-01.ssh > 198.96.87.75.51219: Flags [P.], seq 298048:298220, ack 73, win 501, length 172
19:46:21.513627 IP lamp-ubuntu-s-1vcpu-1gb-tor1-01.ssh > 198.96.87.75.51219: Flags [P.], seq 298220:298392, ack 73, win 501, length 172
19:46:21.513668 IP lamp-ubuntu-s-1vcpu-1gb-tor1-01.ssh > 198.96.87.75.51219: Flags [P.], seq 298392:298564, ack 73, win 501, length 172
19:46:21.513709 IP lamp-ubuntu-s-1vcpu-1gb-tor1-01.ssh > 198.96.87.75.51219: Flags [P.], seq 298564:298736, ack 73, win 501, length 172
19:46:21.513751 IP lamp-ubuntu-s-1vcpu-1gb-tor1-01.ssh > 198.96.87.75.51219: Flags [P.], seq 298736:298908, ack 73, win 501, length 172
19:46:21.513804 IP lamp-ubuntu-s-1vcpu-1gb-tor1-01.ssh > 198.96.87.75.51219: Flags [P.], seq 298908:299080, ack 73, win 501, length 172
19:46:21.513850 IP lamp-ubuntu-s-1vcpu-1gb-tor1-01.ssh > 198.96.87.75.51219: Flags [P.], seq 299080:299252, ack 73, win 501, length 172
19:46:21.513900 IP lamp-ubuntu-s-1vcpu-1gb-tor1-01.ssh > 198.96.87.75.51219: Flags [P.], seq 299252:299424, ack 73, win 501, length 172
19:46:21.513943 IP lamp-ubuntu-s-1vcpu-1gb-tor1-01.ssh > 198.96.87.75.51219: Flags [P.], seq 299424:299596, ack 73, win 501, length 172
19:46:21.513984 IP lamp-ubuntu-s-1vcpu-1gb-tor1-01.ssh > 198.96.87.75.51219: Flags [P.], seq 299596:299768, ack 73, win 501, length 172
19:46:21.514029 IP lamp-ubuntu-s-1vcpu-1gb-tor1-01.ssh > 198.96.87.75.51219: Flags [P.], seq 299768:299940, ack 73, win 501, length 172
19:46:21.514074 IP lamp-ubuntu-s-1vcpu-1gb-tor1-01.ssh > 198.96.87.75.51219: Flags [P.], seq 299940:300112, ack 73, win 501, length 172
19:46:21.514121 IP lamp-ubuntu-s-1vcpu-1gb-tor1-01.ssh > 198.96.87.75.51219: Flags [P.], seq 300112:300284, ack 73, win 501, length 172
19:46:21.514184 IP lamp-ubuntu-s-1vcpu-1gb-tor1-01.ssh > 198.96.87.75.51219: Flags [P.], seq 300284:300456, ack 73, win 501, length 172
19:46:21.514248 IP lamp-ubuntu-s-1vcpu-1gb-tor1-01.ssh > 198.96.87.75.51219: Flags [P.], seq 300456:300628, ack 73, win 501, length 172
19:46:21.514302 IP lamp-ubuntu-s-1vcpu-1gb-tor1-01.ssh > 198.96.87.75.51219: Flags [P.], seq 300628:300800, ack 73, win 501, length 172
19:46:21.514351 IP lamp-ubuntu-s-1vcpu-1gb-tor1-01.ssh > 198.96.87.75.51219: Flags [P.], seq 300800:300972, ack 73, win 501, length 172
19:46:21.514394 IP lamp-ubuntu-s-1vcpu-1gb-tor1-01.ssh > 198.96.87.75.51219: Flags [P.], seq 300972:301144, ack 73, win 501, length 172
19:46:21.514435 IP lamp-ubuntu-s-1vcpu-1gb-tor1-01.ssh > 198.96.87.75.51219: Flags [P.], seq 301144:301316, ack 73, win 501, length 172
19:46:21.514475 IP lamp-ubuntu-s-1vcpu-1gb-tor1-01.ssh > 198.96.87.75.51219: Flags [P.], seq 301316:301488, ack 73, win 501, length 172
19:46:21.514516 IP lamp-ubuntu-s-1vcpu-1gb-tor1-01.ssh > 198.96.87.75.51219: Flags [P.], seq 301488:301660, ack 73, win 501, length 172
19:46:21.514572 IP lamp-ubuntu-s-1vcpu-1gb-tor1-01.ssh > 198.96.87.75.51219: Flags [P.], seq 301660:301832, ack 73, win 501, length 172
19:46:21.514616 IP lamp-ubuntu-s-1vcpu-1gb-tor1-01.ssh > 198.96.87.75.51219: Flags [P.], seq 301832:302004, ack 73, win 501, length 172
19:46:21.514657 IP lamp-ubuntu-s-1vcpu-1gb-tor1-01.ssh > 198.96.87.75.51219: Flags [P.], seq 302004:302176, ack 73, win 501, length 172
19:46:21.514701 IP lamp-ubuntu-s-1vcpu-1gb-tor1-01.ssh > 198.96.87.75.51219: Flags [P.], seq 302176:302348, ack 73, win 501, length 172
19:46:21.514743 IP lamp-ubuntu-s-1vcpu-1gb-tor1-01.ssh > 198.96.87.75.51219: Flags [P.], seq 302348:302520, ack 73, win 501, length 172
19:46:21.514784 IP lamp-ubuntu-s-1vcpu-1gb-tor1-01.ssh > 198.96.87.75.51219: Flags [P.], seq 302520:302692, ack 73, win 501, length 172
19:46:21.514826 IP lamp-ubuntu-s-1vcpu-1gb-tor1-01.ssh > 198.96.87.75.51219: Flags [P.], seq 302692:302864, ack 73, win 501, length 172
19:46:21.514867 IP lamp-ubuntu-s-1vcpu-1gb-tor1-01.ssh > 198.96.87.75.51219: Flags [P.], seq 302864:303036, ack 73, win 501, length 172
19:46:21.514916 IP lamp-ubuntu-s-1vcpu-1gb-tor1-01.ssh > 198.96.87.75.51219: Flags [P.], seq 303036:303208, ack 73, win 501, length 172
19:46:21.514978 IP lamp-ubuntu-s-1vcpu-1gb-tor1-01.ssh > 198.96.87.75.51219: Flags [P.], seq 303208:303380, ack 73, win 501, length 172
19:46:21.515026 IP lamp-ubuntu-s-1vcpu-1gb-tor1-01.ssh > 198.96.87.75.51219: Flags [P.], seq 303380:303552, ack 73, win 501, length 172
19:46:21.515081 IP lamp-ubuntu-s-1vcpu-1gb-tor1-01.ssh > 198.96.87.75.51219: Flags [P.], seq 303552:303724, ack 73, win 501, length 172
19:46:21.515126 IP lamp-ubuntu-s-1vcpu-1gb-tor1-01.ssh > 198.96.87.75.51219: Flags [P.], seq 303724:303896, ack 73, win 501, length 172
19:46:21.515171 IP lamp-ubuntu-s-1vcpu-1gb-tor1-01.ssh > 198.96.87.75.51219: Flags [P.], seq 303896:304068, ack 73, win 501, length 172
19:46:21.515218 IP lamp-ubuntu-s-1vcpu-1gb-tor1-01.ssh > 198.96.87.75.51219: Flags [P.], seq 304068:304240, ack 73, win 501, length 172
19:46:21.515261 IP lamp-ubuntu-s-1vcpu-1gb-tor1-01.ssh > 198.96.87.75.51219: Flags [P.], seq 304240:304412, ack 73, win 501, length 172
19:46:21.515302 IP lamp-ubuntu-s-1vcpu-1gb-tor1-01.ssh > 198.96.87.75.51219: Flags [P.], seq 304412:304584, ack 73, win 501, length 172
19:46:21.515343 IP lamp-ubuntu-s-1vcpu-1gb-tor1-01.ssh > 198.96.87.75.51219: Flags [P.], seq 304584:304756, ack 73, win 501, length 172
19:46:21.515428 IP lamp-ubuntu-s-1vcpu-1gb-tor1-01.ssh > 198.96.87.75.51219: Flags [P.], seq 304756:304928, ack 73, win 501, length 172
19:46:21.515473 IP lamp-ubuntu-s-1vcpu-1gb-tor1-01.ssh > 198.96.87.75.51219: Flags [P.], seq 304928:305100, ack 73, win 501, length 172
19:46:21.515514 IP lamp-ubuntu-s-1vcpu-1gb-tor1-01.ssh > 198.96.87.75.51219: Flags [P.], seq 305100:305272, ack 73, win 501, length 172
19:46:21.515556 IP lamp-ubuntu-s-1vcpu-1gb-tor1-01.ssh > 198.96.87.75.51219: Flags [P.], seq 305272:305444, ack 73, win 501, length 172
19:46:21.515599 IP lamp-ubuntu-s-1vcpu-1gb-tor1-01.ssh > 198.96.87.75.51219: Flags [P.], seq 305444:305616, ack 73, win 501, length 172
19:46:21.515644 IP lamp-ubuntu-s-1vcpu-1gb-tor1-01.ssh > 198.96.87.75.51219: Flags [P.], seq 305616:305788, ack 73, win 501, length 172
19:46:21.515721 IP lamp-ubuntu-s-1vcpu-1gb-tor1-01.ssh > 198.96.87.75.51219: Flags [P.], seq 305788:305960, ack 73, win 501, length 172
19:46:21.515776 IP lamp-ubuntu-s-1vcpu-1gb-tor1-01.ssh > 198.96.87.75.51219: Flags [P.], seq 305960:306132, ack 73, win 501, length 172
19:46:21.515916 IP lamp-ubuntu-s-1vcpu-1gb-tor1-01.ssh > 198.96.87.75.51219: Flags [P.], seq 306132:306304, ack 73, win 501, length 172
19:46:21.515979 IP lamp-ubuntu-s-1vcpu-1gb-tor1-01.ssh > 198.96.87.75.51219: Flags [P.], seq 306304:306476, ack 73, win 501, length 172
19:46:21.516035 IP lamp-ubuntu-s-1vcpu-1gb-tor1-01.ssh > 198.96.87.75.51219: Flags [P.], seq 306476:306648, ack 73, win 501, length 172
19:46:21.516091 IP lamp-ubuntu-s-1vcpu-1gb-tor1-01.ssh > 198.96.87.75.51219: Flags [P.], seq 306648:306820, ack 73, win 501, length 172
19:46:21.516144 IP lamp-ubuntu-s-1vcpu-1gb-tor1-01.ssh > 198.96.87.75.51219: Flags [P.], seq 306820:306992, ack 73, win 501, length 172
19:46:21.516191 IP lamp-ubuntu-s-1vcpu-1gb-tor1-01.ssh > 198.96.87.75.51219: Flags [P.], seq 306992:307164, ack 73, win 501, length 172
19:46:21.516234 IP lamp-ubuntu-s-1vcpu-1gb-tor1-01.ssh > 198.96.87.75.51219: Flags [P.], seq 307164:307336, ack 73, win 501, length 172
19:46:21.516275 IP lamp-ubuntu-s-1vcpu-1gb-tor1-01.ssh > 198.96.87.75.51219: Flags [P.], seq 307336:307508, ack 73, win 501, length 172
19:46:21.516316 IP lamp-ubuntu-s-1vcpu-1gb-tor1-01.ssh > 198.96.87.75.51219: Flags [P.], seq 307508:307680, ack 73, win 501, length 172
19:46:21.516356 IP lamp-ubuntu-s-1vcpu-1gb-tor1-01.ssh > 198.96.87.75.51219: Flags [P.], seq 307680:307852, ack 73, win 501, length 172
19:46:21.516396 IP lamp-ubuntu-s-1vcpu-1gb-tor1-01.ssh > 198.96.87.75.51219: Flags [P.], seq 307852:308024, ack 73, win 501, length 172
19:46:21.516436 IP lamp-ubuntu-s-1vcpu-1gb-tor1-01.ssh > 198.96.87.75.51219: Flags [P.], seq 308024:308196, ack 73, win 501, length 172
19:46:21.516476 IP lamp-ubuntu-s-1vcpu-1gb-tor1-01.ssh > 198.96.87.75.51219: Flags [P.], seq 308196:308368, ack 73, win 501, length 172
19:46:21.516517 IP lamp-ubuntu-s-1vcpu-1gb-tor1-01.ssh > 198.96.87.75.51219: Flags [P.], seq 308368:308540, ack 73, win 501, length 172
19:46:21.516559 IP lamp-ubuntu-s-1vcpu-1gb-tor1-01.ssh > 198.96.87.75.51219: Flags [P.], seq 308540:308712, ack 73, win 501, length 172
19:46:21.516599 IP lamp-ubuntu-s-1vcpu-1gb-tor1-01.ssh > 198.96.87.75.51219: Flags [P.], seq 308712:308884, ack 73, win 501, length 172
19:46:21.516642 IP lamp-ubuntu-s-1vcpu-1gb-tor1-01.ssh > 198.96.87.75.51219: Flags [P.], seq 308884:309056, ack 73, win 501, length 172
19:46:21.516700 IP lamp-ubuntu-s-1vcpu-1gb-tor1-01.ssh > 198.96.87.75.51219: Flags [P.], seq 309056:309228, ack 73, win 501, length 172
19:46:21.516744 IP lamp-ubuntu-s-1vcpu-1gb-tor1-01.ssh > 198.96.87.75.51219: Flags [P.], seq 309228:309400, ack 73, win 501, length 172
19:46:21.516920 IP lamp-ubuntu-s-1vcpu-1gb-tor1-01.ssh > 198.96.87.75.51219: Flags [P.], seq 309400:309572, ack 73, win 501, length 172
19:46:21.516985 IP lamp-ubuntu-s-1vcpu-1gb-tor1-01.ssh > 198.96.87.75.51219: Flags [P.], seq 309572:309744, ack 73, win 501, length 172
19:46:21.517029 IP lamp-ubuntu-s-1vcpu-1gb-tor1-01.ssh > 198.96.87.75.51219: Flags [P.], seq 309744:309916, ack 73, win 501, length 172
19:46:21.517077 IP lamp-ubuntu-s-1vcpu-1gb-tor1-01.ssh > 198.96.87.75.51219: Flags [P.], seq 309916:310088, ack 73, win 501, length 172
19:46:21.517118 IP lamp-ubuntu-s-1vcpu-1gb-tor1-01.ssh > 198.96.87.75.51219: Flags [P.], seq 310088:310260, ack 73, win 501, length 172
19:46:21.517172 IP lamp-ubuntu-s-1vcpu-1gb-tor1-01.ssh > 198.96.87.75.51219: Flags [P.], seq 310260:310432, ack 73, win 501, length 172
19:46:21.517218 IP lamp-ubuntu-s-1vcpu-1gb-tor1-01.ssh > 198.96.87.75.51219: Flags [P.], seq 310432:310604, ack 73, win 501, length 172
19:46:21.517263 IP lamp-ubuntu-s-1vcpu-1gb-tor1-01.ssh > 198.96.87.75.51219: Flags [P.], seq 310604:310776, ack 73, win 501, length 172
19:46:21.517305 IP lamp-ubuntu-s-1vcpu-1gb-tor1-01.ssh > 198.96.87.75.51219: Flags [P.], seq 310776:310948, ack 73, win 501, length 172
19:46:21.517345 IP lamp-ubuntu-s-1vcpu-1gb-tor1-01.ssh > 198.96.87.75.51219: Flags [P.], seq 310948:311120, ack 73, win 501, length 172
19:46:21.517386 IP lamp-ubuntu-s-1vcpu-1gb-tor1-01.ssh > 198.96.87.75.51219: Flags [P.], seq 311120:311292, ack 73, win 501, length 172
19:46:21.517428 IP lamp-ubuntu-s-1vcpu-1gb-tor1-01.ssh > 198.96.87.75.51219: Flags [P.], seq 311292:311464, ack 73, win 501, length 172
19:46:21.517474 IP lamp-ubuntu-s-1vcpu-1gb-tor1-01.ssh > 198.96.87.75.51219: Flags [P.], seq 311464:311636, ack 73, win 501, length 172
19:46:21.517514 IP lamp-ubuntu-s-1vcpu-1gb-tor1-01.ssh > 198.96.87.75.51219: Flags [P.], seq 311636:311808, ack 73, win 501, length 172
19:46:21.517555 IP lamp-ubuntu-s-1vcpu-1gb-tor1-01.ssh > 198.96.87.75.51219: Flags [P.], seq 311808:311980, ack 73, win 501, length 172
19:46:21.517596 IP lamp-ubuntu-s-1vcpu-1gb-tor1-01.ssh > 198.96.87.75.51219: Flags [P.], seq 311980:312152, ack 73, win 501, length 172
19:46:21.517643 IP lamp-ubuntu-s-1vcpu-1gb-tor1-01.ssh > 198.96.87.75.51219: Flags [P.], seq 312152:312324, ack 73, win 501, length 172
19:46:21.523093 IP 198.96.87.75.51219 > lamp-ubuntu-s-1vcpu-1gb-tor1-01.ssh: Flags [.], ack 310604, win 305, length 0
19:46:21.523094 IP 198.96.87.75.51219 > lamp-ubuntu-s-1vcpu-1gb-tor1-01.ssh: Flags [.], ack 312324, win 298, length 0
19:46:21.523215 IP lamp-ubuntu-s-1vcpu-1gb-tor1-01.ssh > 198.96.87.75.51219: Flags [P.], seq 312324:312496, ack 73, win 501, length 172
19:46:21.523376 IP lamp-ubuntu-s-1vcpu-1gb-tor1-01.ssh > 198.96.87.75.51219: Flags [P.], seq 312496:312908, ack 73, win 501, length 412
19:46:21.523425 IP lamp-ubuntu-s-1vcpu-1gb-tor1-01.ssh > 198.96.87.75.51219: Flags [P.], seq 312908:313080, ack 73, win 501, length 172
19:46:21.523468 IP lamp-ubuntu-s-1vcpu-1gb-tor1-01.ssh > 198.96.87.75.51219: Flags [P.], seq 313080:313252, ack 73, win 501, length 172
19:46:21.523510 IP lamp-ubuntu-s-1vcpu-1gb-tor1-01.ssh > 198.96.87.75.51219: Flags [P.], seq 313252:313424, ack 73, win 501, length 172
19:46:21.523552 IP lamp-ubuntu-s-1vcpu-1gb-tor1-01.ssh > 198.96.87.75.51219: Flags [P.], seq 313424:313596, ack 73, win 501, length 172
19:46:21.523594 IP lamp-ubuntu-s-1vcpu-1gb-tor1-01.ssh > 198.96.87.75.51219: Flags [P.], seq 313596:313768, ack 73, win 501, length 172
19:46:21.523636 IP lamp-ubuntu-s-1vcpu-1gb-tor1-01.ssh > 198.96.87.75.51219: Flags [P.], seq 313768:313940, ack 73, win 501, length 172
19:46:21.523678 IP lamp-ubuntu-s-1vcpu-1gb-tor1-01.ssh > 198.96.87.75.51219: Flags [P.], seq 313940:314112, ack 73, win 501, length 172
19:46:21.523739 IP lamp-ubuntu-s-1vcpu-1gb-tor1-01.ssh > 198.96.87.75.51219: Flags [P.], seq 314112:314284, ack 73, win 501, length 172
19:46:21.523788 IP lamp-ubuntu-s-1vcpu-1gb-tor1-01.ssh > 198.96.87.75.51219: Flags [P.], seq 314284:314456, ack 73, win 501, length 172
19:46:21.523885 IP lamp-ubuntu-s-1vcpu-1gb-tor1-01.ssh > 198.96.87.75.51219: Flags [P.], seq 314456:314628, ack 73, win 501, length 172
19:46:21.523929 IP lamp-ubuntu-s-1vcpu-1gb-tor1-01.ssh > 198.96.87.75.51219: Flags [P.], seq 314628:314800, ack 73, win 501, length 172
19:46:21.523970 IP lamp-ubuntu-s-1vcpu-1gb-tor1-01.ssh > 198.96.87.75.51219: Flags [P.], seq 314800:314972, ack 73, win 501, length 172
19:46:21.524028 IP lamp-ubuntu-s-1vcpu-1gb-tor1-01.ssh > 198.96.87.75.51219: Flags [P.], seq 314972:315144, ack 73, win 501, length 172
19:46:21.524090 IP lamp-ubuntu-s-1vcpu-1gb-tor1-01.ssh > 198.96.87.75.51219: Flags [P.], seq 315144:315316, ack 73, win 501, length 172
19:46:21.524148 IP lamp-ubuntu-s-1vcpu-1gb-tor1-01.ssh > 198.96.87.75.51219: Flags [P.], seq 315316:315488, ack 73, win 501, length 172
19:46:21.524198 IP lamp-ubuntu-s-1vcpu-1gb-tor1-01.ssh > 198.96.87.75.51219: Flags [P.], seq 315488:315660, ack 73, win 501, length 172
19:46:21.524241 IP lamp-ubuntu-s-1vcpu-1gb-tor1-01.ssh > 198.96.87.75.51219: Flags [P.], seq 315660:315832, ack 73, win 501, length 172
19:46:21.524283 IP lamp-ubuntu-s-1vcpu-1gb-tor1-01.ssh > 198.96.87.75.51219: Flags [P.], seq 315832:316004, ack 73, win 501, length 172
19:46:21.524324 IP lamp-ubuntu-s-1vcpu-1gb-tor1-01.ssh > 198.96.87.75.51219: Flags [P.], seq 316004:316176, ack 73, win 501, length 172
19:46:21.524366 IP lamp-ubuntu-s-1vcpu-1gb-tor1-01.ssh > 198.96.87.75.51219: Flags [P.], seq 316176:316348, ack 73, win 501, length 172
19:46:21.524407 IP lamp-ubuntu-s-1vcpu-1gb-tor1-01.ssh > 198.96.87.75.51219: Flags [P.], seq 316348:316520, ack 73, win 501, length 172
19:46:21.524448 IP lamp-ubuntu-s-1vcpu-1gb-tor1-01.ssh > 198.96.87.75.51219: Flags [P.], seq 316520:316692, ack 73, win 501, length 172
19:46:21.524495 IP lamp-ubuntu-s-1vcpu-1gb-tor1-01.ssh > 198.96.87.75.51219: Flags [P.], seq 316692:316864, ack 73, win 501, length 172
19:46:21.524549 IP lamp-ubuntu-s-1vcpu-1gb-tor1-01.ssh > 198.96.87.75.51219: Flags [P.], seq 316864:317036, ack 73, win 501, length 172
19:46:21.524593 IP lamp-ubuntu-s-1vcpu-1gb-tor1-01.ssh > 198.96.87.75.51219: Flags [P.], seq 317036:317208, ack 73, win 501, length 172
19:46:21.524634 IP lamp-ubuntu-s-1vcpu-1gb-tor1-01.ssh > 198.96.87.75.51219: Flags [P.], seq 317208:317380, ack 73, win 501, length 172
19:46:21.524675 IP lamp-ubuntu-s-1vcpu-1gb-tor1-01.ssh > 198.96.87.75.51219: Flags [P.], seq 317380:317552, ack 73, win 501, length 172
19:46:21.524716 IP lamp-ubuntu-s-1vcpu-1gb-tor1-01.ssh > 198.96.87.75.51219: Flags [P.], seq 317552:317724, ack 73, win 501, length 172
19:46:21.524757 IP lamp-ubuntu-s-1vcpu-1gb-tor1-01.ssh > 198.96.87.75.51219: Flags [P.], seq 317724:317896, ack 73, win 501, length 172
19:46:21.524801 IP lamp-ubuntu-s-1vcpu-1gb-tor1-01.ssh > 198.96.87.75.51219: Flags [P.], seq 317896:318068, ack 73, win 501, length 172
19:46:21.524842 IP lamp-ubuntu-s-1vcpu-1gb-tor1-01.ssh > 198.96.87.75.51219: Flags [P.], seq 318068:318240, ack 73, win 501, length 172
19:46:21.524883 IP lamp-ubuntu-s-1vcpu-1gb-tor1-01.ssh > 198.96.87.75.51219: Flags [P.], seq 318240:318412, ack 73, win 501, length 172
19:46:21.524925 IP lamp-ubuntu-s-1vcpu-1gb-tor1-01.ssh > 198.96.87.75.51219: Flags [P.], seq 318412:318584, ack 73, win 501, length 172
19:46:21.524968 IP lamp-ubuntu-s-1vcpu-1gb-tor1-01.ssh > 198.96.87.75.51219: Flags [P.], seq 318584:318756, ack 73, win 501, length 172
19:46:21.525018 IP lamp-ubuntu-s-1vcpu-1gb-tor1-01.ssh > 198.96.87.75.51219: Flags [P.], seq 318756:318928, ack 73, win 501, length 172
19:46:21.525064 IP lamp-ubuntu-s-1vcpu-1gb-tor1-01.ssh > 198.96.87.75.51219: Flags [P.], seq 318928:319100, ack 73, win 501, length 172
19:46:21.525106 IP lamp-ubuntu-s-1vcpu-1gb-tor1-01.ssh > 198.96.87.75.51219: Flags [P.], seq 319100:319272, ack 73, win 501, length 172
19:46:21.525147 IP lamp-ubuntu-s-1vcpu-1gb-tor1-01.ssh > 198.96.87.75.51219: Flags [P.], seq 319272:319444, ack 73, win 501, length 172
19:46:21.525197 IP lamp-ubuntu-s-1vcpu-1gb-tor1-01.ssh > 198.96.87.75.51219: Flags [P.], seq 319444:319616, ack 73, win 501, length 172
19:46:21.525256 IP lamp-ubuntu-s-1vcpu-1gb-tor1-01.ssh > 198.96.87.75.51219: Flags [P.], seq 319616:319788, ack 73, win 501, length 172
19:46:21.525307 IP lamp-ubuntu-s-1vcpu-1gb-tor1-01.ssh > 198.96.87.75.51219: Flags [P.], seq 319788:319960, ack 73, win 501, length 172
19:46:21.525350 IP lamp-ubuntu-s-1vcpu-1gb-tor1-01.ssh > 198.96.87.75.51219: Flags [P.], seq 319960:320132, ack 73, win 501, length 172
19:46:21.525391 IP lamp-ubuntu-s-1vcpu-1gb-tor1-01.ssh > 198.96.87.75.51219: Flags [P.], seq 320132:320304, ack 73, win 501, length 172
19:46:21.525432 IP lamp-ubuntu-s-1vcpu-1gb-tor1-01.ssh > 198.96.87.75.51219: Flags [P.], seq 320304:320476, ack 73, win 501, length 172
19:46:21.525521 IP lamp-ubuntu-s-1vcpu-1gb-tor1-01.ssh > 198.96.87.75.51219: Flags [P.], seq 320476:320648, ack 73, win 501, length 172
19:46:21.525566 IP lamp-ubuntu-s-1vcpu-1gb-tor1-01.ssh > 198.96.87.75.51219: Flags [P.], seq 320648:320820, ack 73, win 501, length 172
19:46:21.525607 IP lamp-ubuntu-s-1vcpu-1gb-tor1-01.ssh > 198.96.87.75.51219: Flags [P.], seq 320820:320992, ack 73, win 501, length 172
19:46:21.525647 IP lamp-ubuntu-s-1vcpu-1gb-tor1-01.ssh > 198.96.87.75.51219: Flags [P.], seq 320992:321164, ack 73, win 501, length 172
19:46:21.525688 IP lamp-ubuntu-s-1vcpu-1gb-tor1-01.ssh > 198.96.87.75.51219: Flags [P.], seq 321164:321336, ack 73, win 501, length 172
19:46:21.525734 IP lamp-ubuntu-s-1vcpu-1gb-tor1-01.ssh > 198.96.87.75.51219: Flags [P.], seq 321336:321508, ack 73, win 501, length 172
19:46:21.525811 IP lamp-ubuntu-s-1vcpu-1gb-tor1-01.ssh > 198.96.87.75.51219: Flags [P.], seq 321508:321680, ack 73, win 501, length 172
19:46:21.525856 IP lamp-ubuntu-s-1vcpu-1gb-tor1-01.ssh > 198.96.87.75.51219: Flags [P.], seq 321680:321852, ack 73, win 501, length 172
19:46:21.525899 IP lamp-ubuntu-s-1vcpu-1gb-tor1-01.ssh > 198.96.87.75.51219: Flags [P.], seq 321852:322024, ack 73, win 501, length 172
19:46:21.525942 IP lamp-ubuntu-s-1vcpu-1gb-tor1-01.ssh > 198.96.87.75.51219: Flags [P.], seq 322024:322196, ack 73, win 501, length 172
19:46:21.525983 IP lamp-ubuntu-s-1vcpu-1gb-tor1-01.ssh > 198.96.87.75.51219: Flags [P.], seq 322196:322368, ack 73, win 501, length 172
19:46:21.526024 IP lamp-ubuntu-s-1vcpu-1gb-tor1-01.ssh > 198.96.87.75.51219: Flags [P.], seq 322368:322540, ack 73, win 501, length 172
19:46:21.526065 IP lamp-ubuntu-s-1vcpu-1gb-tor1-01.ssh > 198.96.87.75.51219: Flags [P.], seq 322540:322712, ack 73, win 501, length 172
19:46:21.526106 IP lamp-ubuntu-s-1vcpu-1gb-tor1-01.ssh > 198.96.87.75.51219: Flags [P.], seq 322712:322884, ack 73, win 501, length 172
19:46:21.526147 IP lamp-ubuntu-s-1vcpu-1gb-tor1-01.ssh > 198.96.87.75.51219: Flags [P.], seq 322884:323056, ack 73, win 501, length 172
19:46:21.526200 IP lamp-ubuntu-s-1vcpu-1gb-tor1-01.ssh > 198.96.87.75.51219: Flags [P.], seq 323056:323228, ack 73, win 501, length 172
19:46:21.526242 IP lamp-ubuntu-s-1vcpu-1gb-tor1-01.ssh > 198.96.87.75.51219: Flags [P.], seq 323228:323400, ack 73, win 501, length 172
19:46:21.526283 IP lamp-ubuntu-s-1vcpu-1gb-tor1-01.ssh > 198.96.87.75.51219: Flags [P.], seq 323400:323572, ack 73, win 501, length 172
19:46:21.526324 IP lamp-ubuntu-s-1vcpu-1gb-tor1-01.ssh > 198.96.87.75.51219: Flags [P.], seq 323572:323744, ack 73, win 501, length 172
19:46:21.526376 IP lamp-ubuntu-s-1vcpu-1gb-tor1-01.ssh > 198.96.87.75.51219: Flags [P.], seq 323744:323916, ack 73, win 501, length 172
19:46:21.526423 IP lamp-ubuntu-s-1vcpu-1gb-tor1-01.ssh > 198.96.87.75.51219: Flags [P.], seq 323916:324088, ack 73, win 501, length 172
19:46:21.526468 IP lamp-ubuntu-s-1vcpu-1gb-tor1-01.ssh > 198.96.87.75.51219: Flags [P.], seq 324088:324260, ack 73, win 501, length 172
19:46:21.526515 IP lamp-ubuntu-s-1vcpu-1gb-tor1-01.ssh > 198.96.87.75.51219: Flags [P.], seq 324260:324432, ack 73, win 501, length 172
19:46:21.526562 IP lamp-ubuntu-s-1vcpu-1gb-tor1-01.ssh > 198.96.87.75.51219: Flags [P.], seq 324432:324604, ack 73, win 501, length 172
19:46:21.526613 IP lamp-ubuntu-s-1vcpu-1gb-tor1-01.ssh > 198.96.87.75.51219: Flags [P.], seq 324604:324776, ack 73, win 501, length 172
19:46:21.526658 IP lamp-ubuntu-s-1vcpu-1gb-tor1-01.ssh > 198.96.87.75.51219: Flags [P.], seq 324776:324948, ack 73, win 501, length 172
19:46:21.526716 IP lamp-ubuntu-s-1vcpu-1gb-tor1-01.ssh > 198.96.87.75.51219: Flags [P.], seq 324948:325120, ack 73, win 501, length 172
19:46:21.526799 IP lamp-ubuntu-s-1vcpu-1gb-tor1-01.ssh > 198.96.87.75.51219: Flags [P.], seq 325120:325292, ack 73, win 501, length 172
19:46:21.526846 IP lamp-ubuntu-s-1vcpu-1gb-tor1-01.ssh > 198.96.87.75.51219: Flags [P.], seq 325292:325464, ack 73, win 501, length 172
19:46:21.526888 IP lamp-ubuntu-s-1vcpu-1gb-tor1-01.ssh > 198.96.87.75.51219: Flags [P.], seq 325464:325636, ack 73, win 501, length 172
19:46:21.526930 IP lamp-ubuntu-s-1vcpu-1gb-tor1-01.ssh > 198.96.87.75.51219: Flags [P.], seq 325636:325808, ack 73, win 501, length 172
19:46:21.526972 IP lamp-ubuntu-s-1vcpu-1gb-tor1-01.ssh > 198.96.87.75.51219: Flags [P.], seq 325808:325980, ack 73, win 501, length 172
19:46:21.527013 IP lamp-ubuntu-s-1vcpu-1gb-tor1-01.ssh > 198.96.87.75.51219: Flags [P.], seq 325980:326152, ack 73, win 501, length 172
19:46:21.527054 IP lamp-ubuntu-s-1vcpu-1gb-tor1-01.ssh > 198.96.87.75.51219: Flags [P.], seq 326152:326324, ack 73, win 501, length 172
19:46:21.527095 IP lamp-ubuntu-s-1vcpu-1gb-tor1-01.ssh > 198.96.87.75.51219: Flags [P.], seq 326324:326496, ack 73, win 501, length 172
19:46:21.527144 IP lamp-ubuntu-s-1vcpu-1gb-tor1-01.ssh > 198.96.87.75.51219: Flags [P.], seq 326496:326668, ack 73, win 501, length 172
19:46:21.527195 IP lamp-ubuntu-s-1vcpu-1gb-tor1-01.ssh > 198.96.87.75.51219: Flags [P.], seq 326668:326840, ack 73, win 501, length 172
19:46:21.527253 IP lamp-ubuntu-s-1vcpu-1gb-tor1-01.ssh > 198.96.87.75.51219: Flags [P.], seq 326840:327012, ack 73, win 501, length 172
19:46:21.527295 IP lamp-ubuntu-s-1vcpu-1gb-tor1-01.ssh > 198.96.87.75.51219: Flags [P.], seq 327012:327184, ack 73, win 501, length 172
19:46:21.527336 IP lamp-ubuntu-s-1vcpu-1gb-tor1-01.ssh > 198.96.87.75.51219: Flags [P.], seq 327184:327356, ack 73, win 501, length 172
19:46:21.527377 IP lamp-ubuntu-s-1vcpu-1gb-tor1-01.ssh > 198.96.87.75.51219: Flags [P.], seq 327356:327528, ack 73, win 501, length 172
19:46:21.527426 IP lamp-ubuntu-s-1vcpu-1gb-tor1-01.ssh > 198.96.87.75.51219: Flags [P.], seq 327528:327700, ack 73, win 501, length 172
19:46:21.527469 IP lamp-ubuntu-s-1vcpu-1gb-tor1-01.ssh > 198.96.87.75.51219: Flags [P.], seq 327700:327872, ack 73, win 501, length 172
19:46:21.527513 IP lamp-ubuntu-s-1vcpu-1gb-tor1-01.ssh > 198.96.87.75.51219: Flags [P.], seq 327872:328044, ack 73, win 501, length 172
19:46:21.527557 IP lamp-ubuntu-s-1vcpu-1gb-tor1-01.ssh > 198.96.87.75.51219: Flags [P.], seq 328044:328216, ack 73, win 501, length 172
19:46:21.527607 IP lamp-ubuntu-s-1vcpu-1gb-tor1-01.ssh > 198.96.87.75.51219: Flags [P.], seq 328216:328388, ack 73, win 501, length 172
19:46:21.527649 IP lamp-ubuntu-s-1vcpu-1gb-tor1-01.ssh > 198.96.87.75.51219: Flags [P.], seq 328388:328560, ack 73, win 501, length 172
19:46:21.527692 IP lamp-ubuntu-s-1vcpu-1gb-tor1-01.ssh > 198.96.87.75.51219: Flags [P.], seq 328560:328732, ack 73, win 501, length 172
19:46:21.527744 IP lamp-ubuntu-s-1vcpu-1gb-tor1-01.ssh > 198.96.87.75.51219: Flags [P.], seq 328732:328904, ack 73, win 501, length 172
19:46:21.527800 IP lamp-ubuntu-s-1vcpu-1gb-tor1-01.ssh > 198.96.87.75.51219: Flags [P.], seq 328904:329076, ack 73, win 501, length 172
19:46:21.527932 IP lamp-ubuntu-s-1vcpu-1gb-tor1-01.ssh > 198.96.87.75.51219: Flags [P.], seq 329076:329248, ack 73, win 501, length 172
19:46:21.527977 IP lamp-ubuntu-s-1vcpu-1gb-tor1-01.ssh > 198.96.87.75.51219: Flags [P.], seq 329248:329420, ack 73, win 501, length 172
19:46:21.528020 IP lamp-ubuntu-s-1vcpu-1gb-tor1-01.ssh > 198.96.87.75.51219: Flags [P.], seq 329420:329592, ack 73, win 501, length 172
19:46:21.528065 IP lamp-ubuntu-s-1vcpu-1gb-tor1-01.ssh > 198.96.87.75.51219: Flags [P.], seq 329592:329764, ack 73, win 501, length 172
19:46:21.528113 IP lamp-ubuntu-s-1vcpu-1gb-tor1-01.ssh > 198.96.87.75.51219: Flags [P.], seq 329764:329936, ack 73, win 501, length 172
19:46:21.528156 IP lamp-ubuntu-s-1vcpu-1gb-tor1-01.ssh > 198.96.87.75.51219: Flags [P.], seq 329936:330108, ack 73, win 501, length 172
19:46:21.528199 IP lamp-ubuntu-s-1vcpu-1gb-tor1-01.ssh > 198.96.87.75.51219: Flags [P.], seq 330108:330280, ack 73, win 501, length 172
