root@lamp-ubuntu-s-1vcpu-1gb-tor1-01:~# tcpdump -c 5 -i eth0
tcpdump: verbose output suppressed, use -v or -vv for full protocol decode
listening on eth0, link-type EN10MB (Ethernet), capture size 262144 bytes
19:37:18.661477 IP lamp-ubuntu-s-1vcpu-1gb-tor1-01.ssh > 198.96.87.75.51219: Flags [P.], seq 281571506:281571614, ack 2445245977, win 501, length 108
19:37:18.661544 IP lamp-ubuntu-s-1vcpu-1gb-tor1-01.ssh > 198.96.87.75.51219: Flags [P.], seq 108:252, ack 1, win 501, length 144
19:37:18.661594 IP lamp-ubuntu-s-1vcpu-1gb-tor1-01.ssh > 198.96.87.75.51219: Flags [P.], seq 252:288, ack 1, win 501, length 36
19:37:18.662386 IP lamp-ubuntu-s-1vcpu-1gb-tor1-01.53111 > 67.207.67.2.domain: 32436+ [1au] PTR? 75.87.96.198.in-addr.arpa. (54)
19:37:18.662463 IP lamp-ubuntu-s-1vcpu-1gb-tor1-01.44539 > 67.207.67.2.domain: 37791+ [1au] PTR? 75.87.96.198.in-addr.arpa. (54)
5 packets captured
40 packets received by filter
5 packets dropped by kernel
root@lamp-ubuntu-s-1vcpu-1gb-tor1-01:~#