root@lamp-ubuntu-s-1vcpu-1gb-tor1-01:~# tcpdump -r 0001.pcap
reading from file 0001.pcap, link-type EN10MB (Ethernet)
19:40:59.234552 IP lamp-ubuntu-s-1vcpu-1gb-tor1-01.ssh > 198.96.87.75.51219: Flags [P.], seq 284340530:284340574, ack 2445248561, win 501, length 44
19:40:59.234619 IP lamp-ubuntu-s-1vcpu-1gb-tor1-01.ssh > 198.96.87.75.51219: Flags [P.], seq 44:152, ack 1, win 501, length 108
19:40:59.234661 IP lamp-ubuntu-s-1vcpu-1gb-tor1-01.ssh > 198.96.87.75.51219: Flags [P.], seq 152:188, ack 1, win 501, length 36
19:40:59.238218 IP 198.96.87.75.51219 > lamp-ubuntu-s-1vcpu-1gb-tor1-01.ssh: Flags [.], ack 188, win 508, length 0
19:41:15.124064 IP 89.248.163.80.53699 > lamp-ubuntu-s-1vcpu-1gb-tor1-01.40702: Flags [S], seq 1404114786, win 1024, length 0
19:41:35.827065 IP 61.177.172.90.57398 > lamp-ubuntu-s-1vcpu-1gb-tor1-01.ssh: Flags [S], seq 3122246587, win 29200, options [mss 1460,sackOK,TS val 8590958 ecr 0,nop,wscale 7], length 0
19:41:35.827121 IP lamp-ubuntu-s-1vcpu-1gb-tor1-01.ssh > 61.177.172.90.57398: Flags [S.], seq 1679566086, ack 3122246588, win 65160, options [mss 1460,sackOK,TS val 3523367775 ecr 8590958,nop,wscale 7], length 0
19:41:36.053056 IP 61.177.172.90.57398 > lamp-ubuntu-s-1vcpu-1gb-tor1-01.ssh: Flags [.], ack 1, win 229, options [nop,nop,TS val 8591013 ecr 3523367775], length 0
19:41:36.053057 IP 61.177.172.90.57398 > lamp-ubuntu-s-1vcpu-1gb-tor1-01.ssh: Flags [P.], seq 1:16, ack 1, win 229, options [nop,nop,TS val 8591013 ecr 3523367775], length 15
19:41:36.064138 IP lamp-ubuntu-s-1vcpu-1gb-tor1-01.ssh > 61.177.172.90.57398: Flags [P.], seq 1:42, ack 1, win 510, options [nop,nop,TS val 3523368012 ecr 8591013], length 41
19:41:36.271538 IP 61.177.172.90.57398 > lamp-ubuntu-s-1vcpu-1gb-tor1-01.ssh: Flags [.], ack 42, win 229, options [nop,nop,TS val 8591069 ecr 3523368012], length 0
19:41:36.659653 IP 89.248.163.80.53699 > lamp-ubuntu-s-1vcpu-1gb-tor1-01.42601: Flags [S], seq 1720238904, win 1024, length 0
19:41:36.709498 IP 61.177.172.90.57398 > lamp-ubuntu-s-1vcpu-1gb-tor1-01.ssh: Flags [P.], seq 16:872, ack 42, win 229, options [nop,nop,TS val 8591179 ecr 3523368012], length 856
19:41:37.373265 IP 61.177.172.90.57398 > lamp-ubuntu-s-1vcpu-1gb-tor1-01.ssh: Flags [P.], seq 1:872, ack 42, win 229, options [nop,nop,TS val 8591345 ecr 3523368012], length 871
19:41:37.373323 IP lamp-ubuntu-s-1vcpu-1gb-tor1-01.ssh > 61.177.172.90.57398: Flags [.], ack 872, win 504, options [nop,nop,TS val 3523369322 ecr 8591345], length 0
19:41:37.374935 IP lamp-ubuntu-s-1vcpu-1gb-tor1-01.ssh > 61.177.172.90.57398: Flags [P.], seq 42:1098, ack 872, win 504, options [nop,nop,TS val 3523369323 ecr 8591345], length 1056
19:41:38.050254 IP lamp-ubuntu-s-1vcpu-1gb-tor1-01.ssh > 61.177.172.90.57398: Flags [P.], seq 42:1098, ack 872, win 504, options [nop,nop,TS val 3523369999 ecr 8591345], length 1056
19:41:38.754241 IP lamp-ubuntu-s-1vcpu-1gb-tor1-01.ssh > 61.177.172.90.57398: Flags [P.], seq 42:1098, ack 872, win 504, options [nop,nop,TS val 3523370703 ecr 8591345], length 1056
19:41:40.130230 IP lamp-ubuntu-s-1vcpu-1gb-tor1-01.ssh > 61.177.172.90.57398: Flags [P.], seq 42:1098, ack 872, win 504, options [nop,nop,TS val 3523372079 ecr 8591345], length 1056
19:41:43.074218 IP lamp-ubuntu-s-1vcpu-1gb-tor1-01.ssh > 61.177.172.90.57398: Flags [P.], seq 42:1098, ack 872, win 504, options [nop,nop,TS val 3523375022 ecr 8591345], length 1056
19:41:48.706229 IP lamp-ubuntu-s-1vcpu-1gb-tor1-01.ssh > 61.177.172.90.57398: Flags [P.], seq 42:1098, ack 872, win 504, options [nop,nop,TS val 3523380655 ecr 8591345], length 1056
19:41:52.625859 IP recyber.net.55324 > lamp-ubuntu-s-1vcpu-1gb-tor1-01.17474: Flags [S], seq 4057695314, win 1024, length 0
19:41:53.638279 IP cpe-66-27-166-127.dc.res.rr.com.45638 > lamp-ubuntu-s-1vcpu-1gb-tor1-01.telnet: Flags [S], seq 2680884245, win 59925, length 0
19:41:53.784094 IP 179.60.147.157.24366 > lamp-ubuntu-s-1vcpu-1gb-tor1-01.ssh: Flags [S], seq 3753545169, win 16060, options [mss 1460,sackOK,TS val 112439270 ecr 0,nop,wscale 14], length 0
19:41:53.784231 IP lamp-ubuntu-s-1vcpu-1gb-tor1-01.ssh > 179.60.147.157.24366: Flags [S.], seq 4237718318, ack 3753545170, win 65160, options [mss 1460,sackOK,TS val 2782899488 ecr 112439270,nop,wscale 7], length 0
19:41:53.878125 IP 179.60.147.157.24366 > lamp-ubuntu-s-1vcpu-1gb-tor1-01.ssh: Flags [.], ack 1, win 1, options [nop,nop,TS val 112439365 ecr 2782899488], length 0
19:41:53.889587 IP lamp-ubuntu-s-1vcpu-1gb-tor1-01.ssh > 179.60.147.157.24366: Flags [P.], seq 1:42, ack 1, win 510, options [nop,nop,TS val 2782899593 ecr 112439365], length 41
19:41:53.983038 IP 179.60.147.157.24366 > lamp-ubuntu-s-1vcpu-1gb-tor1-01.ssh: Flags [.], ack 42, win 1, options [nop,nop,TS val 112439469 ecr 2782899593], length 0
19:41:54.406377 IP 179.60.147.157.24366 > lamp-ubuntu-s-1vcpu-1gb-tor1-01.ssh: Flags [P.], seq 1:22, ack 42, win 1, options [nop,nop,TS val 112439893 ecr 2782899593], length 21
19:41:54.406377 IP 179.60.147.157.24366 > lamp-ubuntu-s-1vcpu-1gb-tor1-01.ssh: Flags [.], seq 22:1470, ack 42, win 1, options [nop,nop,TS val 112439893 ecr 2782899593], length 1448
19:41:54.406433 IP lamp-ubuntu-s-1vcpu-1gb-tor1-01.ssh > 179.60.147.157.24366: Flags [.], ack 22, win 510, options [nop,nop,TS val 2782900110 ecr 112439893], length 0
19:41:54.406460 IP lamp-ubuntu-s-1vcpu-1gb-tor1-01.ssh > 179.60.147.157.24366: Flags [.], ack 1470, win 501, options [nop,nop,TS val 2782900110 ecr 112439893], length 0
19:41:54.407985 IP lamp-ubuntu-s-1vcpu-1gb-tor1-01.ssh > 179.60.147.157.24366: Flags [P.], seq 42:1098, ack 1470, win 501, options [nop,nop,TS val 2782900111 ecr 112439893], length 1056
19:41:54.499985 IP 179.60.147.157.24366 > lamp-ubuntu-s-1vcpu-1gb-tor1-01.ssh: Flags [P.], seq 1470:2086, ack 42, win 1, options [nop,nop,TS val 112439986 ecr 2782900110], length 616
19:41:54.500027 IP lamp-ubuntu-s-1vcpu-1gb-tor1-01.ssh > 179.60.147.157.24366: Flags [.], ack 2086, win 501, options [nop,nop,TS val 2782900203 ecr 112439986], length 0
19:41:54.501495 IP 179.60.147.157.24366 > lamp-ubuntu-s-1vcpu-1gb-tor1-01.ssh: Flags [.], ack 1098, win 1, options [nop,nop,TS val 112439988 ecr 2782900111], length 0
19:41:54.668688 IP 179.60.147.157.24366 > lamp-ubuntu-s-1vcpu-1gb-tor1-01.ssh: Flags [P.], seq 2086:2358, ack 1098, win 1, options [nop,nop,TS val 112440155 ecr 2782900203], length 272
19:41:54.668738 IP lamp-ubuntu-s-1vcpu-1gb-tor1-01.ssh > 179.60.147.157.24366: Flags [.], ack 2358, win 501, options [nop,nop,TS val 2782900372 ecr 112440155], length 0
19:41:54.672418 IP lamp-ubuntu-s-1vcpu-1gb-tor1-01.ssh > 179.60.147.157.24366: Flags [P.], seq 1098:1846, ack 2358, win 501, options [nop,nop,TS val 2782900376 ecr 112440155], length 748
19:41:54.765841 IP 179.60.147.157.24366 > lamp-ubuntu-s-1vcpu-1gb-tor1-01.ssh: Flags [.], ack 1846, win 1, options [nop,nop,TS val 112440252 ecr 2782900376], length 0
19:41:54.977192 IP 179.60.147.157.24366 > lamp-ubuntu-s-1vcpu-1gb-tor1-01.ssh: Flags [P.], seq 2358:2374, ack 1846, win 1, options [nop,nop,TS val 112440463 ecr 2782900376], length 16
19:41:54.977234 IP lamp-ubuntu-s-1vcpu-1gb-tor1-01.ssh > 179.60.147.157.24366: Flags [.], ack 2374, win 501, options [nop,nop,TS val 2782900681 ecr 112440463], length 0
19:41:55.070723 IP 179.60.147.157.24366 > lamp-ubuntu-s-1vcpu-1gb-tor1-01.ssh: Flags [P.], seq 2374:2426, ack 1846, win 1, options [nop,nop,TS val 112440557 ecr 2782900681], length 52
19:41:55.070773 IP lamp-ubuntu-s-1vcpu-1gb-tor1-01.ssh > 179.60.147.157.24366: Flags [.], ack 2426, win 501, options [nop,nop,TS val 2782900774 ecr 112440557], length 0
19:41:55.070867 IP lamp-ubuntu-s-1vcpu-1gb-tor1-01.ssh > 179.60.147.157.24366: Flags [P.], seq 1846:1898, ack 2426, win 501, options [nop,nop,TS val 2782900774 ecr 112440557], length 52
19:41:55.164330 IP 179.60.147.157.24366 > lamp-ubuntu-s-1vcpu-1gb-tor1-01.ssh: Flags [.], ack 1898, win 1, options [nop,nop,TS val 112440651 ecr 2782900774], length 0
19:41:55.241307 IP 179.60.147.157.24366 > lamp-ubuntu-s-1vcpu-1gb-tor1-01.ssh: Flags [P.], seq 2426:2574, ack 1898, win 1, options [nop,nop,TS val 112440728 ecr 2782900774], length 148
19:41:55.282217 IP lamp-ubuntu-s-1vcpu-1gb-tor1-01.ssh > 179.60.147.157.24366: Flags [.], ack 2574, win 501, options [nop,nop,TS val 2782900986 ecr 112440728], length 0
19:41:56.043027 IP 61.177.172.108.54404 > lamp-ubuntu-s-1vcpu-1gb-tor1-01.ssh: Flags [S], seq 2540637221, win 29200, options [mss 1460,sackOK,TS val 8597651 ecr 0,nop,wscale 7], length 0
19:41:56.043081 IP lamp-ubuntu-s-1vcpu-1gb-tor1-01.ssh > 61.177.172.108.54404: Flags [S.], seq 1173341237, ack 2540637222, win 65160, options [mss 1460,sackOK,TS val 2989925191 ecr 8597651,nop,wscale 7], length 0
19:41:56.287143 IP 61.177.172.108.54404 > lamp-ubuntu-s-1vcpu-1gb-tor1-01.ssh: Flags [.], ack 1, win 229, options [nop,nop,TS val 8597712 ecr 2989925191], length 0
19:41:56.287143 IP 61.177.172.108.54404 > lamp-ubuntu-s-1vcpu-1gb-tor1-01.ssh: Flags [P.], seq 1:16, ack 1, win 229, options [nop,nop,TS val 8597712 ecr 2989925191], length 15
19:41:56.297896 IP lamp-ubuntu-s-1vcpu-1gb-tor1-01.ssh > 61.177.172.108.54404: Flags [P.], seq 1:42, ack 1, win 510, options [nop,nop,TS val 2989925446 ecr 8597712], length 41
19:41:56.540515 IP 61.177.172.108.54404 > lamp-ubuntu-s-1vcpu-1gb-tor1-01.ssh: Flags [.], ack 42, win 229, options [nop,nop,TS val 8597775 ecr 2989925446], length 0
19:41:57.022494 IP 61.177.172.108.54404 > lamp-ubuntu-s-1vcpu-1gb-tor1-01.ssh: Flags [P.], seq 16:872, ack 42, win 229, options [nop,nop,TS val 8597896 ecr 2989925446], length 856
19:41:57.758557 IP 61.177.172.108.54404 > lamp-ubuntu-s-1vcpu-1gb-tor1-01.ssh: Flags [P.], seq 1:872, ack 42, win 229, options [nop,nop,TS val 8598080 ecr 2989925446], length 871
19:41:57.758614 IP lamp-ubuntu-s-1vcpu-1gb-tor1-01.ssh > 61.177.172.108.54404: Flags [.], ack 872, win 504, options [nop,nop,TS val 2989926907 ecr 8598080], length 0
19:41:57.760374 IP lamp-ubuntu-s-1vcpu-1gb-tor1-01.ssh > 61.177.172.108.54404: Flags [P.], seq 42:1098, ack 872, win 504, options [nop,nop,TS val 2989926909 ecr 8598080], length 1056
19:41:58.009565 IP 61.177.172.108.54404 > lamp-ubuntu-s-1vcpu-1gb-tor1-01.ssh: Flags [.], ack 1098, win 245, options [nop,nop,TS val 8598142 ecr 2989926909], length 0
19:41:58.009888 IP 61.177.172.108.54404 > lamp-ubuntu-s-1vcpu-1gb-tor1-01.ssh: Flags [P.], seq 872:952, ack 1098, win 245, options [nop,nop,TS val 8598142 ecr 2989926909], length 80
19:41:58.009904 IP lamp-ubuntu-s-1vcpu-1gb-tor1-01.ssh > 61.177.172.108.54404: Flags [.], ack 952, win 504, options [nop,nop,TS val 2989927158 ecr 8598142], length 0
19:41:58.011147 IP lamp-ubuntu-s-1vcpu-1gb-tor1-01.ssh > 61.177.172.108.54404: Flags [P.], seq 1098:1410, ack 952, win 504, options [nop,nop,TS val 2989927159 ecr 8598142], length 312
19:41:58.263728 IP 61.177.172.108.54404 > lamp-ubuntu-s-1vcpu-1gb-tor1-01.ssh: Flags [P.], seq 952:968, ack 1410, win 262, options [nop,nop,TS val 8598206 ecr 2989927159], length 16
19:41:58.263788 IP lamp-ubuntu-s-1vcpu-1gb-tor1-01.ssh > 61.177.172.108.54404: Flags [.], ack 968, win 504, options [nop,nop,TS val 2989927412 ecr 8598206], length 0
19:41:58.519351 IP 61.177.172.108.54404 > lamp-ubuntu-s-1vcpu-1gb-tor1-01.ssh: Flags [P.], seq 968:1032, ack 1410, win 262, options [nop,nop,TS val 8598270 ecr 2989927412], length 64
19:41:58.519395 IP lamp-ubuntu-s-1vcpu-1gb-tor1-01.ssh > 61.177.172.108.54404: Flags [.], ack 1032, win 504, options [nop,nop,TS val 2989927668 ecr 8598270], length 0
19:41:58.519528 IP lamp-ubuntu-s-1vcpu-1gb-tor1-01.ssh > 61.177.172.108.54404: Flags [P.], seq 1410:1474, ack 1032, win 504, options [nop,nop,TS val 2989927668 ecr 8598270], length 64
19:41:58.766944 IP 61.177.172.108.54404 > lamp-ubuntu-s-1vcpu-1gb-tor1-01.ssh: Flags [P.], seq 1032:1112, ack 1474, win 262, options [nop,nop,TS val 8598332 ecr 2989927668], length 80
19:41:58.775198 IP lamp-ubuntu-s-1vcpu-1gb-tor1-01.ssh > 61.177.172.108.54404: Flags [P.], seq 1474:1554, ack 1112, win 504, options [nop,nop,TS val 2989927923 ecr 8598332], length 80
19:41:59.022053 IP 61.177.172.108.54404 > lamp-ubuntu-s-1vcpu-1gb-tor1-01.ssh: Flags [P.], seq 1112:1208, ack 1554, win 262, options [nop,nop,TS val 8598395 ecr 2989927923], length 96
19:41:59.062244 IP lamp-ubuntu-s-1vcpu-1gb-tor1-01.ssh > 61.177.172.108.54404: Flags [.], ack 1208, win 504, options [nop,nop,TS val 2989928211 ecr 8598395], length 0
19:41:59.304501 IP 179.60.147.157.24398 > lamp-ubuntu-s-1vcpu-1gb-tor1-01.ssh: Flags [S], seq 1567663305, win 16060, options [mss 1460,sackOK,TS val 112444791 ecr 0,nop,wscale 14], length 0
19:41:59.304566 IP lamp-ubuntu-s-1vcpu-1gb-tor1-01.ssh > 179.60.147.157.24398: Flags [S.], seq 148721374, ack 1567663306, win 65160, options [mss 1460,sackOK,TS val 2782905008 ecr 112444791,nop,wscale 7], length 0
19:41:59.304701 IP 179.60.147.157.24366 > lamp-ubuntu-s-1vcpu-1gb-tor1-01.ssh: Flags [F.], seq 2574, ack 1898, win 1, options [nop,nop,TS val 112444791 ecr 2782900986], length 0
19:41:59.346225 IP lamp-ubuntu-s-1vcpu-1gb-tor1-01.ssh > 179.60.147.157.24366: Flags [.], ack 2575, win 501, options [nop,nop,TS val 2782905050 ecr 112444791], length 0
19:41:59.397841 IP 179.60.147.157.24398 > lamp-ubuntu-s-1vcpu-1gb-tor1-01.ssh: Flags [.], ack 1, win 1, options [nop,nop,TS val 112444884 ecr 2782905008], length 0
19:41:59.409188 IP lamp-ubuntu-s-1vcpu-1gb-tor1-01.ssh > 179.60.147.157.24398: Flags [P.], seq 1:42, ack 1, win 510, options [nop,nop,TS val 2782905112 ecr 112444884], length 41
19:41:59.450348 IP lamp-ubuntu-s-1vcpu-1gb-tor1-01.ssh > 179.60.147.157.24366: Flags [P.], seq 1898:1966, ack 2575, win 501, options [nop,nop,TS val 2782905154 ecr 112444791], length 68
19:41:59.453879 IP lamp-ubuntu-s-1vcpu-1gb-tor1-01.ssh > 179.60.147.157.24366: Flags [F.], seq 1966, ack 2575, win 501, options [nop,nop,TS val 2782905157 ecr 112444791], length 0
19:41:59.502401 IP 179.60.147.157.24398 > lamp-ubuntu-s-1vcpu-1gb-tor1-01.ssh: Flags [.], ack 42, win 1, options [nop,nop,TS val 112444989 ecr 2782905112], length 0
19:41:59.543867 IP 179.60.147.157.24366 > lamp-ubuntu-s-1vcpu-1gb-tor1-01.ssh: Flags [R], seq 3753547744, win 0, length 0
19:41:59.547349 IP 179.60.147.157.24366 > lamp-ubuntu-s-1vcpu-1gb-tor1-01.ssh: Flags [R], seq 3753547744, win 0, length 0
19:41:59.714248 IP lamp-ubuntu-s-1vcpu-1gb-tor1-01.ssh > 61.177.172.90.57398: Flags [P.], seq 42:1098, ack 872, win 504, options [nop,nop,TS val 3523391663 ecr 8591345], length 1056
19:41:59.800435 IP 179.60.147.157.24398 > lamp-ubuntu-s-1vcpu-1gb-tor1-01.ssh: Flags [P.], seq 1:22, ack 42, win 1, options [nop,nop,TS val 112445287 ecr 2782905112], length 21
19:41:59.800436 IP 179.60.147.157.24398 > lamp-ubuntu-s-1vcpu-1gb-tor1-01.ssh: Flags [.], seq 22:1470, ack 42, win 1, options [nop,nop,TS val 112445287 ecr 2782905112], length 1448
19:41:59.800495 IP lamp-ubuntu-s-1vcpu-1gb-tor1-01.ssh > 179.60.147.157.24398: Flags [.], ack 22, win 510, options [nop,nop,TS val 2782905504 ecr 112445287], length 0
19:41:59.800520 IP lamp-ubuntu-s-1vcpu-1gb-tor1-01.ssh > 179.60.147.157.24398: Flags [.], ack 1470, win 501, options [nop,nop,TS val 2782905504 ecr 112445287], length 0
19:41:59.801892 IP lamp-ubuntu-s-1vcpu-1gb-tor1-01.ssh > 179.60.147.157.24398: Flags [P.], seq 42:1098, ack 1470, win 501, options [nop,nop,TS val 2782905505 ecr 112445287], length 1056
19:41:59.893685 IP 179.60.147.157.24398 > lamp-ubuntu-s-1vcpu-1gb-tor1-01.ssh: Flags [P.], seq 1470:2086, ack 42, win 1, options [nop,nop,TS val 112445380 ecr 2782905504], length 616
19:41:59.893726 IP lamp-ubuntu-s-1vcpu-1gb-tor1-01.ssh > 179.60.147.157.24398: Flags [.], ack 2086, win 501, options [nop,nop,TS val 2782905597 ecr 112445380], length 0
19:41:59.895110 IP 179.60.147.157.24398 > lamp-ubuntu-s-1vcpu-1gb-tor1-01.ssh: Flags [.], ack 1098, win 1, options [nop,nop,TS val 112445382 ecr 2782905505], length 0
19:42:00.000282 IP 61.177.173.37.43888 > lamp-ubuntu-s-1vcpu-1gb-tor1-01.ssh: Flags [S], seq 1217264281, win 29200, options [mss 1460,sackOK,TS val 5926156 ecr 0,nop,wscale 7], length 0
19:42:00.000350 IP lamp-ubuntu-s-1vcpu-1gb-tor1-01.ssh > 61.177.173.37.43888: Flags [S.], seq 1161139002, ack 1217264282, win 65160, options [mss 1460,sackOK,TS val 2660503244 ecr 5926156,nop,wscale 7], length 0
19:42:00.045597 IP 179.60.147.157.24398 > lamp-ubuntu-s-1vcpu-1gb-tor1-01.ssh: Flags [P.], seq 2086:2358, ack 1098, win 1, options [nop,nop,TS val 112445532 ecr 2782905597], length 272
19:42:00.045637 IP lamp-ubuntu-s-1vcpu-1gb-tor1-01.ssh > 179.60.147.157.24398: Flags [.], ack 2358, win 501, options [nop,nop,TS val 2782905749 ecr 112445532], length 0
19:42:00.049276 IP lamp-ubuntu-s-1vcpu-1gb-tor1-01.ssh > 179.60.147.157.24398: Flags [P.], seq 1098:1846, ack 2358, win 501, options [nop,nop,TS val 2782905753 ecr 112445532], length 748
19:42:00.142691 IP 179.60.147.157.24398 > lamp-ubuntu-s-1vcpu-1gb-tor1-01.ssh: Flags [.], ack 1846, win 1, options [nop,nop,TS val 112445629 ecr 2782905753], length 0
19:42:00.215978 IP 61.177.173.37.43888 > lamp-ubuntu-s-1vcpu-1gb-tor1-01.ssh: Flags [.], ack 1, win 229, options [nop,nop,TS val 5926209 ecr 2660503244], length 0
19:42:00.215979 IP 61.177.173.37.43888 > lamp-ubuntu-s-1vcpu-1gb-tor1-01.ssh: Flags [P.], seq 1:16, ack 1, win 229, options [nop,nop,TS val 5926209 ecr 2660503244], length 15
19:42:00.227906 IP lamp-ubuntu-s-1vcpu-1gb-tor1-01.ssh > 61.177.173.37.43888: Flags [P.], seq 1:42, ack 1, win 510, options [nop,nop,TS val 2660503471 ecr 5926209], length 41
19:42:00.337019 IP 179.60.147.157.24398 > lamp-ubuntu-s-1vcpu-1gb-tor1-01.ssh: Flags [P.], seq 2358:2374, ack 1846, win 1, options [nop,nop,TS val 112445824 ecr 2782905753], length 16
19:42:00.337056 IP lamp-ubuntu-s-1vcpu-1gb-tor1-01.ssh > 179.60.147.157.24398: Flags [.], ack 2374, win 501, options [nop,nop,TS val 2782906040 ecr 112445824], length 0
19:42:00.430788 IP 179.60.147.157.24398 > lamp-ubuntu-s-1vcpu-1gb-tor1-01.ssh: Flags [P.], seq 2374:2426, ack 1846, win 1, options [nop,nop,TS val 112445917 ecr 2782906040], length 52
19:42:00.430844 IP lamp-ubuntu-s-1vcpu-1gb-tor1-01.ssh > 179.60.147.157.24398: Flags [.], ack 2426, win 501, options [nop,nop,TS val 2782906134 ecr 112445917], length 0
19:42:00.430958 IP lamp-ubuntu-s-1vcpu-1gb-tor1-01.ssh > 179.60.147.157.24398: Flags [P.], seq 1846:1898, ack 2426, win 501, options [nop,nop,TS val 2782906134 ecr 112445917], length 52
19:42:00.446576 IP 61.177.173.37.43888 > lamp-ubuntu-s-1vcpu-1gb-tor1-01.ssh: Flags [.], ack 42, win 229, options [nop,nop,TS val 5926267 ecr 2660503471], length 0
19:42:00.524277 IP 179.60.147.157.24398 > lamp-ubuntu-s-1vcpu-1gb-tor1-01.ssh: Flags [.], ack 1898, win 1, options [nop,nop,TS val 112446011 ecr 2782906134], length 0
19:42:00.602054 IP 179.60.147.157.24398 > lamp-ubuntu-s-1vcpu-1gb-tor1-01.ssh: Flags [P.], seq 2426:2574, ack 1898, win 1, options [nop,nop,TS val 112446089 ecr 2782906134], length 148
19:42:00.642229 IP lamp-ubuntu-s-1vcpu-1gb-tor1-01.ssh > 179.60.147.157.24398: Flags [.], ack 2574, win 501, options [nop,nop,TS val 2782906346 ecr 112446089], length 0
19:42:00.859854 IP 61.177.173.37.43888 > lamp-ubuntu-s-1vcpu-1gb-tor1-01.ssh: Flags [P.], seq 16:872, ack 42, win 229, options [nop,nop,TS val 5926371 ecr 2660503471], length 856
19:42:01.508237 IP 61.177.173.37.43888 > lamp-ubuntu-s-1vcpu-1gb-tor1-01.ssh: Flags [P.], seq 1:872, ack 42, win 229, options [nop,nop,TS val 5926533 ecr 2660503471], length 871
19:42:01.508293 IP lamp-ubuntu-s-1vcpu-1gb-tor1-01.ssh > 61.177.173.37.43888: Flags [.], ack 872, win 504, options [nop,nop,TS val 2660504752 ecr 5926533], length 0
19:42:01.509909 IP lamp-ubuntu-s-1vcpu-1gb-tor1-01.ssh > 61.177.173.37.43888: Flags [P.], seq 42:1098, ack 872, win 504, options [nop,nop,TS val 2660504753 ecr 5926533], length 1056
19:42:01.730252 IP 61.177.173.37.43888 > lamp-ubuntu-s-1vcpu-1gb-tor1-01.ssh: Flags [.], ack 1098, win 245, options [nop,nop,TS val 5926588 ecr 2660504753], length 0
19:42:01.730506 IP 61.177.173.37.43888 > lamp-ubuntu-s-1vcpu-1gb-tor1-01.ssh: Flags [P.], seq 872:952, ack 1098, win 245, options [nop,nop,TS val 5926588 ecr 2660504753], length 80
19:42:01.730537 IP lamp-ubuntu-s-1vcpu-1gb-tor1-01.ssh > 61.177.173.37.43888: Flags [.], ack 952, win 504, options [nop,nop,TS val 2660504974 ecr 5926588], length 0
19:42:01.731739 IP lamp-ubuntu-s-1vcpu-1gb-tor1-01.ssh > 61.177.173.37.43888: Flags [P.], seq 1098:1410, ack 952, win 504, options [nop,nop,TS val 2660504975 ecr 5926588], length 312
19:42:01.948298 IP 61.177.173.37.43888 > lamp-ubuntu-s-1vcpu-1gb-tor1-01.ssh: Flags [P.], seq 952:968, ack 1410, win 262, options [nop,nop,TS val 5926643 ecr 2660504975], length 16
19:42:01.948354 IP lamp-ubuntu-s-1vcpu-1gb-tor1-01.ssh > 61.177.173.37.43888: Flags [.], ack 968, win 504, options [nop,nop,TS val 2660505192 ecr 5926643], length 0
19:42:02.163498 IP 61.177.173.37.43888 > lamp-ubuntu-s-1vcpu-1gb-tor1-01.ssh: Flags [P.], seq 968:1032, ack 1410, win 262, options [nop,nop,TS val 5926696 ecr 2660505192], length 64
19:42:02.163535 IP lamp-ubuntu-s-1vcpu-1gb-tor1-01.ssh > 61.177.173.37.43888: Flags [.], ack 1032, win 504, options [nop,nop,TS val 2660505407 ecr 5926696], length 0
19:42:02.163666 IP lamp-ubuntu-s-1vcpu-1gb-tor1-01.ssh > 61.177.173.37.43888: Flags [P.], seq 1410:1474, ack 1032, win 504, options [nop,nop,TS val 2660505407 ecr 5926696], length 64
19:42:02.386234 IP 61.177.173.37.43888 > lamp-ubuntu-s-1vcpu-1gb-tor1-01.ssh: Flags [P.], seq 1032:1112, ack 1474, win 262, options [nop,nop,TS val 5926752 ecr 2660505407], length 80
19:42:02.394529 IP lamp-ubuntu-s-1vcpu-1gb-tor1-01.ssh > 61.177.173.37.43888: Flags [P.], seq 1474:1554, ack 1112, win 504, options [nop,nop,TS val 2660505638 ecr 5926752], length 80
19:42:02.624063 IP 61.177.173.37.43888 > lamp-ubuntu-s-1vcpu-1gb-tor1-01.ssh: Flags [P.], seq 1112:1208, ack 1554, win 262, options [nop,nop,TS val 5926812 ecr 2660505638], length 96
19:42:02.666238 IP lamp-ubuntu-s-1vcpu-1gb-tor1-01.ssh > 61.177.173.37.43888: Flags [.], ack 1208, win 504, options [nop,nop,TS val 2660505910 ecr 5926812], length 0
19:42:03.115286 IP lamp-ubuntu-s-1vcpu-1gb-tor1-01.ssh > 61.177.172.108.54404: Flags [P.], seq 1554:1634, ack 1208, win 504, options [nop,nop,TS val 2989932264 ecr 8598395], length 80
19:42:03.374091 IP 61.177.172.108.54404 > lamp-ubuntu-s-1vcpu-1gb-tor1-01.ssh: Flags [P.], seq 1208:1304, ack 1634, win 262, options [nop,nop,TS val 8599483 ecr 2989932264], length 96
19:42:03.374141 IP lamp-ubuntu-s-1vcpu-1gb-tor1-01.ssh > 61.177.172.108.54404: Flags [.], ack 1304, win 504, options [nop,nop,TS val 2989932522 ecr 8599483], length 0
19:42:04.670928 IP lamp-ubuntu-s-1vcpu-1gb-tor1-01.ssh > 61.177.173.37.43888: Flags [P.], seq 1554:1634, ack 1208, win 504, options [nop,nop,TS val 2660507914 ecr 5926812], length 80
19:42:04.732617 IP 179.60.147.157.24398 > lamp-ubuntu-s-1vcpu-1gb-tor1-01.ssh: Flags [F.], seq 2574, ack 1898, win 1, options [nop,nop,TS val 112450219 ecr 2782906346], length 0
19:42:04.774231 IP lamp-ubuntu-s-1vcpu-1gb-tor1-01.ssh > 179.60.147.157.24398: Flags [.], ack 2575, win 501, options [nop,nop,TS val 2782910478 ecr 112450219], length 0
19:42:04.811150 IP lamp-ubuntu-s-1vcpu-1gb-tor1-01.ssh > 179.60.147.157.24398: Flags [P.], seq 1898:1966, ack 2575, win 501, options [nop,nop,TS val 2782910514 ecr 112450219], length 68
19:42:04.812579 IP lamp-ubuntu-s-1vcpu-1gb-tor1-01.ssh > 179.60.147.157.24398: Flags [F.], seq 1966, ack 2575, win 501, options [nop,nop,TS val 2782910516 ecr 112450219], length 0
19:42:04.902250 IP 61.177.173.37.43888 > lamp-ubuntu-s-1vcpu-1gb-tor1-01.ssh: Flags [P.], seq 1208:1304, ack 1634, win 262, options [nop,nop,TS val 5927381 ecr 2660507914], length 96
19:42:04.902294 IP lamp-ubuntu-s-1vcpu-1gb-tor1-01.ssh > 61.177.173.37.43888: Flags [.], ack 1304, win 504, options [nop,nop,TS val 2660508146 ecr 5927381], length 0
19:42:04.904296 IP 179.60.147.157.24398 > lamp-ubuntu-s-1vcpu-1gb-tor1-01.ssh: Flags [R], seq 1567665880, win 0, length 0
19:42:04.905859 IP 179.60.147.157.24398 > lamp-ubuntu-s-1vcpu-1gb-tor1-01.ssh: Flags [R], seq 1567665880, win 0, length 0
19:42:05.420879 IP lamp-ubuntu-s-1vcpu-1gb-tor1-01.ssh > 61.177.172.108.54404: Flags [P.], seq 1634:1714, ack 1304, win 504, options [nop,nop,TS val 2989934569 ecr 8599483], length 80
19:42:05.676713 IP 61.177.172.108.54404 > lamp-ubuntu-s-1vcpu-1gb-tor1-01.ssh: Flags [P.], seq 1304:1400, ack 1714, win 262, options [nop,nop,TS val 8600059 ecr 2989934569], length 96
19:42:05.676761 IP lamp-ubuntu-s-1vcpu-1gb-tor1-01.ssh > 61.177.172.108.54404: Flags [.], ack 1400, win 504, options [nop,nop,TS val 2989934825 ecr 8600059], length 0
19:42:08.995454 IP lamp-ubuntu-s-1vcpu-1gb-tor1-01.ssh > 61.177.173.37.43888: Flags [P.], seq 1634:1714, ack 1304, win 504, options [nop,nop,TS val 2660512239 ecr 5927381], length 80
19:42:09.214302 IP 61.177.173.37.43888 > lamp-ubuntu-s-1vcpu-1gb-tor1-01.ssh: Flags [P.], seq 1304:1400, ack 1714, win 262, options [nop,nop,TS val 5928459 ecr 2660512239], length 96
19:42:09.214345 IP lamp-ubuntu-s-1vcpu-1gb-tor1-01.ssh > 61.177.173.37.43888: Flags [.], ack 1400, win 504, options [nop,nop,TS val 2660512458 ecr 5928459], length 0
19:42:09.769909 IP lamp-ubuntu-s-1vcpu-1gb-tor1-01.ssh > 61.177.172.108.54404: Flags [P.], seq 1714:1794, ack 1400, win 504, options [nop,nop,TS val 2989938918 ecr 8600059], length 80
19:42:09.991119 IP 61.177.172.108.36382 > lamp-ubuntu-s-1vcpu-1gb-tor1-01.ssh: Flags [S], seq 1518079628, win 29200, options [mss 1460,sackOK,TS val 8601144 ecr 0,nop,wscale 7], length 0
19:42:09.991208 IP lamp-ubuntu-s-1vcpu-1gb-tor1-01.ssh > 61.177.172.108.36382: Flags [S.], seq 474241889, ack 1518079629, win 65160, options [mss 1460,sackOK,TS val 2989939140 ecr 8601144,nop,wscale 7], length 0
19:42:10.016409 IP 61.177.172.108.54404 > lamp-ubuntu-s-1vcpu-1gb-tor1-01.ssh: Flags [P.], seq 1400:1464, ack 1794, win 262, options [nop,nop,TS val 8601144 ecr 2989938918], length 64
19:42:10.016409 IP 61.177.172.108.54404 > lamp-ubuntu-s-1vcpu-1gb-tor1-01.ssh: Flags [F.], seq 1464, ack 1794, win 262, options [nop,nop,TS val 8601144 ecr 2989938918], length 0
19:42:10.016459 IP lamp-ubuntu-s-1vcpu-1gb-tor1-01.ssh > 61.177.172.108.54404: Flags [.], ack 1464, win 504, options [nop,nop,TS val 2989939165 ecr 8601144], length 0
19:42:10.018070 IP lamp-ubuntu-s-1vcpu-1gb-tor1-01.ssh > 61.177.172.108.54404: Flags [F.], seq 1794, ack 1465, win 504, options [nop,nop,TS val 2989939166 ecr 8601144], length 0
19:42:10.208904 IP 61.177.172.108.36382 > lamp-ubuntu-s-1vcpu-1gb-tor1-01.ssh: Flags [.], ack 1, win 229, options [nop,nop,TS val 8601198 ecr 2989939140], length 0
19:42:10.208904 IP 61.177.172.108.36382 > lamp-ubuntu-s-1vcpu-1gb-tor1-01.ssh: Flags [P.], seq 1:16, ack 1, win 229, options [nop,nop,TS val 8601198 ecr 2989939140], length 15
19:42:10.221391 IP lamp-ubuntu-s-1vcpu-1gb-tor1-01.ssh > 61.177.172.108.36382: Flags [P.], seq 1:42, ack 1, win 510, options [nop,nop,TS val 2989939370 ecr 8601198], length 41
19:42:10.260972 IP 61.177.172.108.54404 > lamp-ubuntu-s-1vcpu-1gb-tor1-01.ssh: Flags [.], ack 1795, win 262, options [nop,nop,TS val 8601205 ecr 2989939166], length 0
19:42:10.438707 IP 61.177.172.108.36382 > lamp-ubuntu-s-1vcpu-1gb-tor1-01.ssh: Flags [.], ack 42, win 229, options [nop,nop,TS val 8601256 ecr 2989939370], length 0
19:42:10.861276 IP 61.177.172.108.36382 > lamp-ubuntu-s-1vcpu-1gb-tor1-01.ssh: Flags [P.], seq 16:872, ack 42, win 229, options [nop,nop,TS val 8601362 ecr 2989939370], length 856
19:42:11.261073 IP lamp-ubuntu-s-1vcpu-1gb-tor1-01.ssh > 61.177.173.37.43888: Flags [P.], seq 1714:1794, ack 1400, win 504, options [nop,nop,TS val 2660514504 ecr 5928459], length 80
19:42:11.478674 IP 61.177.173.37.52543 > lamp-ubuntu-s-1vcpu-1gb-tor1-01.ssh: Flags [S], seq 1100555667, win 29200, options [mss 1460,sackOK,TS val 5929027 ecr 0,nop,wscale 7], length 0
19:42:11.478730 IP lamp-ubuntu-s-1vcpu-1gb-tor1-01.ssh > 61.177.173.37.52543: Flags [S.], seq 3854993755, ack 1100555668, win 65160, options [mss 1460,sackOK,TS val 2660514722 ecr 5929027,nop,wscale 7], length 0
19:42:11.485629 IP 61.177.173.37.43888 > lamp-ubuntu-s-1vcpu-1gb-tor1-01.ssh: Flags [P.], seq 1400:1464, ack 1794, win 262, options [nop,nop,TS val 5929027 ecr 2660514504], length 64
19:42:11.485629 IP 61.177.173.37.43888 > lamp-ubuntu-s-1vcpu-1gb-tor1-01.ssh: Flags [F.], seq 1464, ack 1794, win 262, options [nop,nop,TS val 5929027 ecr 2660514504], length 0
19:42:11.485671 IP lamp-ubuntu-s-1vcpu-1gb-tor1-01.ssh > 61.177.173.37.43888: Flags [.], ack 1464, win 504, options [nop,nop,TS val 2660514729 ecr 5929027], length 0
19:42:11.487116 IP lamp-ubuntu-s-1vcpu-1gb-tor1-01.ssh > 61.177.173.37.43888: Flags [F.], seq 1794, ack 1465, win 504, options [nop,nop,TS val 2660514730 ecr 5929027], length 0
19:42:11.517217 IP 61.177.172.108.36382 > lamp-ubuntu-s-1vcpu-1gb-tor1-01.ssh: Flags [P.], seq 1:872, ack 42, win 229, options [nop,nop,TS val 8601526 ecr 2989939370], length 871
19:42:11.517270 IP lamp-ubuntu-s-1vcpu-1gb-tor1-01.ssh > 61.177.172.108.36382: Flags [.], ack 872, win 504, options [nop,nop,TS val 2989940666 ecr 8601526], length 0
19:42:11.518740 IP lamp-ubuntu-s-1vcpu-1gb-tor1-01.ssh > 61.177.172.108.36382: Flags [P.], seq 42:1098, ack 872, win 504, options [nop,nop,TS val 2989940667 ecr 8601526], length 1056
19:42:11.692605 IP 61.177.173.37.52543 > lamp-ubuntu-s-1vcpu-1gb-tor1-01.ssh: Flags [.], ack 1, win 229, options [nop,nop,TS val 5929080 ecr 2660514722], length 0
19:42:11.692606 IP 61.177.173.37.52543 > lamp-ubuntu-s-1vcpu-1gb-tor1-01.ssh: Flags [P.], seq 1:16, ack 1, win 229, options [nop,nop,TS val 5929080 ecr 2660514722], length 15
19:42:11.704301 IP lamp-ubuntu-s-1vcpu-1gb-tor1-01.ssh > 61.177.173.37.52543: Flags [P.], seq 1:42, ack 1, win 510, options [nop,nop,TS val 2660514948 ecr 5929080], length 41
19:42:11.708272 IP 61.177.173.37.43888 > lamp-ubuntu-s-1vcpu-1gb-tor1-01.ssh: Flags [.], ack 1795, win 262, options [nop,nop,TS val 5929083 ecr 2660514730], length 0
19:42:11.927269 IP 61.177.173.37.52543 > lamp-ubuntu-s-1vcpu-1gb-tor1-01.ssh: Flags [.], ack 42, win 229, options [nop,nop,TS val 5929139 ecr 2660514948], length 0
19:42:12.162225 IP lamp-ubuntu-s-1vcpu-1gb-tor1-01.ssh > 61.177.172.108.36382: Flags [P.], seq 42:1098, ack 872, win 504, options [nop,nop,TS val 2989941311 ecr 8601526], length 1056
19:42:12.332833 IP 61.177.173.37.52543 > lamp-ubuntu-s-1vcpu-1gb-tor1-01.ssh: Flags [P.], seq 16:872, ack 42, win 229, options [nop,nop,TS val 5929241 ecr 2660514948], length 856
19:42:12.834222 IP lamp-ubuntu-s-1vcpu-1gb-tor1-01.ssh > 61.177.172.108.36382: Flags [P.], seq 42:1098, ack 872, win 504, options [nop,nop,TS val 2989941983 ecr 8601526], length 1056
19:42:12.976824 IP 61.177.173.37.52543 > lamp-ubuntu-s-1vcpu-1gb-tor1-01.ssh: Flags [P.], seq 1:872, ack 42, win 229, options [nop,nop,TS val 5929402 ecr 2660514948], length 871
19:42:12.976869 IP lamp-ubuntu-s-1vcpu-1gb-tor1-01.ssh > 61.177.173.37.52543: Flags [.], ack 872, win 504, options [nop,nop,TS val 2660516220 ecr 5929402], length 0
19:42:12.978243 IP lamp-ubuntu-s-1vcpu-1gb-tor1-01.ssh > 61.177.173.37.52543: Flags [P.], seq 42:1098, ack 872, win 504, options [nop,nop,TS val 2660516222 ecr 5929402], length 1056
19:42:13.634214 IP lamp-ubuntu-s-1vcpu-1gb-tor1-01.ssh > 61.177.173.37.52543: Flags [P.], seq 42:1098, ack 872, win 504, options [nop,nop,TS val 2660516877 ecr 5929402], length 1056
19:42:14.178230 IP lamp-ubuntu-s-1vcpu-1gb-tor1-01.ssh > 61.177.172.108.36382: Flags [P.], seq 42:1098, ack 872, win 504, options [nop,nop,TS val 2989943327 ecr 8601526], length 1056
19:42:14.306201 IP lamp-ubuntu-s-1vcpu-1gb-tor1-01.ssh > 61.177.173.37.52543: Flags [P.], seq 42:1098, ack 872, win 504, options [nop,nop,TS val 2660517549 ecr 5929402], length 1056
19:42:15.618226 IP lamp-ubuntu-s-1vcpu-1gb-tor1-01.ssh > 61.177.173.37.52543: Flags [P.], seq 42:1098, ack 872, win 504, options [nop,nop,TS val 2660518862 ecr 5929402], length 1056
19:42:16.866224 IP lamp-ubuntu-s-1vcpu-1gb-tor1-01.ssh > 61.177.172.108.36382: Flags [P.], seq 42:1098, ack 872, win 504, options [nop,nop,TS val 2989946015 ecr 8601526], length 1056
19:42:18.402233 IP lamp-ubuntu-s-1vcpu-1gb-tor1-01.ssh > 61.177.173.37.52543: Flags [P.], seq 42:1098, ack 872, win 504, options [nop,nop,TS val 2660521646 ecr 5929402], length 1056
19:42:21.744260 IP 61.177.172.108.55251 > lamp-ubuntu-s-1vcpu-1gb-tor1-01.ssh: Flags [S], seq 3090019384, win 29200, options [mss 1460,sackOK,TS val 8604082 ecr 0,nop,wscale 7], length 0
19:42:21.744324 IP lamp-ubuntu-s-1vcpu-1gb-tor1-01.ssh > 61.177.172.108.55251: Flags [S.], seq 137546878, ack 3090019385, win 65160, options [mss 1460,sackOK,TS val 2989950893 ecr 8604082,nop,wscale 7], length 0
19:42:21.975177 IP 61.177.172.108.55251 > lamp-ubuntu-s-1vcpu-1gb-tor1-01.ssh: Flags [.], ack 1, win 229, options [nop,nop,TS val 8604140 ecr 2989950893], length 0
19:42:21.975261 IP 61.177.172.108.55251 > lamp-ubuntu-s-1vcpu-1gb-tor1-01.ssh: Flags [P.], seq 1:16, ack 1, win 229, options [nop,nop,TS val 8604140 ecr 2989950893], length 15
19:42:21.988232 IP lamp-ubuntu-s-1vcpu-1gb-tor1-01.ssh > 61.177.172.108.55251: Flags [P.], seq 1:42, ack 1, win 510, options [nop,nop,TS val 2989951137 ecr 8604140], length 41
19:42:22.205145 IP 61.177.172.108.55251 > lamp-ubuntu-s-1vcpu-1gb-tor1-01.ssh: Flags [.], ack 42, win 229, options [nop,nop,TS val 8604197 ecr 2989951137], length 0
19:42:22.242231 IP lamp-ubuntu-s-1vcpu-1gb-tor1-01.ssh > 61.177.172.90.57398: Flags [P.], seq 42:1098, ack 872, win 504, options [nop,nop,TS val 3523414191 ecr 8591345], length 1056
19:42:22.242257 IP lamp-ubuntu-s-1vcpu-1gb-tor1-01.ssh > 61.177.172.108.36382: Flags [P.], seq 42:1098, ack 872, win 504, options [nop,nop,TS val 2989951391 ecr 8601526], length 1056
19:42:22.717275 IP 61.177.172.108.55251 > lamp-ubuntu-s-1vcpu-1gb-tor1-01.ssh: Flags [P.], seq 16:872, ack 42, win 229, options [nop,nop,TS val 8604326 ecr 2989951137], length 856
19:42:23.217637 IP 61.177.173.37.62644 > lamp-ubuntu-s-1vcpu-1gb-tor1-01.ssh: Flags [S], seq 2467418448, win 29200, options [mss 1460,sackOK,TS val 5931960 ecr 0,nop,wscale 7], length 0
19:42:23.217712 IP lamp-ubuntu-s-1vcpu-1gb-tor1-01.ssh > 61.177.173.37.62644: Flags [S.], seq 1216128393, ack 2467418449, win 65160, options [mss 1460,sackOK,TS val 2660526461 ecr 5931960,nop,wscale 7], length 0
19:42:23.432418 IP 61.177.173.37.62644 > lamp-ubuntu-s-1vcpu-1gb-tor1-01.ssh: Flags [.], ack 1, win 229, options [nop,nop,TS val 5932014 ecr 2660526461], length 0
19:42:23.434116 IP 61.177.173.37.62644 > lamp-ubuntu-s-1vcpu-1gb-tor1-01.ssh: Flags [P.], seq 1:16, ack 1, win 229, options [nop,nop,TS val 5932014 ecr 2660526461], length 15
19:42:23.446915 IP lamp-ubuntu-s-1vcpu-1gb-tor1-01.ssh > 61.177.173.37.62644: Flags [P.], seq 1:42, ack 1, win 510, options [nop,nop,TS val 2660526690 ecr 5932014], length 41
19:42:23.462808 IP 61.177.172.108.55251 > lamp-ubuntu-s-1vcpu-1gb-tor1-01.ssh: Flags [P.], seq 1:872, ack 42, win 229, options [nop,nop,TS val 8604512 ecr 2989951137], length 871
19:42:23.462863 IP lamp-ubuntu-s-1vcpu-1gb-tor1-01.ssh > 61.177.172.108.55251: Flags [.], ack 872, win 504, options [nop,nop,TS val 2989952611 ecr 8604512], length 0
19:42:23.464648 IP lamp-ubuntu-s-1vcpu-1gb-tor1-01.ssh > 61.177.172.108.55251: Flags [P.], seq 42:1098, ack 872, win 504, options [nop,nop,TS val 2989952613 ecr 8604512], length 1056
19:42:23.667315 IP 61.177.173.37.62644 > lamp-ubuntu-s-1vcpu-1gb-tor1-01.ssh: Flags [.], ack 42, win 229, options [nop,nop,TS val 5932073 ecr 2660526690], length 0
19:42:23.778242 IP lamp-ubuntu-s-1vcpu-1gb-tor1-01.ssh > 61.177.173.37.52543: Flags [P.], seq 42:1098, ack 872, win 504, options [nop,nop,TS val 2660527022 ecr 5929402], length 1056
19:42:24.103123 IP 61.177.173.37.62644 > lamp-ubuntu-s-1vcpu-1gb-tor1-01.ssh: Flags [P.], seq 16:872, ack 42, win 229, options [nop,nop,TS val 5932182 ecr 2660526690], length 856
19:42:24.130224 IP lamp-ubuntu-s-1vcpu-1gb-tor1-01.ssh > 61.177.172.108.55251: Flags [P.], seq 42:1098, ack 872, win 504, options [nop,nop,TS val 2989953279 ecr 8604512], length 1056
19:42:24.775140 IP 61.177.173.37.62644 > lamp-ubuntu-s-1vcpu-1gb-tor1-01.ssh: Flags [P.], seq 1:872, ack 42, win 229, options [nop,nop,TS val 5932350 ecr 2660526690], length 871
19:42:24.775194 IP lamp-ubuntu-s-1vcpu-1gb-tor1-01.ssh > 61.177.173.37.62644: Flags [.], ack 872, win 504, options [nop,nop,TS val 2660528018 ecr 5932350], length 0
19:42:24.776731 IP lamp-ubuntu-s-1vcpu-1gb-tor1-01.ssh > 61.177.173.37.62644: Flags [P.], seq 42:1098, ack 872, win 504, options [nop,nop,TS val 2660528020 ecr 5932350], length 1056
19:42:24.834221 IP lamp-ubuntu-s-1vcpu-1gb-tor1-01.ssh > 61.177.172.108.55251: Flags [P.], seq 42:1098, ack 872, win 504, options [nop,nop,TS val 2989953983 ecr 8604512], length 1056
19:42:25.001885 IP 61.177.173.37.62644 > lamp-ubuntu-s-1vcpu-1gb-tor1-01.ssh: Flags [.], ack 1098, win 245, options [nop,nop,TS val 5932406 ecr 2660528020], length 0
19:42:25.002101 IP 61.177.173.37.62644 > lamp-ubuntu-s-1vcpu-1gb-tor1-01.ssh: Flags [P.], seq 872:952, ack 1098, win 245, options [nop,nop,TS val 5932406 ecr 2660528020], length 80
19:42:25.002120 IP lamp-ubuntu-s-1vcpu-1gb-tor1-01.ssh > 61.177.173.37.62644: Flags [.], ack 952, win 504, options [nop,nop,TS val 2660528245 ecr 5932406], length 0
19:42:25.003225 IP lamp-ubuntu-s-1vcpu-1gb-tor1-01.ssh > 61.177.173.37.62644: Flags [P.], seq 1098:1410, ack 952, win 504, options [nop,nop,TS val 2660528247 ecr 5932406], length 312
19:42:25.221013 IP 61.177.173.37.62644 > lamp-ubuntu-s-1vcpu-1gb-tor1-01.ssh: Flags [P.], seq 952:968, ack 1410, win 262, options [nop,nop,TS val 5932461 ecr 2660528247], length 16
19:42:25.221079 IP lamp-ubuntu-s-1vcpu-1gb-tor1-01.ssh > 61.177.173.37.62644: Flags [.], ack 968, win 504, options [nop,nop,TS val 2660528464 ecr 5932461], length 0
19:42:25.444381 IP 61.177.173.37.62644 > lamp-ubuntu-s-1vcpu-1gb-tor1-01.ssh: Flags [P.], seq 968:1032, ack 1410, win 262, options [nop,nop,TS val 5932517 ecr 2660528464], length 64
19:42:25.444424 IP lamp-ubuntu-s-1vcpu-1gb-tor1-01.ssh > 61.177.173.37.62644: Flags [.], ack 1032, win 504, options [nop,nop,TS val 2660528688 ecr 5932517], length 0
19:42:25.444557 IP lamp-ubuntu-s-1vcpu-1gb-tor1-01.ssh > 61.177.173.37.62644: Flags [P.], seq 1410:1474, ack 1032, win 504, options [nop,nop,TS val 2660528688 ecr 5932517], length 64
19:42:25.672357 IP 61.177.173.37.62644 > lamp-ubuntu-s-1vcpu-1gb-tor1-01.ssh: Flags [P.], seq 1032:1112, ack 1474, win 262, options [nop,nop,TS val 5932574 ecr 2660528688], length 80
19:42:25.680626 IP lamp-ubuntu-s-1vcpu-1gb-tor1-01.ssh > 61.177.173.37.62644: Flags [P.], seq 1474:1554, ack 1112, win 504, options [nop,nop,TS val 2660528924 ecr 5932574], length 80
19:42:25.898223 IP 61.177.173.37.62644 > lamp-ubuntu-s-1vcpu-1gb-tor1-01.ssh: Flags [P.], seq 1112:1208, ack 1554, win 262, options [nop,nop,TS val 5932630 ecr 2660528924], length 96
19:42:25.942212 IP lamp-ubuntu-s-1vcpu-1gb-tor1-01.ssh > 61.177.173.37.62644: Flags [.], ack 1208, win 504, options [nop,nop,TS val 2660529185 ecr 5932630], length 0
19:42:26.242220 IP lamp-ubuntu-s-1vcpu-1gb-tor1-01.ssh > 61.177.172.108.55251: Flags [P.], seq 42:1098, ack 872, win 504, options [nop,nop,TS val 2989955391 ecr 8604512], length 1056
19:42:29.154220 IP lamp-ubuntu-s-1vcpu-1gb-tor1-01.ssh > 61.177.172.108.55251: Flags [P.], seq 42:1098, ack 872, win 504, options [nop,nop,TS val 2989958303 ecr 8604512], length 1056
19:42:29.991398 IP lamp-ubuntu-s-1vcpu-1gb-tor1-01.ssh > 61.177.173.37.62644: Flags [P.], seq 1554:1634, ack 1208, win 504, options [nop,nop,TS val 2660533235 ecr 5932630], length 80
19:42:30.498231 IP lamp-ubuntu-s-1vcpu-1gb-tor1-01.ssh > 61.177.173.37.62644: Flags [P.], seq 1554:1634, ack 1208, win 504, options [nop,nop,TS val 2660533742 ecr 5932630], length 80
19:42:31.010244 IP lamp-ubuntu-s-1vcpu-1gb-tor1-01.ssh > 61.177.173.37.62644: Flags [P.], seq 1554:1634, ack 1208, win 504, options [nop,nop,TS val 2660534254 ecr 5932630], length 80
19:42:32.034208 IP lamp-ubuntu-s-1vcpu-1gb-tor1-01.ssh > 61.177.173.37.62644: Flags [P.], seq 1554:1634, ack 1208, win 504, options [nop,nop,TS val 2660535277 ecr 5932630], length 80
19:42:32.994244 IP lamp-ubuntu-s-1vcpu-1gb-tor1-01.ssh > 61.177.172.108.36382: Flags [P.], seq 42:1098, ack 872, win 504, options [nop,nop,TS val 2989962143 ecr 8601526], length 1056
19:42:33.693116 IP 61.177.172.108.14571 > lamp-ubuntu-s-1vcpu-1gb-tor1-01.ssh: Flags [S], seq 913432328, win 29200, options [mss 1460,sackOK,TS val 8607069 ecr 0,nop,wscale 7], length 0
19:42:33.693170 IP lamp-ubuntu-s-1vcpu-1gb-tor1-01.ssh > 61.177.172.108.14571: Flags [S.], seq 4257976480, ack 913432329, win 65160, options [mss 1460,sackOK,TS val 2989962841 ecr 8607069,nop,wscale 7], length 0
19:42:33.917210 IP 61.177.172.108.14571 > lamp-ubuntu-s-1vcpu-1gb-tor1-01.ssh: Flags [.], ack 1, win 229, options [nop,nop,TS val 8607125 ecr 2989962841], length 0
19:42:33.917295 IP 61.177.172.108.14571 > lamp-ubuntu-s-1vcpu-1gb-tor1-01.ssh: Flags [P.], seq 1:16, ack 1, win 229, options [nop,nop,TS val 8607125 ecr 2989962841], length 15
19:42:33.929676 IP lamp-ubuntu-s-1vcpu-1gb-tor1-01.ssh > 61.177.172.108.14571: Flags [P.], seq 1:42, ack 1, win 510, options [nop,nop,TS val 2989963078 ecr 8607125], length 41
19:42:34.050221 IP lamp-ubuntu-s-1vcpu-1gb-tor1-01.ssh > 61.177.173.37.62644: Flags [P.], seq 1554:1634, ack 1208, win 504, options [nop,nop,TS val 2660537294 ecr 5932630], length 80
19:42:34.150026 IP 61.177.172.108.14571 > lamp-ubuntu-s-1vcpu-1gb-tor1-01.ssh: Flags [.], ack 42, win 229, options [nop,nop,TS val 8607183 ecr 2989963078], length 0
19:42:34.274242 IP lamp-ubuntu-s-1vcpu-1gb-tor1-01.ssh > 61.177.173.37.52543: Flags [P.], seq 42:1098, ack 872, win 504, options [nop,nop,TS val 2660537518 ecr 5929402], length 1056
19:42:34.659520 IP 61.177.172.108.14571 > lamp-ubuntu-s-1vcpu-1gb-tor1-01.ssh: Flags [P.], seq 16:872, ack 42, win 229, options [nop,nop,TS val 8607311 ecr 2989963078], length 856
19:42:34.786231 IP lamp-ubuntu-s-1vcpu-1gb-tor1-01.ssh > 61.177.172.108.55251: Flags [P.], seq 42:1098, ack 872, win 504, options [nop,nop,TS val 2989963935 ecr 8604512], length 1056
19:42:35.286621 IP 114.228.129.231.33352 > lamp-ubuntu-s-1vcpu-1gb-tor1-01.telnet: Flags [S], seq 2680884245, win 31052, length 0
19:42:35.403441 IP 61.177.172.108.14571 > lamp-ubuntu-s-1vcpu-1gb-tor1-01.ssh: Flags [P.], seq 1:872, ack 42, win 229, options [nop,nop,TS val 8607497 ecr 2989963078], length 871
19:42:35.403488 IP lamp-ubuntu-s-1vcpu-1gb-tor1-01.ssh > 61.177.172.108.14571: Flags [.], ack 872, win 504, options [nop,nop,TS val 2989964552 ecr 8607497], length 0
19:42:35.405050 IP lamp-ubuntu-s-1vcpu-1gb-tor1-01.ssh > 61.177.172.108.14571: Flags [P.], seq 42:1098, ack 872, win 504, options [nop,nop,TS val 2989964553 ecr 8607497], length 1056
19:42:35.623927 IP 61.177.172.108.14571 > lamp-ubuntu-s-1vcpu-1gb-tor1-01.ssh: Flags [.], ack 1098, win 245, options [nop,nop,TS val 8607552 ecr 2989964553], length 0
19:42:35.624301 IP 61.177.172.108.14571 > lamp-ubuntu-s-1vcpu-1gb-tor1-01.ssh: Flags [P.], seq 872:952, ack 1098, win 245, options [nop,nop,TS val 8607552 ecr 2989964553], length 80
19:42:35.624322 IP lamp-ubuntu-s-1vcpu-1gb-tor1-01.ssh > 61.177.172.108.14571: Flags [.], ack 952, win 504, options [nop,nop,TS val 2989964773 ecr 8607552], length 0
19:42:35.625549 IP lamp-ubuntu-s-1vcpu-1gb-tor1-01.ssh > 61.177.172.108.14571: Flags [P.], seq 1098:1410, ack 952, win 504, options [nop,nop,TS val 2989964774 ecr 8607552], length 312
19:42:35.847655 IP 61.177.172.108.14571 > lamp-ubuntu-s-1vcpu-1gb-tor1-01.ssh: Flags [P.], seq 952:968, ack 1410, win 262, options [nop,nop,TS val 8607608 ecr 2989964774], length 16
19:42:35.847715 IP lamp-ubuntu-s-1vcpu-1gb-tor1-01.ssh > 61.177.172.108.14571: Flags [.], ack 968, win 504, options [nop,nop,TS val 2989964996 ecr 8607608], length 0
19:42:36.078411 IP 61.177.172.108.14571 > lamp-ubuntu-s-1vcpu-1gb-tor1-01.ssh: Flags [P.], seq 968:1032, ack 1410, win 262, options [nop,nop,TS val 8607665 ecr 2989964996], length 64
19:42:36.078447 IP lamp-ubuntu-s-1vcpu-1gb-tor1-01.ssh > 61.177.172.108.14571: Flags [.], ack 1032, win 504, options [nop,nop,TS val 2989965227 ecr 8607665], length 0
19:42:36.078561 IP lamp-ubuntu-s-1vcpu-1gb-tor1-01.ssh > 61.177.172.108.14571: Flags [P.], seq 1410:1474, ack 1032, win 504, options [nop,nop,TS val 2989965227 ecr 8607665], length 64
19:42:36.309307 IP 61.177.172.108.14571 > lamp-ubuntu-s-1vcpu-1gb-tor1-01.ssh: Flags [P.], seq 1032:1112, ack 1474, win 262, options [nop,nop,TS val 8607723 ecr 2989965227], length 80
19:42:36.317590 IP lamp-ubuntu-s-1vcpu-1gb-tor1-01.ssh > 61.177.172.108.14571: Flags [P.], seq 1474:1554, ack 1112, win 504, options [nop,nop,TS val 2989965466 ecr 8607723], length 80
19:42:36.552965 IP 61.177.172.108.14571 > lamp-ubuntu-s-1vcpu-1gb-tor1-01.ssh: Flags [P.], seq 1112:1208, ack 1554, win 262, options [nop,nop,TS val 8607784 ecr 2989965466], length 96
19:42:36.594217 IP lamp-ubuntu-s-1vcpu-1gb-tor1-01.ssh > 61.177.172.108.14571: Flags [.], ack 1208, win 504, options [nop,nop,TS val 2989965742 ecr 8607784], length 0
19:42:38.114229 IP lamp-ubuntu-s-1vcpu-1gb-tor1-01.ssh > 61.177.173.37.62644: Flags [P.], seq 1554:1634, ack 1208, win 504, options [nop,nop,TS val 2660541358 ecr 5932630], length 80
19:42:38.966371 IP zg-1220a-105.stretchoid.com.44829 > lamp-ubuntu-s-1vcpu-1gb-tor1-01.8998: Flags [S], seq 1539860813, win 65535, length 0
19:42:40.646105 IP lamp-ubuntu-s-1vcpu-1gb-tor1-01.ssh > 61.177.172.108.14571: Flags [P.], seq 1554:1634, ack 1208, win 504, options [nop,nop,TS val 2989969794 ecr 8607784], length 80
19:42:40.879522 IP 61.177.172.108.14571 > lamp-ubuntu-s-1vcpu-1gb-tor1-01.ssh: Flags [P.], seq 1208:1304, ack 1634, win 262, options [nop,nop,TS val 8608866 ecr 2989969794], length 96
19:42:40.879579 IP lamp-ubuntu-s-1vcpu-1gb-tor1-01.ssh > 61.177.172.108.14571: Flags [.], ack 1304, win 504, options [nop,nop,TS val 2989970028 ecr 8608866], length 0
19:42:42.926285 IP lamp-ubuntu-s-1vcpu-1gb-tor1-01.ssh > 61.177.172.108.14571: Flags [P.], seq 1634:1714, ack 1304, win 504, options [nop,nop,TS val 2989972075 ecr 8608866], length 80
19:42:43.149001 IP 61.177.172.108.14571 > lamp-ubuntu-s-1vcpu-1gb-tor1-01.ssh: Flags [P.], seq 1304:1400, ack 1714, win 262, options [nop,nop,TS val 8609433 ecr 2989972075], length 96
19:42:43.149049 IP lamp-ubuntu-s-1vcpu-1gb-tor1-01.ssh > 61.177.172.108.14571: Flags [.], ack 1400, win 504, options [nop,nop,TS val 2989972297 ecr 8609433], length 0
19:42:43.813699 IP 212.70.149.50.44100 > lamp-ubuntu-s-1vcpu-1gb-tor1-01.40631: Flags [S], seq 142534179, win 1024, length 0
19:42:46.050227 IP lamp-ubuntu-s-1vcpu-1gb-tor1-01.ssh > 61.177.172.108.55251: Flags [P.], seq 42:1098, ack 872, win 504, options [nop,nop,TS val 2989975199 ecr 8604512], length 1056
19:42:46.306237 IP lamp-ubuntu-s-1vcpu-1gb-tor1-01.ssh > 61.177.173.37.62644: Flags [P.], seq 1554:1634, ack 1208, win 504, options [nop,nop,TS val 2660549550 ecr 5932630], length 80
19:42:47.242182 IP lamp-ubuntu-s-1vcpu-1gb-tor1-01.ssh > 61.177.172.108.14571: Flags [P.], seq 1714:1794, ack 1400, win 504, options [nop,nop,TS val 2989976390 ecr 8609433], length 80
19:42:47.462267 IP 61.177.172.108.14571 > lamp-ubuntu-s-1vcpu-1gb-tor1-01.ssh: Flags [P.], seq 1400:1464, ack 1794, win 262, options [nop,nop,TS val 8610511 ecr 2989976390], length 64
19:42:47.462268 IP 61.177.172.108.14571 > lamp-ubuntu-s-1vcpu-1gb-tor1-01.ssh: Flags [F.], seq 1464, ack 1794, win 262, options [nop,nop,TS val 8610511 ecr 2989976390], length 0
19:42:47.462321 IP lamp-ubuntu-s-1vcpu-1gb-tor1-01.ssh > 61.177.172.108.14571: Flags [.], ack 1464, win 504, options [nop,nop,TS val 2989976611 ecr 8610511], length 0
19:42:47.463646 IP lamp-ubuntu-s-1vcpu-1gb-tor1-01.ssh > 61.177.172.108.14571: Flags [F.], seq 1794, ack 1465, win 504, options [nop,nop,TS val 2989976612 ecr 8610511], length 0
19:42:47.466554 IP 61.177.172.108.44822 > lamp-ubuntu-s-1vcpu-1gb-tor1-01.ssh: Flags [S], seq 44919580, win 29200, options [mss 1460,sackOK,TS val 8610511 ecr 0,nop,wscale 7], length 0
19:42:47.466608 IP lamp-ubuntu-s-1vcpu-1gb-tor1-01.ssh > 61.177.172.108.44822: Flags [S.], seq 1984560486, ack 44919581, win 65160, options [mss 1460,sackOK,TS val 2989976615 ecr 8610511,nop,wscale 7], length 0
19:42:47.511322 IP 80.66.83.55.51852 > lamp-ubuntu-s-1vcpu-1gb-tor1-01.50443: Flags [S], seq 2522741121, win 1024, length 0
19:42:47.683217 IP 61.177.172.108.14571 > lamp-ubuntu-s-1vcpu-1gb-tor1-01.ssh: Flags [.], ack 1795, win 262, options [nop,nop,TS val 8610566 ecr 2989976612], length 0
19:42:47.695200 IP 61.177.172.108.44822 > lamp-ubuntu-s-1vcpu-1gb-tor1-01.ssh: Flags [.], ack 1, win 229, options [nop,nop,TS val 8610567 ecr 2989976615], length 0
19:42:47.695201 IP 61.177.172.108.44822 > lamp-ubuntu-s-1vcpu-1gb-tor1-01.ssh: Flags [P.], seq 1:16, ack 1, win 229, options [nop,nop,TS val 8610567 ecr 2989976615], length 15
19:42:47.706410 IP lamp-ubuntu-s-1vcpu-1gb-tor1-01.ssh > 61.177.172.108.44822: Flags [P.], seq 1:42, ack 1, win 510, options [nop,nop,TS val 2989976855 ecr 8610567], length 41
19:42:47.929634 IP 61.177.172.108.44822 > lamp-ubuntu-s-1vcpu-1gb-tor1-01.ssh: Flags [.], ack 42, win 229, options [nop,nop,TS val 8610627 ecr 2989976855], length 0
19:42:48.419945 IP 61.177.172.108.44822 > lamp-ubuntu-s-1vcpu-1gb-tor1-01.ssh: Flags [P.], seq 16:872, ack 42, win 229, options [nop,nop,TS val 8610750 ecr 2989976855], length 856
19:42:49.151905 IP 61.177.172.108.44822 > lamp-ubuntu-s-1vcpu-1gb-tor1-01.ssh: Flags [P.], seq 1:872, ack 42, win 229, options [nop,nop,TS val 8610933 ecr 2989976855], length 871
19:42:49.151953 IP lamp-ubuntu-s-1vcpu-1gb-tor1-01.ssh > 61.177.172.108.44822: Flags [.], ack 872, win 504, options [nop,nop,TS val 2989978300 ecr 8610933], length 0
19:42:49.153334 IP lamp-ubuntu-s-1vcpu-1gb-tor1-01.ssh > 61.177.172.108.44822: Flags [P.], seq 42:1098, ack 872, win 504, options [nop,nop,TS val 2989978302 ecr 8610933], length 1056
19:42:49.826223 IP lamp-ubuntu-s-1vcpu-1gb-tor1-01.ssh > 61.177.172.108.44822: Flags [P.], seq 42:1098, ack 872, win 504, options [nop,nop,TS val 2989978975 ecr 8610933], length 1056
19:42:50.530236 IP lamp-ubuntu-s-1vcpu-1gb-tor1-01.ssh > 61.177.172.108.44822: Flags [P.], seq 42:1098, ack 872, win 504, options [nop,nop,TS val 2989979679 ecr 8610933], length 1056
19:42:51.938240 IP lamp-ubuntu-s-1vcpu-1gb-tor1-01.ssh > 61.177.172.108.44822: Flags [P.], seq 42:1098, ack 872, win 504, options [nop,nop,TS val 2989981087 ecr 8610933], length 1056
^C19:42:53.701315 IP 39.108.163.24.36242 > lamp-ubuntu-s-1vcpu-1gb-tor1-01.6379: Flags [S], seq 583719027, win 29200, options [mss 1460,sackOK,TS val 2659203701 ecr 0,nop,wscale 7], length 0