.7U.=.)...6.7k......1tx'..........M.;...*zO
19:38:00.845209 IP lamp-ubuntu-s-1vcpu-1gb-tor1-01.ssh > 198.96.87.75.51219: Flags [P.], seq 1088276:1088528, ack 397, win 501, length 252
E..$.v@.@........`WK...........MP.......n.t..K2U..X..[z..c..I......;T.....".    j.>.}.oQ..............!.%....L..4../.o.{<..c...N...."-e..?<..IW.(..~..q.[..&..../.cD....}.....!^.......Z3...@
...2,...x.A.N.'f.!...k...[.L..  ...-.%....@t..ud.G...i..h.P..2.rG...x.x..eS.....2..D...A..B.......`~......
19:38:00.845336 IP lamp-ubuntu-s-1vcpu-1gb-tor1-01.ssh > 198.96.87.75.51219: Flags [P.], seq 1088528:1088924, ack 397, win 501, length 396
E....w@.@..0.....`WK...........MP....2...L."r...Zw.........Uy.....S.yo...JN?..l{a.."A:...ae..0..S!..X....k........}).R...2:...^.j.../ a..v%C%...c>..E...M..4.bz].. .}..E.....+f4..`T...O..F.T.XF..]...&.....8m6E9...e.W..>..^...L...;.....~.g.c...o.x$!M.d......U..tJ..(M.u.B.......b.1.pi....#xZ...Y...W.....6=.V.D..y......4|.c.v....**...Sxp..:h2.Y%uZ.J.K..=eH.uwqN.L..?.1~.5....5.F+9....eT.qy$.Q.e......u.A...S.+'.q.zK.....P*.._l.81H.....`..
19:38:00.845379 IP lamp-ubuntu-s-1vcpu-1gb-tor1-01.ssh > 198.96.87.75.51219: Flags [P.], seq 1088924:1088960, ack 397, win 501, length 36
E..L.x@.@........`WK...........MP....................N..^o.E..5....5......`W
19:38:00.845463 IP lamp-ubuntu-s-1vcpu-1gb-tor1-01.ssh > 198.96.87.75.51219: Flags [P.], seq 1089132:1089312, ack 397, win 501, length 180
E....z@.@........`WK.......n...MP....Z......<.'.....(....x..,..\*GTU=...!..g..8.%O...6K...;.n..4..\E...=.......A..?..`...Ou.f:d=W[v\.C90...........Wp...v..s%.....*.y..%....tP0..(.7'...`.... ..8..T%upI.U.H.....n2.....2.U.
19:38:00.845625 IP lamp-ubuntu-s-1vcpu-1gb-tor1-01.ssh > 198.96.87.75.51219: Flags [P.], seq 1089564:1089936, ack 397, win 501, length 372
E....|@.@..C.....`WK...........MP..........4e.........?.8.5)...F...a"
3......Jt..Y?..e.C.H.N.(TV...f/.aM ....cc.].8.'g|3.A......%w.Q3..u...%.......Y...........G.......".....G%...#1.....w.\..i....M..d..U..xE....}.2.7Tt#-...C.9......'(....B.}.<.O....]|..n.A.Hx...0..........;y_.A......T..y.....Y,G/....x....sQ`.`....3.x..I.~.
....M......`    *...5.../.&...j
..-..Q.......y7}l...i....|~...'.....N...!.h..#..h`Lho.1M. }
19:38:00.845731 IP lamp-ubuntu-s-1vcpu-1gb-tor1-01.ssh > 198.96.87.75.51219: Flags [P.], seq 1089936:1090540, ack 397, win 501, length 604
E....}@.@..Z.....`WK...........MP.......E|Re....*....*C.u....,M.g...'6.'.M....m.{..j.4fJ.[.. i...T...4.K..j..\..C.FQ.U....Q...'..>P.....G.....9.W-.....6"s..(...
.x..az}I.l.cY.........u.8..."Vx..\....]..[..    p...IG|....X.?.W..iX.>....&~.......&.r....-..(&4w.IE....Pq.g...0......3....P...}....o)
]       ...q.....<      .?.E..1!.V.C=   .........C.+.@...Ut.<.9......Y....R.    .N.;...^iz.L.L..C".Z........,.Q.c......k..im.P....FeG/9....1..-o.Y.hfJ.R)...u.S.....}.<.IN...45Q..S...<.O...!.G.W....z.Y.Gf...........u.hY..}U../.z.....<.I.............]k.....M@.i_....0..~..p..H....|...hj.:..1Q..........1....k+...%f.[.  .{..f..C.\.l....?...8$.eT.A....l...(..(..5,.$..W...
19:38:00.845812 IP lamp-ubuntu-s-1vcpu-1gb-tor1-01.ssh > 198.96.87.75.51219: Flags [P.], seq 1090540:1090792, ack 397, win 501, length 252
E..$.~@.@........`WK...........MP........f/..".]Y0k....0#E....,...........(..r.. .+_....$MQ&%../..?.OD.....L..)@c..!./....!...,
...@.......wQ..0.j'v..A..*....E...[+........~...N...O...)c..>.*.a.....EH.G.....F<3.A.Rc vA........      ...
..[.......s...s.Wl..Y..+..M.Dw .aR.4..f4;|'yK......~..MR....
19:38:00.848807 IP 198.96.87.75.51219 > lamp-ubuntu-s-1vcpu-1gb-tor1-01.ssh: Flags [.], ack 1067856, win 90, length 0
E..(o.@.w..a.`WK...........M...RP..Z9.........
19:38:00.848807 IP 198.96.87.75.51219 > lamp-ubuntu-s-1vcpu-1gb-tor1-01.ssh: Flags [.], ack 1079372, win 45, length 0
E..(o.@.w..`.`WK...........M...NP..-..........
19:38:00.848807 IP 198.96.87.75.51219 > lamp-ubuntu-s-1vcpu-1gb-tor1-01.ssh: Flags [.], ack 1080016, win 43, length 0
E..(o.@.w.._.`WK...........M....P..+
<........
19:38:00.851070 IP 198.96.87.75.51219 > lamp-ubuntu-s-1vcpu-1gb-tor1-01.ssh: Flags [.], ack 1087412, win 14, length 0
E..(o.@.w..^.`WK...........M....P....t........
19:38:00.851070 IP 198.96.87.75.51219 > lamp-ubuntu-s-1vcpu-1gb-tor1-01.ssh: Flags [.], ack 1089564, win 5, length 0
E..(o.@.w..].`WK...........M....P.............
19:38:00.851122 IP 198.96.87.75.51219 > lamp-ubuntu-s-1vcpu-1gb-tor1-01.ssh: Flags [.], ack 1090792, win 0, length 0
E..(o.@.w..\.`WK...........M....P....N........
19:38:00.948694 IP 198.96.87.75.51219 > lamp-ubuntu-s-1vcpu-1gb-tor1-01.ssh: Flags [P.], seq 397:433, ack 1090792, win 0, length 36
E..Lo.@.w..7.`WK...........M....P...<...)..suGx. E..dop...j.o2.h.y..\. .t.b.
19:38:00.948876 IP lamp-ubuntu-s-1vcpu-1gb-tor1-01.ssh > 198.96.87.75.51219: Flags [.], ack 433, win 501, length 0
E..(..@.@........`WK...........qP.......
19:38:01.007312 IP 198.96.87.75.51219 > lamp-ubuntu-s-1vcpu-1gb-tor1-01.ssh: Flags [P.], seq 433:505, ack 1090792, win 0, length 72^CE..po.@.w....`WK...........q....P...E=...w......=n.8CkF.......[...P.\.Fv.......v6$D..}.....(o2.}....78V..%...7..

1202 packets captured
3676 packets received by filter
2473 packets dropped by kernel