19:48:56.938861 IP lamp-ubuntu-s-1vcpu-1gb-tor1-01.ssh > 198.96.87.75.51219: Flags [P.], seq 958280:958452, ack 361, win 501, length 172
19:48:56.938994 IP lamp-ubuntu-s-1vcpu-1gb-tor1-01.ssh > 198.96.87.75.51219: Flags [P.], seq 958452:958624, ack 361, win 501, length 172
19:48:56.939049 IP lamp-ubuntu-s-1vcpu-1gb-tor1-01.ssh > 198.96.87.75.51219: Flags [P.], seq 958624:958796, ack 361, win 501, length 172
19:48:56.939094 IP lamp-ubuntu-s-1vcpu-1gb-tor1-01.ssh > 198.96.87.75.51219: Flags [P.], seq 958796:958968, ack 361, win 501, length 172
19:48:56.939170 IP lamp-ubuntu-s-1vcpu-1gb-tor1-01.ssh > 198.96.87.75.51219: Flags [P.], seq 958968:959140, ack 361, win 501, length 172
19:48:56.939226 IP lamp-ubuntu-s-1vcpu-1gb-tor1-01.ssh > 198.96.87.75.51219: Flags [P.], seq 959140:959312, ack 361, win 501, length 172
19:48:56.939278 IP lamp-ubuntu-s-1vcpu-1gb-tor1-01.ssh > 198.96.87.75.51219: Flags [P.], seq 959312:959484, ack 361, win 501, length 172
19:48:56.939323 IP lamp-ubuntu-s-1vcpu-1gb-tor1-01.ssh > 198.96.87.75.51219: Flags [P.], seq 959484:959656, ack 361, win 501, length 172
19:48:56.939367 IP lamp-ubuntu-s-1vcpu-1gb-tor1-01.ssh > 198.96.87.75.51219: Flags [P.], seq 959656:959828, ack 361, win 501, length 172
19:48:56.939412 IP lamp-ubuntu-s-1vcpu-1gb-tor1-01.ssh > 198.96.87.75.51219: Flags [P.], seq 959828:960000, ack 361, win 501, length 172
19:48:56.939457 IP lamp-ubuntu-s-1vcpu-1gb-tor1-01.ssh > 198.96.87.75.51219: Flags [P.], seq 960000:960172, ack 361, win 501, length 172
19:48:56.939505 IP lamp-ubuntu-s-1vcpu-1gb-tor1-01.ssh > 198.96.87.75.51219: Flags [P.], seq 960172:960344, ack 361, win 501, length 172
19:48:56.939568 IP lamp-ubuntu-s-1vcpu-1gb-tor1-01.ssh > 198.96.87.75.51219: Flags [P.], seq 960344:960516, ack 361, win 501, length 172
19:48:56.939728 IP lamp-ubuntu-s-1vcpu-1gb-tor1-01.ssh > 198.96.87.75.51219: Flags [P.], seq 960516:960688, ack 361, win 501, length 172
19:48:56.939808 IP lamp-ubuntu-s-1vcpu-1gb-tor1-01.ssh > 198.96.87.75.51219: Flags [P.], seq 960688:960860, ack 361, win 501, length 172
19:48:56.939870 IP lamp-ubuntu-s-1vcpu-1gb-tor1-01.ssh > 198.96.87.75.51219: Flags [P.], seq 960860:961032, ack 361, win 501, length 172
19:48:56.939928 IP lamp-ubuntu-s-1vcpu-1gb-tor1-01.ssh > 198.96.87.75.51219: Flags [P.], seq 961032:961204, ack 361, win 501, length 172
19:48:56.939991 IP lamp-ubuntu-s-1vcpu-1gb-tor1-01.ssh > 198.96.87.75.51219: Flags [P.], seq 961204:961376, ack 361, win 501, length 172
19:48:56.940044 IP lamp-ubuntu-s-1vcpu-1gb-tor1-01.ssh > 198.96.87.75.51219: Flags [P.], seq 961376:961548, ack 361, win 501, length 172
19:48:56.940096 IP 198.96.87.75.51219 > lamp-ubuntu-s-1vcpu-1gb-tor1-01.ssh: Flags [.], ack 949216, win 62, length 0
19:48:56.940167 IP lamp-ubuntu-s-1vcpu-1gb-tor1-01.ssh > 198.96.87.75.51219: Flags [P.], seq 961548:961720, ack 361, win 501, length 172
19:48:56.940216 IP lamp-ubuntu-s-1vcpu-1gb-tor1-01.ssh > 198.96.87.75.51219: Flags [P.], seq 961720:961876, ack 361, win 501, length 156
19:48:56.940263 IP lamp-ubuntu-s-1vcpu-1gb-tor1-01.ssh > 198.96.87.75.51219: Flags [P.], seq 961876:962192, ack 361, win 501, length 316
19:48:56.940310 IP lamp-ubuntu-s-1vcpu-1gb-tor1-01.ssh > 198.96.87.75.51219: Flags [P.], seq 962192:962364, ack 361, win 501, length 172
19:48:56.940357 IP lamp-ubuntu-s-1vcpu-1gb-tor1-01.ssh > 198.96.87.75.51219: Flags [P.], seq 962364:962536, ack 361, win 501, length 172
19:48:56.940402 IP lamp-ubuntu-s-1vcpu-1gb-tor1-01.ssh > 198.96.87.75.51219: Flags [P.], seq 962536:962708, ack 361, win 501, length 172
19:48:56.940443 IP lamp-ubuntu-s-1vcpu-1gb-tor1-01.ssh > 198.96.87.75.51219: Flags [P.], seq 962708:962880, ack 361, win 501, length 172
19:48:56.940485 IP lamp-ubuntu-s-1vcpu-1gb-tor1-01.ssh > 198.96.87.75.51219: Flags [P.], seq 962880:963052, ack 361, win 501, length 172
19:48:56.940527 IP lamp-ubuntu-s-1vcpu-1gb-tor1-01.ssh > 198.96.87.75.51219: Flags [P.], seq 963052:963224, ack 361, win 501, length 172
19:48:56.940570 IP lamp-ubuntu-s-1vcpu-1gb-tor1-01.ssh > 198.96.87.75.51219: Flags [P.], seq 963224:963396, ack 361, win 501, length 172
19:48:56.940682 IP lamp-ubuntu-s-1vcpu-1gb-tor1-01.ssh > 198.96.87.75.51219: Flags [P.], seq 963396:963568, ack 361, win 501, length 172
19:48:56.940730 IP lamp-ubuntu-s-1vcpu-1gb-tor1-01.ssh > 198.96.87.75.51219: Flags [P.], seq 963568:963740, ack 361, win 501, length 172
19:48:56.940772 IP lamp-ubuntu-s-1vcpu-1gb-tor1-01.ssh > 198.96.87.75.51219: Flags [P.], seq 963740:963912, ack 361, win 501, length 172
19:48:56.940815 IP lamp-ubuntu-s-1vcpu-1gb-tor1-01.ssh > 198.96.87.75.51219: Flags [P.], seq 963912:964084, ack 361, win 501, length 172
19:48:56.940892 IP lamp-ubuntu-s-1vcpu-1gb-tor1-01.ssh > 198.96.87.75.51219: Flags [P.], seq 964084:964256, ack 361, win 501, length 172
19:48:56.940981 IP lamp-ubuntu-s-1vcpu-1gb-tor1-01.ssh > 198.96.87.75.51219: Flags [P.], seq 964256:964428, ack 361, win 501, length 172
19:48:56.941042 IP lamp-ubuntu-s-1vcpu-1gb-tor1-01.ssh > 198.96.87.75.51219: Flags [P.], seq 964428:964600, ack 361, win 501, length 172
19:48:56.941098 IP lamp-ubuntu-s-1vcpu-1gb-tor1-01.ssh > 198.96.87.75.51219: Flags [P.], seq 964600:964772, ack 361, win 501, length 172
19:48:56.941155 IP lamp-ubuntu-s-1vcpu-1gb-tor1-01.ssh > 198.96.87.75.51219: Flags [P.], seq 964772:964944, ack 361, win 501, length 172
19:48:56.943846 IP 198.96.87.75.51219 > lamp-ubuntu-s-1vcpu-1gb-tor1-01.ssh: Flags [.], ack 962536, win 10, length 0
19:48:56.946655 IP 198.96.87.75.51219 > lamp-ubuntu-s-1vcpu-1gb-tor1-01.ssh: Flags [.], ack 964944, win 0, length 0
19:48:56.990443 IP 198.96.87.75.51219 > lamp-ubuntu-s-1vcpu-1gb-tor1-01.ssh: Flags [P.], seq 361:397, ack 964944, win 0, length 36
19:48:56.990626 IP lamp-ubuntu-s-1vcpu-1gb-tor1-01.ssh > 198.96.87.75.51219: Flags [.], ack 397, win 501, length 0
19:48:56.997438 IP 198.96.87.75.51219 > lamp-ubuntu-s-1vcpu-1gb-tor1-01.ssh: Flags [P.], seq 397:433, ack 964944, win 0, length 36
^C
5633 packets captured
5644 packets received by filter
10 packets dropped by kernel